"DESCRIPTION","DURATION IN MS","NAME","PARENT SUITE","START TIME","STATUS","STOP TIME","SUB SUITE","SUITE","TEST CLASS","TEST METHOD"
"Checks if 'Contact us' link is visible on each page in DATA_1","0","TC 02.01.24 - Check display of 'Contact us' link on each page specified in DATA_1","tests","Mon Jan 06 01:45:05 GMT 2025","skipped","Mon Jan 06 01:45:05 GMT 2025","TestFooter","test_footer","",""
"Verify that text-2 in 'Luma shorts' block correctly displayed","0","TC 14.06.24 Verify that the 'Cool it now' text is visible.","tests","Mon Jan 06 01:59:15 GMT 2025","skipped","Mon Jan 06 01:59:15 GMT 2025","TestMenPagePromoBlock","test_men","",""
"Check that the 'Proceed to checkout' button is displayed and clickable.","0","tc 07.02.07 Verify that 'Proceed to checkout' button is displayed and clickable","tests","Mon Jan 06 02:02:59 GMT 2025","passed","Mon Jan 06 02:02:59 GMT 2025","TestShoppingCartFull","test_shopping_cart","",""
"Check that link in section 2 block 5 'home-eco' is correct","6382","TC 13.02.06 - Check the link in section 2 block 5 'home-eco' in the Promo Block leads to the correct page","tests","Mon Jan 06 01:58:17 GMT 2025","broken","Mon Jan 06 01:58:23 GMT 2025","TestMainPage","test_main_page","",""
" Verify that First name input field highlighted when label is clicked","683","TC 04_01_04 Verify First name input field highlighting on label click","tests","Mon Jan 06 01:42:25 GMT 2025","passed","Mon Jan 06 01:42:26 GMT 2025","TestCreateAnAccount","test_create_an_account","",""
"Check that Advanced Search link in footer is correct","1727","TC 02.02.03 - Check Advanced Search link in footer leads to the correct page from each page specified in DATA_1","tests","Mon Jan 06 01:45:32 GMT 2025","passed","Mon Jan 06 01:45:33 GMT 2025","TestFooter","test_footer","",""
"Verify that the link 'Tees' correctly opens and redirects to a new webpage, the header 'Tees' is
        displayed","1588","TC 14.03.07 Verify the link 'Tees' redirects to a correct page.","tests","Mon Jan 06 01:58:52 GMT 2025","passed","Mon Jan 06 01:58:54 GMT 2025","TestMenPage","test_men","",""
"Check that six elements in Women's Deals section are displayed and enabled","26","TC 10.01.02, 10.01.04, 10.01.06, 10.01.08, 10.01.10, 10.01.12 - Verify 6 links in Women's Deals section are visible and clickable","tests","Mon Jan 06 02:00:36 GMT 2025","passed","Mon Jan 06 02:00:36 GMT 2025","TestSalePage","test_sale","",""
"Checks if Orders and Returns link is present in the DOM tree on each page specified in DATA_1","1055","TC 02.01.18 - Check Orders and Returns link is present in the DOM tree on each page specified in DATA_1","tests","Mon Jan 06 01:44:50 GMT 2025","passed","Mon Jan 06 01:44:51 GMT 2025","TestFooter","test_footer","",""
"Checks if Copyright text is present in the DOM tree on each page specified in DATA_1","1110","TC 02.01.35 - Check Copyright text is present in the DOM tree on each page specified in DATA_1","tests","Mon Jan 06 01:45:16 GMT 2025","passed","Mon Jan 06 01:45:17 GMT 2025","TestFooter","test_footer","",""
"Checks if text on Subscribe Button is visible on each page in DATA_1","0","TC 02.01.45 - Check display of text on Subscribe Button on each page specified in DATA_1","tests","Mon Jan 06 01:45:24 GMT 2025","skipped","Mon Jan 06 01:45:24 GMT 2025","TestFooter","test_footer","",""
"Check error message for incorrect email format in email field","210","TC 03.01.18 Verify Email field for correct email format","tests","Mon Jan 06 02:05:44 GMT 2025","passed","Mon Jan 06 02:05:44 GMT 2025","TestRegisteredCustomers","test_sign_in","",""
"Check that 'Subscribe to our mailing list' link in footer is correct","0","TC 02.02.07 - Check 'Subscribe to our mailing list' link in footer leads to the correct page from each page specified in DATA_1","tests","Mon Jan 06 01:45:42 GMT 2025","skipped","Mon Jan 06 01:45:42 GMT 2025","TestFooter","test_footer","",""
"Checks if Subscribe Email Field is visible on each page in DATA_1","0","TC 02.01.48 - Check display of Subscribe Email Field on each page specified in DATA_1","tests","Mon Jan 06 01:45:24 GMT 2025","skipped","Mon Jan 06 01:45:24 GMT 2025","TestFooter","test_footer","",""
"Checks if text of 'Contact us' link is correct on each page in DATA_1","0","TC 02.01.27 - Check text of 'Contact us' link on each page specified in DATA_1","tests","Mon Jan 06 01:45:05 GMT 2025","skipped","Mon Jan 06 01:45:05 GMT 2025","TestFooter","test_footer","",""
"Check 'Hoodies & Sweatshirts' subsection link click in 'Men' section redirects to the         Hoodies & Sweatshirts-men page and the 'Hoodies & Sweatshirts' header is displayed","3080","TC 01.03.20 correctness of the ""Hoodies & Sweatshirts"" link of the ""Men"" section","tests","Mon Jan 06 01:49:10 GMT 2025","passed","Mon Jan 06 01:49:13 GMT 2025","TestHeader","test_header","",""
"Check Login Page Heading is present ","79","TC 03.01.01 Verify Sign In Page h1 Header","tests","Mon Jan 06 02:05:01 GMT 2025","passed","Mon Jan 06 02:05:01 GMT 2025","TestRegisteredCustomers","test_sign_in","",""
"Check 'Sign In' link is displayed and underlined","1512","TC 01.01.04 display and interactivity of the ""Sign In"" link","tests","Mon Jan 06 01:46:33 GMT 2025","passed","Mon Jan 06 01:46:35 GMT 2025","TestHeader","test_header","",""
"Check if the displayed email matches the entered email in Email field","217","TC 17.01.07 Verify displayed email matches the entered email in FYP Email field","tests","Mon Jan 06 01:46:00 GMT 2025","passed","Mon Jan 06 01:46:01 GMT 2025","TestForgotYourPassword","test_forgot_your_password","",""
"
        The user is NOT logged in, located in the product card, section ""Reviews""
        1. All required fields are filled with correct data
        2. Pressed 1 star
        3.The ""Submit Review"" button is pressed
        Result: Present in the DOM and visible on the page the message: ""You submitted your review for moderation.""
        This code works when run on Win, Mac, Ubuntu on a real laptop and has the features of working on GitHub Action.
        When interacting with the GitHub Action, it checks not for the text of the ""Success"" message, but for the ""Success"" URL""
        ","6056","TC 01_15_01 Verify possibility to vote with 1 star","tests","Mon Jan 06 01:59:28 GMT 2025","passed","Mon Jan 06 01:59:34 GMT 2025","TestReviews","test_reviews_page","",""
"Checks if 'Contact us' link is present in the DOM tree on each page specified in DATA_1","0","TC 02.01.23 - Check 'Contact us' link is present in the DOM tree on each page specified in DATA_1","tests","Mon Jan 06 01:45:05 GMT 2025","skipped","Mon Jan 06 01:45:05 GMT 2025","TestFooter","test_footer","",""
"This test checks if Orders and Returns link is clickable on each page specified in DATA_1","1160","TC 02.01.20 - Check if Orders and Returns link is clickable on each page specified in DATA_1","tests","Mon Jan 06 01:44:57 GMT 2025","passed","Mon Jan 06 01:44:58 GMT 2025","TestFooter","test_footer","",""
"Verify that text-3 in 'Luma hoodies' block correctly displayed","0","TC 14.06.37 Verify that the 'Shop Hoodies' text is visible.","tests","Mon Jan 06 01:59:15 GMT 2025","skipped","Mon Jan 06 01:59:15 GMT 2025","TestMenPagePromoBlock","test_men","",""
"Checks if text of Copyright section is correct on each page in DATA_1","0","TC 02.01.37 - Check text of Copyright section on each page specified in DATA_1","tests","Mon Jan 06 01:45:24 GMT 2025","skipped","Mon Jan 06 01:45:24 GMT 2025","TestFooter","test_footer","",""
"Check that six elements in Women's Deals section are displayed and enabled","27","TC 10.01.02, 10.01.04, 10.01.06, 10.01.08, 10.01.10, 10.01.12 - Verify 6 links in Women's Deals section are visible and clickable","tests","Mon Jan 06 02:00:34 GMT 2025","passed","Mon Jan 06 02:00:34 GMT 2025","TestSalePage","test_sale","",""
"Checks if Privacy and Cookie Policy link is present in the DOM tree on each page specified in DATA_1","997","TC 02.01.08 - Check Privacy and Cookie Policy link is present in the DOM tree on each page specified in DATA_1","tests","Mon Jan 06 01:44:03 GMT 2025","passed","Mon Jan 06 01:44:04 GMT 2025","TestFooter","test_footer","",""
"Check 'Pants' subsection link click in 'Women' section redirects to the Pants page and         the 'Pants' header is displayed","4168","TC 01.03.13 correctness of the ""Pants"" link of the ""Women"" section","tests","Mon Jan 06 01:50:40 GMT 2025","passed","Mon Jan 06 01:50:44 GMT 2025","TestHeader","test_header","",""
"This test checks if an image in section 1 'home-main' is visible","1223","TC 13.01.03 - Check the display of an image in section 1 'home-main' in the Promo Block","tests","Mon Jan 06 01:52:35 GMT 2025","passed","Mon Jan 06 01:52:36 GMT 2025","TestMainPage","test_main_page","",""
"Checks if the footer is present in the DOM tree on each page specified in DATA_1","0","TC 02.01.01 - Check Footer is present in the DOM tree on each page specified in DATA_1","tests","Mon Jan 06 01:43:37 GMT 2025","skipped","Mon Jan 06 01:43:37 GMT 2025","TestFooter","test_footer","",""
"Check that five elements in Men's Deals section are displayed and enabled","46","TC 10.02.02, 10.02.04, 10.02.06, 10.02.08, 10.02.10 - Verify 5 links in Men's Deals section are visible and clickable","tests","Mon Jan 06 02:01:08 GMT 2025","passed","Mon Jan 06 02:01:08 GMT 2025","TestSalePage","test_sale","",""
"Check that five elements in Men's Deals section are displayed and enabled","47","TC 10.02.02, 10.02.04, 10.02.06, 10.02.08, 10.02.10 - Verify 5 links in Men's Deals section are visible and clickable","tests","Mon Jan 06 02:01:14 GMT 2025","passed","Mon Jan 06 02:01:14 GMT 2025","TestSalePage","test_sale","",""
"Check that quantity field is displayed and clickable.","1217","tc 07.02.03 Verify that quantity field is displayed and clickable","tests","Mon Jan 06 02:02:41 GMT 2025","passed","Mon Jan 06 02:02:42 GMT 2025","TestShoppingCartFull","test_shopping_cart","",""
"Check if the captcha input is of correct format (input-text) and clickable","0","TC 17.01.10 Verify FYP captcha input field is correct format and clickable","tests","Mon Jan 06 01:46:03 GMT 2025","skipped","Mon Jan 06 01:46:03 GMT 2025","TestForgotYourPassword","test_forgot_your_password","",""
"Check img existence of Men's Deals section","55","TC 10.04.04 - Verify that the Men's Deals contains an image","tests","Mon Jan 06 02:01:47 GMT 2025","passed","Mon Jan 06 02:01:47 GMT 2025","TestSalePage","test_sale","",""
"Check title-text and content-text in 2 columns block - Gear Deals","93","TC 10.04.08 - Verify the text in 2 columns block - Gear Deals","tests","Mon Jan 06 02:01:56 GMT 2025","passed","Mon Jan 06 02:01:56 GMT 2025","TestSalePage","test_sale","",""
"Check the 'Create an account' link is not displayed if the user is authorized","8366","TC 01.01.06 absence of the ""Create an account"" link display","tests","Mon Jan 06 01:48:21 GMT 2025","broken","Mon Jan 06 01:48:29 GMT 2025","TestHeader","test_header","",""
"Verify that the link 'Tops' correctly opens and redirects to a new webpage, the header 'Tops' is
              displayed","1624","TC 14.02.03 Verify the link Tops redirects to a correct page.","tests","Mon Jan 06 01:58:27 GMT 2025","passed","Mon Jan 06 01:58:29 GMT 2025","TestMenPage","test_men","",""
"This test checks if info block in section 2 block 2 'home-t-shirts' is displayed
            in the Promo Block under header on the main page","6284","TC 13.01.22 - Check the display of the info block in block 2 't-shirts' in the Promo Block","tests","Mon Jan 06 01:54:33 GMT 2025","broken","Mon Jan 06 01:54:39 GMT 2025","TestMainPage","test_main_page","",""
"Checks if Copyright text is visible on each page in DATA_1","901","TC 02.01.36 - Check display of Copyright text on each page specified in DATA_1","tests","Mon Jan 06 01:45:23 GMT 2025","passed","Mon Jan 06 01:45:24 GMT 2025","TestFooter","test_footer","",""
"Verify the message 'You have no items in your wish list.' is visible","810","TC 18.01.04 message no items to compare is displayed","tests","Mon Jan 06 02:07:35 GMT 2025","passed","Mon Jan 06 02:07:36 GMT 2025","TestTrainingVideoDownload","test_training_video_download","",""
"Check 'Tees' subsection link click in 'Men' section redirects to the Tees-men page and         the 'Tees' header is displayed","3142","TC 01.03.21 correctness of the ""Tees"" link of the ""Men"" section","tests","Mon Jan 06 01:49:14 GMT 2025","passed","Mon Jan 06 01:49:17 GMT 2025","TestHeader","test_header","",""
"Checks if text of 'Contact us' link is correct on each page in DATA_1","0","TC 02.01.27 - Check text of 'Contact us' link on each page specified in DATA_1","tests","Mon Jan 06 01:45:05 GMT 2025","skipped","Mon Jan 06 01:45:05 GMT 2025","TestFooter","test_footer","",""
"This test checks if info block in section 2 block 5 'home-eco' is displayed
            in the Promo Block under header on the Main Page","6297","TC 13.01.37 - Check the display of the info block in block 5 'home-eco' in the Promo Block","tests","Mon Jan 06 01:55:46 GMT 2025","broken","Mon Jan 06 01:55:53 GMT 2025","TestMainPage","test_main_page","",""
"This test checks if the image in section 2 block 3 'home-erin' is visible","1121","TC 13.01.26 - Check the display of an image in block 3 'home-erin' in the Promo Block","tests","Mon Jan 06 01:54:49 GMT 2025","broken","Mon Jan 06 01:54:50 GMT 2025","TestMainPage","test_main_page","",""
"Verify title 'Video Download' is visible","957","TC 18.02.01 title ""Video Download"" is visible","tests","Mon Jan 06 02:07:37 GMT 2025","passed","Mon Jan 06 02:07:38 GMT 2025","TestTrainingVideoDownload","test_training_video_download","",""
"Check that six elements in Women's Deals section are displayed and enabled","28","TC 10.01.02, 10.01.04, 10.01.06, 10.01.08, 10.01.10, 10.01.12 - Verify 6 links in Women's Deals section are visible and clickable","tests","Mon Jan 06 02:00:38 GMT 2025","passed","Mon Jan 06 02:00:39 GMT 2025","TestSalePage","test_sale","",""
"Check Shop By title is visible","1004","TC 12.01.01 Check side panel title Shop By is visible","tests","Mon Jan 06 02:07:42 GMT 2025","passed","Mon Jan 06 02:07:43 GMT 2025","TestWomenPage","test_women","",""
"Checks if Advanced Search link is visible on each page in DATA_1","1220","TC 02.01.14 - Check display of Advanced Search link on each page specified in DATA_1","tests","Mon Jan 06 01:44:24 GMT 2025","passed","Mon Jan 06 01:44:25 GMT 2025","TestFooter","test_footer","",""
"Check 'Bras & Tanks' subsection link click in 'Women' section redirects to the Bras & Tanks-women page and         the 'Bras & Tanks' header is displayed","4433","TC 01.03.10 correctness of the ""Bras"" link of the ""Women"" section","tests","Mon Jan 06 01:50:27 GMT 2025","passed","Mon Jan 06 01:50:32 GMT 2025","TestHeader","test_header","",""
"Check if Email field is appropriately labeled ","77","TC 17.01.05 Verify FYP Email field is appropriately labeled","tests","Mon Jan 06 01:45:55 GMT 2025","passed","Mon Jan 06 01:45:55 GMT 2025","TestForgotYourPassword","test_forgot_your_password","",""
"This test check the cursor change when hovering over the block training main","0","TC 16.02.06 Check the cursor change to block training main ","tests","Mon Jan 06 02:07:25 GMT 2025","skipped","Mon Jan 06 02:07:25 GMT 2025","TestMainPage","test_training","",""
"Check that two links in Gear Deals section lead to the correct pages after click","555","TC 10.03.03, 10.03.05 - Verify 2 links in Gear Deals open the correct pages","tests","Mon Jan 06 02:01:39 GMT 2025","passed","Mon Jan 06 02:01:40 GMT 2025","TestSalePage","test_sale","",""
"This test checks if the info block title in section 1 'home-main' is correct
            in the Promo Block under header on the Main Page","1258","TC 13.01.07 - Check the display of the info block title in section 1 'home-main' in the Promo Block","tests","Mon Jan 06 01:52:43 GMT 2025","passed","Mon Jan 06 01:52:44 GMT 2025","TestMainPage","test_main_page","",""
"Check that link in section 2 block 1 'home-pants' is correct","7321","TC 13.02.02 - Check the link in section 2 block 1 'home-pants' in the Promo Block leads to the correct page","tests","Mon Jan 06 01:57:43 GMT 2025","broken","Mon Jan 06 01:57:50 GMT 2025","TestMainPage","test_main_page","",""
"Verify the link 'Fitness Equipment' redirected to the page and the 'Fitness Equipment' header is displayed","2222","TC 01.03.30 correctly redirected the link ""Gear - Fitness Equipment""","tests","Mon Jan 06 01:48:08 GMT 2025","passed","Mon Jan 06 01:48:10 GMT 2025","TestHeader","test_header","",""
"Checks if Subscribe section is visible on each page in DATA_1","0","TC 02.01.39 - Check display of Subscribe section on each page specified in DATA_1","tests","Mon Jan 06 01:45:24 GMT 2025","skipped","Mon Jan 06 01:45:24 GMT 2025","TestFooter","test_footer","",""
"Check that table headers in item cart are visible","42","test_tc_07_02_02_Verify_table_headers_in_item_cart_are_visible[t_header3]","tests","Mon Jan 06 02:04:14 GMT 2025","passed","Mon Jan 06 02:04:14 GMT 2025","TestShoppingCartFull","test_shopping_cart","",""
"Verify 'Sale' link click redirected to the page and the 'Sale' header is displayed","1575","TC 01.03.36 correctly redirected the link sale","tests","Mon Jan 06 01:46:42 GMT 2025","passed","Mon Jan 06 01:46:44 GMT 2025","TestHeader","test_header","",""
" Verify presence of Password Strength hint and warning color of weak password ","289","TC 04_02_09_13 Verify presence of strong password strength hint","tests","Mon Jan 06 01:43:31 GMT 2025","passed","Mon Jan 06 01:43:32 GMT 2025","TestCreateAnAccount","test_create_an_account","",""
"Verify that the block 'Luma hoodies' is displayed on the Men page","0","TC 14.06.33 Verify the visibility of 'Luma hoodies' promo block.","tests","Mon Jan 06 01:59:15 GMT 2025","skipped","Mon Jan 06 01:59:15 GMT 2025","TestMenPagePromoBlock","test_men","",""
"Check that five links in Men's Deals section lead to the correct pages after click","631","TC 10.02.03, 10.02.05, 10.02.07, 10.02.09, 10.02.11 - Verify 5 links in Men's Deals open the correct pages","tests","Mon Jan 06 02:01:23 GMT 2025","passed","Mon Jan 06 02:01:24 GMT 2025","TestSalePage","test_sale","",""
"Check error message on attempt to reset password with empty captcha input field","0","TC 17.01.26 Verify error on resetting My Password with empty captcha","tests","Mon Jan 06 01:46:08 GMT 2025","skipped","Mon Jan 06 01:46:08 GMT 2025","TestForgotYourPasswordFunctionality","test_forgot_your_password","",""
"This test checks the color change of the add to wishlist button and add to compare button on hover","1455","test_tc_06_01_12_the_color_change_my_wish_and_add_to_compare_button[add_to_compare]","tests","Mon Jan 06 01:51:34 GMT 2025","passed","Mon Jan 06 01:51:35 GMT 2025","TestMainPage","test_main_page","",""
"Verify the link 'Training' is visible and interactive and link 'Video Download' is visible","1652","TC_01_03_32_visible_and_interactive_the_link_""Training""","tests","Mon Jan 06 01:47:16 GMT 2025","passed","Mon Jan 06 01:47:18 GMT 2025","TestHeader","test_header","",""
"Check that Orders and Returns link in footer is correct","1482","TC 02.02.04 - Check Orders and Returns link in footer leads to the correct page from each page specified in DATA_1","tests","Mon Jan 06 01:45:41 GMT 2025","passed","Mon Jan 06 01:45:42 GMT 2025","TestFooter","test_footer","",""
"Check that the cursor changes to a 'hand' indicating the logo is a clickable element,         and that clicking on it causes the page to reload and redirect to the main page","1463","TC 01.02.04 display and interactivity of the logo","tests","Mon Jan 06 01:46:39 GMT 2025","passed","Mon Jan 06 01:46:41 GMT 2025","TestHeader","test_header","",""
"This test checks if the info block text in section 2 block 4 'home-performance' is correct
            in the Promo Block under header on the main page","1215","TC 13.01.34 - Check the display of the text in block 4 'home-performance' in the Promo Block","tests","Mon Jan 06 01:55:27 GMT 2025","broken","Mon Jan 06 01:55:28 GMT 2025","TestMainPage","test_main_page","",""
"Check if 'Create an Account' button link opens correct page","785","TC 03.01.23 Verify Create an Account button is functional","tests","Mon Jan 06 02:05:56 GMT 2025","passed","Mon Jan 06 02:05:57 GMT 2025","TestNewCustomers","test_sign_in","",""
"Checks if text of 'Subscribe to our mailing list' link is correct on each page in DATA_1","0","TC 02.01.56 - Check text of 'Subscribe to our mailing list' link on each page specified in DATA_1","tests","Mon Jan 06 01:45:24 GMT 2025","skipped","Mon Jan 06 01:45:24 GMT 2025","TestFooter","test_footer","",""
"Check that Advanced Search link in footer is correct","1568","TC 02.02.03 - Check Advanced Search link in footer leads to the correct page from each page specified in DATA_1","tests","Mon Jan 06 01:45:35 GMT 2025","passed","Mon Jan 06 01:45:36 GMT 2025","TestFooter","test_footer","",""
"This test checks if Advanced Search link is clickable on each page specified in DATA_1","1265","TC 02.01.15 - Check if Advanced Search link is clickable on each page specified in DATA_1","tests","Mon Jan 06 01:44:29 GMT 2025","passed","Mon Jan 06 01:44:30 GMT 2025","TestFooter","test_footer","",""
"Check error on Failed Login with invalid credentials, case-sensitive password and password with spaces","1287","TC 03.02.02 to 03_02_10 Verify Error on Failed Login with invalid credentials","tests","Mon Jan 06 02:07:08 GMT 2025","passed","Mon Jan 06 02:07:09 GMT 2025","TestFailedLogin","test_sign_in","",""
"Verify the link 'Gear' redirected to the page and the 'Gear' header is displayed","1985","TC 01.03.28 correctly redirected the link ""Gear""","tests","Mon Jan 06 01:47:53 GMT 2025","passed","Mon Jan 06 01:47:55 GMT 2025","TestHeader","test_header","",""
" Verify presence of First name label and the required asterisk ","78","TC 04_01_03 Verify presence of First name label and the required asterisk","tests","Mon Jan 06 01:42:23 GMT 2025","passed","Mon Jan 06 01:42:23 GMT 2025","TestCreateAnAccount","test_create_an_account","",""
" Verify presence of Password label and the required asterisk ","745","TC 04_01_13 Verify presence of Password label and the required asterisk","tests","Mon Jan 06 01:42:50 GMT 2025","passed","Mon Jan 06 01:42:50 GMT 2025","TestCreateAnAccount","test_create_an_account","",""
"Check that six links in Women's Deals section lead to the correct pages after click","636","TC 10.01.03, 10.01.05, 10.01.07, 10.01.09, 10.01.11, 10.01.13 - Verify 6 links in Women's Deals open the correct pages","tests","Mon Jan 06 02:00:54 GMT 2025","passed","Mon Jan 06 02:00:54 GMT 2025","TestSalePage","test_sale","",""
" Verify that Confirm Password input field highlighted when clicked","722","TC 04_01_17 Verify Confirm Password input field highlighting on click","tests","Mon Jan 06 01:43:01 GMT 2025","passed","Mon Jan 06 01:43:02 GMT 2025","TestCreateAnAccount","test_create_an_account","",""
"This test checks if block 4 'home-performance' in section 2 in Promo Block under header is clickable","6326","TC 13.01.53 - Check if block 4 'home-performance' in section 2 is clickablein the Promo Block on the main page","tests","Mon Jan 06 01:57:23 GMT 2025","broken","Mon Jan 06 01:57:29 GMT 2025","TestMainPage","test_main_page","",""
"
        Check the Email field is activated with a cursor and gets highlighted when clicked
        ","651","TC 03.01.07 Verify Email field highlighting on click","tests","Mon Jan 06 02:05:15 GMT 2025","passed","Mon Jan 06 02:05:16 GMT 2025","TestRegisteredCustomers","test_sign_in","",""
"Check if 'Create an Account' button is present","64","TC 03.01.21 Verify presence of Create an Account button ","tests","Mon Jan 06 02:05:51 GMT 2025","passed","Mon Jan 06 02:05:51 GMT 2025","TestNewCustomers","test_sign_in","",""
"Checks if placeholder in Email field is present in the DOM tree on each page specified in DATA_1","0","TC 02.01.49 - Check placeholder in Subscribe Email Field is present in the DOM tree on each page specified in DATA_1","tests","Mon Jan 06 01:45:24 GMT 2025","skipped","Mon Jan 06 01:45:24 GMT 2025","TestFooter","test_footer","",""
"Check New Customers Heading is present ","55","TC 03.01.19 Verify New Customers Heading","tests","Mon Jan 06 02:05:46 GMT 2025","passed","Mon Jan 06 02:05:46 GMT 2025","TestNewCustomers","test_sign_in","",""
" Verify presence of Password Strength hint and warning color of weak password ","312","TC 04_02_09_13 Verify presence of strong password strength hint","tests","Mon Jan 06 01:43:29 GMT 2025","passed","Mon Jan 06 01:43:29 GMT 2025","TestCreateAnAccount","test_create_an_account","",""
"This test checks if 'Contact us' link is clickable on each page specified in DATA_1","0","TC 02.01.25 - Check if 'Contact us' link is clickable on each page specified in DATA_1","tests","Mon Jan 06 01:45:05 GMT 2025","skipped","Mon Jan 06 01:45:05 GMT 2025","TestFooter","test_footer","",""
"Check 'Create an account' link is displayed and underlined","1418","TC 01.01.02 display and interactivity of the ""Create an account"" link","tests","Mon Jan 06 01:46:27 GMT 2025","passed","Mon Jan 06 01:46:29 GMT 2025","TestHeader","test_header","",""
"Check that bags link is correct","1517","test_TC_11_01_03","tests","Mon Jan 06 01:46:14 GMT 2025","passed","Mon Jan 06 01:46:16 GMT 2025","TestGearPage","test_gear","",""
"This test checks if the sign in info block in section 2 block 5 'home-eco' is correct
            in the Promo Block under header on the main page","1136","TC 13.01.40 - Check the display of the sign in block 5 'home-eco' in the Promo Block","tests","Mon Jan 06 01:56:00 GMT 2025","broken","Mon Jan 06 01:56:01 GMT 2025","TestMainPage","test_main_page","",""
