"DESCRIPTION","DURATION IN MS","NAME","PARENT SUITE","START TIME","STATUS","STOP TIME","SUB SUITE","SUITE","TEST CLASS","TEST METHOD"
"Verify that text-1 in 'Save up to $24!' block correctly displayed","0","TC 14.06.11 Verify that the 'Save up to $24!' text in the 'Save up to $24!' promo block is visible.","tests","Sun Mar 23 01:34:37 GMT 2025","skipped","Sun Mar 23 01:34:37 GMT 2025","TestMenPagePromoBlock","test_men","",""
"Check that Privacy and Cookie Policy link in footer is correct","1746","TC 02.02.02 - Check Privacy and Cookie Policy link in footer leads to the correct page from each page specified in DATA_1","tests","Sun Mar 23 01:20:53 GMT 2025","passed","Sun Mar 23 01:20:55 GMT 2025","TestFooter","test_footer","",""
"Verify that text-2 in 'Last chance for pants' block correctly displayed","0","TC 14.06.18 Verify that the 'Take 20% OFF' text is visible.","tests","Sun Mar 23 01:34:37 GMT 2025","skipped","Sun Mar 23 01:34:37 GMT 2025","TestMenPagePromoBlock","test_men","",""
"This test checks if info block in section 2 block 2 'home-t-shirts' is displayed
            in the Promo Block under header on the main page","8457","TC 13.01.22 - Check the display of the info block in block 2 't-shirts' in the Promo Block","tests","Sun Mar 23 01:29:09 GMT 2025","broken","Sun Mar 23 01:29:17 GMT 2025","TestMainPage","test_main_page","",""
"Verify subtotal in summary: subtotal = price * qty and displayed correctly.","3433","tc 07.02.22 Verify subtotal in Summury Card: subtotal = price * qty and displayed correctly.","tests","Sun Mar 23 01:48:39 GMT 2025","passed","Sun Mar 23 01:48:43 GMT 2025","TestShoppingCartFull","test_shopping_cart","",""
"Check if items are visible","1012","TC 12.05.01/02/03/04 Check the Sidebar text is visible","tests","Sun Mar 23 01:53:12 GMT 2025","passed","Sun Mar 23 01:53:13 GMT 2025","TestWomenPage","test_women","",""
"Check that five elements in Men's Deals section are displayed and enabled","27","TC 10.02.02, 10.02.04, 10.02.06, 10.02.08, 10.02.10 - Verify 5 links in Men's Deals section are visible and clickable","tests","Sun Mar 23 01:41:30 GMT 2025","passed","Sun Mar 23 01:41:30 GMT 2025","TestSalePage","test_sale","",""
"Check the 'Men' section click redirects to the Men page and the 'Men' header is displayed","1976","TC 01.03.16 correctness of the ""Men"" section link","tests","Sun Mar 23 01:23:21 GMT 2025","passed","Sun Mar 23 01:23:23 GMT 2025","TestHeader","test_header","",""
"Verify that the image in the block 'Luma hoodies' is displayed on the Men page","0","TC 14.06.34 Verify the visibility of the image in the 'Luma hoodies' promo block.","tests","Sun Mar 23 01:34:37 GMT 2025","skipped","Sun Mar 23 01:34:37 GMT 2025","TestMenPagePromoBlock","test_men","",""
"Check if Email field is appropriately labeled ","69","TC 17.01.05 Verify FYP Email field is appropriately labeled","tests","Sun Mar 23 01:21:20 GMT 2025","passed","Sun Mar 23 01:21:20 GMT 2025","TestForgotYourPassword","test_forgot_your_password","",""
"
        Check that the 'Reload captcha' button generates a new captcha image
        and ensure the new image source is different from the original image source
        ","0","TC 17.01.16 Verify click Reload captcha button generates a new captcha image","tests","Sun Mar 23 01:21:28 GMT 2025","skipped","Sun Mar 23 01:21:28 GMT 2025","TestForgotYourPassword","test_forgot_your_password","",""
"This test checks if the info block text in section 2 block 2 'home-t-shirts' is correct
            in the Promo Block under header on the main page","1620","TC 13.01.24 - Check the display of the text in block 2 'home-t-shirts' in the Promo Block","tests","Sun Mar 23 01:29:22 GMT 2025","broken","Sun Mar 23 01:29:23 GMT 2025","TestMainPage","test_main_page","",""
"This test checks if the image in section 2 block 4 'home-performance' is visible","1361","TC 13.01.31 - Check the display of an image in block 4 'home-performance' in the Promo Block","tests","Sun Mar 23 01:29:53 GMT 2025","broken","Sun Mar 23 01:29:54 GMT 2025","TestMainPage","test_main_page","",""
"Verify subtotal for items: subtotal = price * qty and displayed correctly.","2550","tc 07.02.21 Verify subtotal for items: subtotal = price * qty and displayed correctly.","tests","Sun Mar 23 01:48:31 GMT 2025","passed","Sun Mar 23 01:48:33 GMT 2025","TestShoppingCartFull","test_shopping_cart","",""
"Checks if Subscribe Email Field is visible on each page in DATA_1","0","TC 02.01.48 - Check display of Subscribe Email Field on each page specified in DATA_1","tests","Sun Mar 23 01:20:48 GMT 2025","skipped","Sun Mar 23 01:20:48 GMT 2025","TestFooter","test_footer","",""
"Checks if text of placeholder in Subscribe Email Field is correct on each page in DATA_1","0","TC 02.01.51 - Check text of placeholder in Subscribe Email Field on each page specified in DATA_1","tests","Sun Mar 23 01:20:48 GMT 2025","skipped","Sun Mar 23 01:20:48 GMT 2025","TestFooter","test_footer","",""
"Verify that text-3 in 'Luma tees' block correctly displayed","0","TC 14.06.31 Verify that the 'Shop Tees' text is visible.","tests","Sun Mar 23 01:34:37 GMT 2025","skipped","Sun Mar 23 01:34:37 GMT 2025","TestMenPagePromoBlock","test_men","",""
"Check error message on attempt to reset password with empty email field","127","TC 17.01.25 Verify error on resetting My Password with empty email","tests","Sun Mar 23 01:21:32 GMT 2025","passed","Sun Mar 23 01:21:33 GMT 2025","TestForgotYourPasswordFunctionality","test_forgot_your_password","",""
" Verify presence of Email label and the required asterisk ","727","TC 04_01_11 Verify presence of email label and the required asterisk","tests","Sun Mar 23 01:18:14 GMT 2025","passed","Sun Mar 23 01:18:15 GMT 2025","TestCreateAnAccount","test_create_an_account","",""
"Check that the 'Reset My Password' button is clickable","27","TC 17.01.20 Verify Reset My Password button is clickable","tests","Sun Mar 23 01:21:30 GMT 2025","passed","Sun Mar 23 01:21:30 GMT 2025","TestForgotYourPassword","test_forgot_your_password","",""
" Verify presence of Confirm Password label and the required asterisk ","752","TC 04_01_16 Verify presence of Confirm Password label and the required asterisk","tests","Sun Mar 23 01:18:29 GMT 2025","passed","Sun Mar 23 01:18:29 GMT 2025","TestCreateAnAccount","test_create_an_account","",""
"
            This test will check that after clicking on the add to wishlist button,
            you are redirected to the My Wishlist page
            User is authorized
            ","0","Check the transition to the page my wish after clicking on the button. User is authorized","tests","Sun Mar 23 01:26:49 GMT 2025","skipped","Sun Mar 23 01:26:49 GMT 2025","TestMainPage","test_main_page","",""
"Check that six elements in Women's Deals section are displayed and enabled","25","TC 10.01.02, 10.01.04, 10.01.06, 10.01.08, 10.01.10, 10.01.12 - Verify 6 links in Women's Deals section are visible and clickable","tests","Sun Mar 23 01:40:53 GMT 2025","passed","Sun Mar 23 01:40:53 GMT 2025","TestSalePage","test_sale","",""
"Checks if text of Privacy and Cookie Policy link matches expected on each page in DATA_1","1204","TC 02.01.12 - Check text of Privacy and Cookie Policy link on each page specified in DATA_1","tests","Sun Mar 23 01:19:49 GMT 2025","passed","Sun Mar 23 01:19:50 GMT 2025","TestFooter","test_footer","",""
"This test checks if block 3 'home-erin' is displayed in section 2 of Promo Block under header
            on the Main Page","8653","TC 13.01.12 - Check display of block 3 'home-erin' in section 2 in the Promo Block","tests","Sun Mar 23 01:27:39 GMT 2025","broken","Sun Mar 23 01:27:48 GMT 2025","TestMainPage","test_main_page","",""
"Check that watches link is correct","1507","test_TC_11_01_07","tests","Sun Mar 23 01:21:49 GMT 2025","passed","Sun Mar 23 01:21:50 GMT 2025","TestGearPage","test_gear","",""
"Checks if text on Subscribe Button is visible on each page in DATA_1","0","TC 02.01.45 - Check display of text on Subscribe Button on each page specified in DATA_1","tests","Sun Mar 23 01:20:48 GMT 2025","skipped","Sun Mar 23 01:20:48 GMT 2025","TestFooter","test_footer","",""
"This test checks if the info block title in section 2 block 3 'home-erin' is correct
            in the Promo Block under header on the main page","1426","TC 13.01.28 - Check the display of the title in block 3 'home-erin' in the Promo Block","tests","Sun Mar 23 01:29:44 GMT 2025","broken","Sun Mar 23 01:29:45 GMT 2025","TestMainPage","test_main_page","",""
"Check that six links in Women's Deals section lead to the correct pages after click","705","TC 10.01.03, 10.01.05, 10.01.07, 10.01.09, 10.01.11, 10.01.13 - Verify 6 links in Women's Deals open the correct pages","tests","Sun Mar 23 01:41:12 GMT 2025","passed","Sun Mar 23 01:41:13 GMT 2025","TestSalePage","test_sale","",""
"","1266","TC 14.02.02 Verify the link Tops is visible and clickable.","tests","Sun Mar 23 01:33:43 GMT 2025","passed","Sun Mar 23 01:33:44 GMT 2025","TestMenPage","test_men","",""
"This test checks if the info block title in section 2 block 1 'home-pants' is correct
            in the Promo Block under header on the Main Page","8357","TC 13.01.18 - Check the display of the title in block 1 'home-pants' in the Promo Block","tests","Sun Mar 23 01:28:33 GMT 2025","broken","Sun Mar 23 01:28:41 GMT 2025","TestMainPage","test_main_page","",""
"Verify that the section Women in the header is visible and interactive","337","TC 01.03.03 display and interactivity of the ""Women"" section","tests","Sun Mar 23 01:22:39 GMT 2025","passed","Sun Mar 23 01:22:39 GMT 2025","TestHeader","test_header","",""
"Check error message on attempt to log in with empty password","365","TC 03.02.05 Verify error on attempting to log in with empty email - Negative","tests","Sun Mar 23 01:51:25 GMT 2025","passed","Sun Mar 23 01:51:26 GMT 2025","TestLogin","test_sign_in","",""
"This test checks if the info block title in section 2 block 4 'home-performance' is correct
            in the Promo Block under header on the main page","1527","TC 13.01.33 - Check the display of the title in block 4 'home-performance' in the Promo Block","tests","Sun Mar 23 01:30:09 GMT 2025","broken","Sun Mar 23 01:30:10 GMT 2025","TestMainPage","test_main_page","",""
"This test checks block-promo training-erin is displayed","0","TC 16.02.03 - Check the display of block 2 erin","tests","Sun Mar 23 01:52:44 GMT 2025","skipped","Sun Mar 23 01:52:44 GMT 2025","TestMainPage","test_training","",""
"Check that Search Terms link in footer is correct","0","TC 02.02.01 - Check Search Terms link in footer leads to the correct page from each page specified in DATA_1","tests","Sun Mar 23 01:20:48 GMT 2025","skipped","Sun Mar 23 01:20:48 GMT 2025","TestFooter","test_footer","",""
"Verify message ""We can not find products matching the selection."" is visible","912","TC 18.02.02 Verify message ""We can not find products matching the selection."" is visible","tests","Sun Mar 23 01:52:58 GMT 2025","passed","Sun Mar 23 01:52:59 GMT 2025","TestTrainingVideoDownload","test_training_video_download","",""
"Check Registered Customers Heading is present ","39","TC 03.01.02 Verify Registered Customers Heading","tests","Sun Mar 23 01:50:23 GMT 2025","passed","Sun Mar 23 01:50:23 GMT 2025","TestRegisteredCustomers","test_sign_in","",""
"Checks if Subscribe section is present in the DOM tree on each page specified in DATA_1","0","TC 02.01.38 - Check Subscribe section is present in the DOM tree on each page specified in DATA_1","tests","Sun Mar 23 01:20:48 GMT 2025","skipped","Sun Mar 23 01:20:48 GMT 2025","TestFooter","test_footer","",""
"Verify that text-2 in 'Luma tees' block correctly displayed","0","TC 14.06.30 Verify that the 'Grab a tee or two!' text is visible.","tests","Sun Mar 23 01:34:37 GMT 2025","skipped","Sun Mar 23 01:34:37 GMT 2025","TestMenPagePromoBlock","test_men","",""
"Checks if Write for us link is present in the DOM tree on each page specified in DATA_1","0","TC 02.01.28 - Check Write for us link is present in the DOM tree on each page specified in DATA_1","tests","Sun Mar 23 01:20:29 GMT 2025","skipped","Sun Mar 23 01:20:29 GMT 2025","TestFooter","test_footer","",""
"This test checks if the image in section 2 block 5 'home-eco' is visible","1241","TC 13.01.36 - Check the display of an image in block 5 'home-eco' in the Promo Block","tests","Sun Mar 23 01:30:27 GMT 2025","broken","Sun Mar 23 01:30:28 GMT 2025","TestMainPage","test_main_page","",""
"
        The user is NOT logged in, located in the product card, section ""Reviews""
        1. All required fields are filled with correct data
        2. Pressed 5 star
        3.The ""Submit Review"" button is pressed
        Result: Present in the DOM and visible on the page the message: ""You submitted your review for moderation.
        This code works when run on Win, Mac, Ubuntu on a real laptop and has the features of working on GitHub Action.
        When interacting with the GitHub Action, it checks not for the text of the ""Success"" message, but for the ""Success"" URL""
        ","10659","TC 01_15_01 Verify possibility to vote with 5 stars","tests","Sun Mar 23 01:40:35 GMT 2025","passed","Sun Mar 23 01:40:45 GMT 2025","TestReviews","test_reviews_page","",""
"Check the ""Search"" field is activated and the drop-down list appears with various product","2446","TC 01.02.02 functionality of the ""Search"" field","tests","Sun Mar 23 01:22:16 GMT 2025","passed","Sun Mar 23 01:22:18 GMT 2025","TestHeader","test_header","",""
"Check that Contact Us link in footer is correct","0","TC 02.02.05 - Check Contact Us link in footer leads to the correct page from each page specified in DATA_1","tests","Sun Mar 23 01:21:07 GMT 2025","skipped","Sun Mar 23 01:21:07 GMT 2025","TestFooter","test_footer","",""
" Verify presence of Password Strength hint and warning color of weak password ","262","TC 04_02_09_13 Verify presence of strong password strength hint","tests","Sun Mar 23 01:19:07 GMT 2025","passed","Sun Mar 23 01:19:07 GMT 2025","TestCreateAnAccount","test_create_an_account","",""
"Checks if the Search Terms link is present in the DOM tree on each page specified in DATA_1","995","TC 02.01.03 - Check Search Terms link is present in the DOM tree on each page specified in DATA_1","tests","Sun Mar 23 01:19:16 GMT 2025","passed","Sun Mar 23 01:19:17 GMT 2025","TestFooter","test_footer","",""
"Check that six elements in Women's Deals section are displayed and enabled","26","TC 10.01.02, 10.01.04, 10.01.06, 10.01.08, 10.01.10, 10.01.12 - Verify 6 links in Women's Deals section are visible and clickable","tests","Sun Mar 23 01:40:55 GMT 2025","passed","Sun Mar 23 01:40:55 GMT 2025","TestSalePage","test_sale","",""
"Checks if 'Contact us' link is visible on each page in DATA_1","0","TC 02.01.24 - Check display of 'Contact us' link on each page specified in DATA_1","tests","Sun Mar 23 01:20:29 GMT 2025","skipped","Sun Mar 23 01:20:29 GMT 2025","TestFooter","test_footer","",""
"Verify that the click on the block 'Luma hoodies' correctly redirects to a new webpage","0","TC 14.06.38 Verify the click on the block 'Luma hoodies' redirects to a correct page.","tests","Sun Mar 23 01:34:37 GMT 2025","skipped","Sun Mar 23 01:34:37 GMT 2025","TestMenPagePromoBlock","test_men","",""
"Check that message coupon code is not valid is displayed correct","3905","tc 07.02.25 Verify the message coupon code is not valid is displayed correct","tests","Sun Mar 23 01:49:51 GMT 2025","broken","Sun Mar 23 01:49:55 GMT 2025","TestShoppingCartFull","test_shopping_cart","",""
" Verify presence of Password Strength hint and warning color of weak password ","245","TC 04_02_09_13 Verify presence of strong password strength hint","tests","Sun Mar 23 01:19:04 GMT 2025","passed","Sun Mar 23 01:19:04 GMT 2025","TestCreateAnAccount","test_create_an_account","",""
" Verify that Last name input field highlighted when clicked","669","TC 04_01_08 Verify Last name input field highlighting on click","tests","Sun Mar 23 01:18:08 GMT 2025","passed","Sun Mar 23 01:18:09 GMT 2025","TestCreateAnAccount","test_create_an_account","",""
"Check that Advanced Search link in footer is correct","2471","TC 02.02.03 - Check Advanced Search link in footer leads to the correct page from each page specified in DATA_1","tests","Sun Mar 23 01:20:56 GMT 2025","passed","Sun Mar 23 01:20:59 GMT 2025","TestFooter","test_footer","",""
"Check if the Email input field is present","51","TC 17.01.03 Verify FYP Email field is present","tests","Sun Mar 23 01:21:15 GMT 2025","passed","Sun Mar 23 01:21:15 GMT 2025","TestForgotYourPassword","test_forgot_your_password","",""
"Verify the link 'Training' is visible and interactive and link 'Video Download' is visible","1723","TC_01_03_32_visible_and_interactive_the_link_""Training""","tests","Sun Mar 23 01:22:32 GMT 2025","passed","Sun Mar 23 01:22:33 GMT 2025","TestHeader","test_header","",""
"Checks if Advanced Search link is visible on each page in DATA_1","1163","TC 02.01.14 - Check display of Advanced Search link on each page specified in DATA_1","tests","Sun Mar 23 01:19:56 GMT 2025","passed","Sun Mar 23 01:19:57 GMT 2025","TestFooter","test_footer","",""
"Check img existence of Women's Deals section","50","TC 10.04.01 - Verify that the Women Deals contains an image","tests","Sun Mar 23 01:42:02 GMT 2025","passed","Sun Mar 23 01:42:02 GMT 2025","TestSalePage","test_sale","",""
"Verify that the 'Proceed to checkout' button redirects to the shipping page.","4524","tc 07.02.08 Verify that 'Proceed to checkout' button redirects to the shipping page","tests","Sun Mar 23 01:48:20 GMT 2025","passed","Sun Mar 23 01:48:25 GMT 2025","TestShoppingCartFull","test_shopping_cart","",""
"Check error on Failed Login with invalid credentials, case-sensitive password and password with spaces","1316","TC 03.02.02 to 03_02_10 Verify Error on Failed Login with invalid credentials","tests","Sun Mar 23 01:52:19 GMT 2025","passed","Sun Mar 23 01:52:21 GMT 2025","TestFailedLogin","test_sign_in","",""
"Checks if Subscribe section is present in the DOM tree on each page specified in DATA_1","0","TC 02.01.38 - Check Subscribe section is present in the DOM tree on each page specified in DATA_1","tests","Sun Mar 23 01:20:48 GMT 2025","skipped","Sun Mar 23 01:20:48 GMT 2025","TestFooter","test_footer","",""
"Check that table headers in item cart are visible","33","test_tc_07_02_02_Verify_table_headers_in_item_cart_are_visible[t_header2]","tests","Sun Mar 23 01:49:25 GMT 2025","passed","Sun Mar 23 01:49:25 GMT 2025","TestShoppingCartFull","test_shopping_cart","",""
"Check 'Pants' subsection link click in 'Men' section redirects to the Pants page and         the 'Pants' header is displayed","2865","TC 01.03.25 correctness of the ""Pants"" link of the ""Men"" section","tests","Sun Mar 23 01:22:56 GMT 2025","passed","Sun Mar 23 01:22:59 GMT 2025","TestHeader","test_header","",""
"Check Sidebar Category title has correct text and is visible","41","TC 16.01.05 Verify Sidebar panel title Compare Products is visible and contains text 'Compare Products'","tests","Sun Mar 23 01:52:40 GMT 2025","passed","Sun Mar 23 01:52:40 GMT 2025","TestMainPage","test_training","",""
"Check that Bags is displayed and enabled","997","test_tc_11_01_02","tests","Sun Mar 23 01:21:36 GMT 2025","passed","Sun Mar 23 01:21:37 GMT 2025","TestGearPage","test_gear","",""
" Verify presence of Password Strength hint and warning color of weak password ","247","TC 04_02_09_13 Verify presence of strong password strength hint","tests","Sun Mar 23 01:19:02 GMT 2025","passed","Sun Mar 23 01:19:02 GMT 2025","TestCreateAnAccount","test_create_an_account","",""
"Check Success and Failed Login, no error validation","2401","TC 03.02.01 to 03_02_10 Verify Failed Login, no error validation","tests","Sun Mar 23 01:52:07 GMT 2025","passed","Sun Mar 23 01:52:10 GMT 2025","TestFailedLogin","test_sign_in","",""
"Check 'Create an account' link click redirects to the accounts registration page and         the ""Create New Customer Account"" header is displayed","2326","TC 01.01.03 correctness of the ""Create an account"" link","tests","Sun Mar 23 01:21:55 GMT 2025","passed","Sun Mar 23 01:21:57 GMT 2025","TestHeader","test_header","",""
"Check that 'Subscribe to our mailing list' link in footer is correct","0","TC 02.02.07 - Check 'Subscribe to our mailing list' link in footer leads to the correct page from each page specified in DATA_1","tests","Sun Mar 23 01:21:07 GMT 2025","skipped","Sun Mar 23 01:21:07 GMT 2025","TestFooter","test_footer","",""
"This test checks if the info block text in section 2 block 1 'home-pants' is correct
            in the Promo Block under header on the Main Page","8515","TC 13.01.19 - Check the display of the text in block 1 'home-pants' in the Promo Block","tests","Sun Mar 23 01:28:43 GMT 2025","broken","Sun Mar 23 01:28:51 GMT 2025","TestMainPage","test_main_page","",""
"Check that five elements in Men's Deals section are displayed and enabled","26","TC 10.02.02, 10.02.04, 10.02.06, 10.02.08, 10.02.10 - Verify 5 links in Men's Deals section are visible and clickable","tests","Sun Mar 23 01:41:28 GMT 2025","passed","Sun Mar 23 01:41:28 GMT 2025","TestSalePage","test_sale","",""
" Verify that Last name input field highlighted when label is clicked","674","TC 04_01_07 Verify Last name input field highlighting on label click","tests","Sun Mar 23 01:18:05 GMT 2025","passed","Sun Mar 23 01:18:06 GMT 2025","TestCreateAnAccount","test_create_an_account","",""
"Check the ""Search"" field in the header contains the placeholder 'Search entire store here...'","1232","TC 01.02.03 presence of a  placeholder in the ""Search"" field","tests","Sun Mar 23 01:22:13 GMT 2025","passed","Sun Mar 23 01:22:15 GMT 2025","TestHeader","test_header","",""
"Check that quantity field is displayed and clickable.","1157","tc 07.02.03 Verify that quantity field is displayed and clickable","tests","Sun Mar 23 01:47:56 GMT 2025","passed","Sun Mar 23 01:47:57 GMT 2025","TestShoppingCartFull","test_shopping_cart","",""
"This test checks if block 1 'home-pants' in section 2 in the Promo Block is present
            in the DOM tree on the main page","7997","TC 13.01.44 - Check block 1 'home-pants' in section 2 of the Promo Block is present in the DOM tree","tests","Sun Mar 23 01:31:07 GMT 2025","broken","Sun Mar 23 01:31:15 GMT 2025","TestMainPage","test_main_page","",""
"Verify that the click on the block 'Luma tees' correctly redirects to a new webpage","0","TC 14.06.32 Verify the click on the block 'Luma tees' redirects to a correct page.","tests","Sun Mar 23 01:34:37 GMT 2025","skipped","Sun Mar 23 01:34:37 GMT 2025","TestMenPagePromoBlock","test_men","",""
"Check that Orders and Returns link in footer is correct","1493","TC 02.02.04 - Check Orders and Returns link in footer leads to the correct page from each page specified in DATA_1","tests","Sun Mar 23 01:21:06 GMT 2025","passed","Sun Mar 23 01:21:07 GMT 2025","TestFooter","test_footer","",""
"This test check the cursor change when hovering over the block training erin","0","TC 16.02.07 Check the cursor change to block training erin","tests","Sun Mar 23 01:52:44 GMT 2025","skipped","Sun Mar 23 01:52:44 GMT 2025","TestMainPage","test_training","",""
"Check if the entered value is masked in password field","166","TC 03.01.13 Verify Password is masked","tests","Sun Mar 23 01:50:50 GMT 2025","passed","Sun Mar 23 01:50:50 GMT 2025","TestRegisteredCustomers","test_sign_in","",""
"Check New Customers Heading is present ","40","TC 03.01.19 Verify New Customers Heading","tests","Sun Mar 23 01:51:06 GMT 2025","passed","Sun Mar 23 01:51:06 GMT 2025","TestNewCustomers","test_sign_in","",""
"Check if the password input field is present","35","TC 03.01.09 Verify Password field is present","tests","Sun Mar 23 01:50:40 GMT 2025","passed","Sun Mar 23 01:50:40 GMT 2025","TestRegisteredCustomers","test_sign_in","",""
"Checks if Footer is visible on each page specified in DATA_1","1817","TC 02.01.02 - Check Footer display on each page specified in DATA_1","tests","Sun Mar 23 01:19:08 GMT 2025","passed","Sun Mar 23 01:19:10 GMT 2025","TestFooter","test_footer","",""
"Check Success Login with correct credentials","1908","TC 03.02.09 Verify login with valid mail containing trailing leading_spaces - Positive","tests","Sun Mar 23 01:51:33 GMT 2025","passed","Sun Mar 23 01:51:35 GMT 2025","TestLogin","test_sign_in","",""
"Check Success and Failed Login, no error validation","2403","TC 03.02.01 to 03_02_10 Verify Failed Login, no error validation","tests","Sun Mar 23 01:51:53 GMT 2025","passed","Sun Mar 23 01:51:55 GMT 2025","TestFailedLogin","test_sign_in","",""
"Checks if text on Subscribe Button is correct on each page in DATA_1","0","TC 02.01.46 - Check text on Subscribe Button on each page specified in DATA_1","tests","Sun Mar 23 01:20:48 GMT 2025","skipped","Sun Mar 23 01:20:48 GMT 2025","TestFooter","test_footer","",""
"This test checks if the image in section 2 block 3 'home-erin' is visible","1432","TC 13.01.26 - Check the display of an image in block 3 'home-erin' in the Promo Block","tests","Sun Mar 23 01:29:28 GMT 2025","broken","Sun Mar 23 01:29:29 GMT 2025","TestMainPage","test_main_page","",""
"Verify the link 'Sale' is visible and interactive","1665","TC 01.03.35 visible and interactive the link ""Sale""","tests","Sun Mar 23 01:22:23 GMT 2025","passed","Sun Mar 23 01:22:24 GMT 2025","TestHeader","test_header","",""
"Check error on Failed Login with invalid credentials, case-sensitive password and password with spaces","1414","TC 03.02.02 to 03_02_10 Verify Error on Failed Login with invalid credentials","tests","Sun Mar 23 01:52:16 GMT 2025","passed","Sun Mar 23 01:52:17 GMT 2025","TestFailedLogin","test_sign_in","",""
