"DESCRIPTION","DURATION IN MS","NAME","PARENT SUITE","START TIME","STATUS","STOP TIME","SUB SUITE","SUITE","TEST CLASS","TEST METHOD"
"Checks if 'Subscribe to our mailing list' link is visible on each page specified in DATA_1","0","TC 02.01.53 - Check 'Subscribe to our mailing list' link is visible on each page specified in DATA_1","tests","Fri Dec 06 01:50:13 GMT 2024","skipped","Fri Dec 06 01:50:13 GMT 2024","TestFooter","test_footer","",""
"Check that table headers in item cart are visible","0","test_tc_07_02_02_Verify_table_headers_in_item_cart_are_visible[t_header1]","tests","Fri Dec 06 02:08:40 GMT 2024","broken","Fri Dec 06 02:08:40 GMT 2024","TestShoppingCartFull","test_shopping_cart","",""
"This test checks if the info block title in section 1 'home-main' is correct
            in the Promo Block under header on the Main Page","1603","TC 13.01.07 - Check the display of the info block title in section 1 'home-main' in the Promo Block","tests","Fri Dec 06 01:58:32 GMT 2024","passed","Fri Dec 06 01:58:34 GMT 2024","TestMainPage","test_main_page","",""
"
        Check the captcha field is activated with a cursor and gets highlighted when clicked
        ","0","TC 17.01.12 Verify FYP captcha field highlighting on click","tests","Fri Dec 06 01:51:13 GMT 2024","skipped","Fri Dec 06 01:51:13 GMT 2024","TestForgotYourPassword","test_forgot_your_password","",""
"Check error on Failed Login with invalid credentials, case-sensitive password and password with spaces","1472","TC 03.02.02 to 03_02_10 Verify Error on Failed Login with invalid credentials","tests","Fri Dec 06 02:12:11 GMT 2024","broken","Fri Dec 06 02:12:12 GMT 2024","TestFailedLogin","test_sign_in","",""
" Verify presence of First name label and the required asterisk ","205","TC 04_01_03 Verify presence of First name label and the required asterisk","tests","Fri Dec 06 01:46:11 GMT 2024","passed","Fri Dec 06 01:46:12 GMT 2024","TestCreateAnAccount","test_create_an_account","",""
"Check Success and Failed Login, no error validation","3290","TC 03.02.01 to 03_02_10 Verify Failed Login, no error validation","tests","Fri Dec 06 02:11:33 GMT 2024","broken","Fri Dec 06 02:11:36 GMT 2024","TestFailedLogin","test_sign_in","",""
"Check 'Tops' subsection link click in 'Men' section redirects to the Tops-men page and         the 'Tops' header is displayed","4010","TC 01.03.18 correctness of the ""Tops"" link of the ""Men"" section","tests","Fri Dec 06 01:55:08 GMT 2024","passed","Fri Dec 06 01:55:12 GMT 2024","TestHeader","test_header","",""
"Check 'Shorts' subsection link click in 'Women' section redirects to the Shorts page and         the 'Shorts' header is displayed","4455","TC 01.03.14 correctness of the ""Shorts"" link of the ""Women"" section","tests","Fri Dec 06 01:57:07 GMT 2024","passed","Fri Dec 06 01:57:11 GMT 2024","TestHeader","test_header","",""
"This test checks if Advanced Search link is clickable on each page specified in DATA_1","2241","TC 02.01.15 - Check if Advanced Search link is clickable on each page specified in DATA_1","tests","Fri Dec 06 01:49:06 GMT 2024","passed","Fri Dec 06 01:49:08 GMT 2024","TestFooter","test_footer","",""
"Check error on Failed Login with invalid credentials, case-sensitive password and password with spaces","1281","TC 03.02.02 to 03_02_10 Verify Error on Failed Login with invalid credentials","tests","Fri Dec 06 02:12:20 GMT 2024","broken","Fri Dec 06 02:12:22 GMT 2024","TestFailedLogin","test_sign_in","",""
"Checks if text of Write for us link is correct on each page in DATA_1","0","TC 02.01.32 - Check text of Write for us link on each page specified in DATA_1","tests","Fri Dec 06 01:49:45 GMT 2024","skipped","Fri Dec 06 01:49:45 GMT 2024","TestFooter","test_footer","",""
"Check that Contact Us link in footer is correct","0","TC 02.02.05 - Check Contact Us link in footer leads to the correct page from each page specified in DATA_1","tests","Fri Dec 06 01:50:45 GMT 2024","skipped","Fri Dec 06 01:50:45 GMT 2024","TestFooter","test_footer","",""
"Checks if 'Contact us' link is visible on each page in DATA_1","0","TC 02.01.24 - Check display of 'Contact us' link on each page specified in DATA_1","tests","Fri Dec 06 01:49:45 GMT 2024","skipped","Fri Dec 06 01:49:45 GMT 2024","TestFooter","test_footer","",""
"Check if items are visible","1954","TC 12.05.01/02/03/04 Check the Sidebar text is visible","tests","Fri Dec 06 02:13:26 GMT 2024","passed","Fri Dec 06 02:13:28 GMT 2024","TestWomenPage","test_women","",""
" Verify that customer can't Create An Account with registered email before ","3002","test 04.02.08 create an account with registered email","tests","Fri Dec 06 01:47:07 GMT 2024","passed","Fri Dec 06 01:47:10 GMT 2024","TestCreateAnAccount","test_create_an_account","",""
"Check if Password field is appropriately labeled ","169","TC 03.01.11 Verify Password field is appropriately labeled","tests","Fri Dec 06 02:09:56 GMT 2024","passed","Fri Dec 06 02:09:56 GMT 2024","TestRegisteredCustomers","test_sign_in","",""
"Checks if placeholder in Email field is present in the DOM tree on each page specified in DATA_1","0","TC 02.01.49 - Check placeholder in Subscribe Email Field is present in the DOM tree on each page specified in DATA_1","tests","Fri Dec 06 01:50:13 GMT 2024","skipped","Fri Dec 06 01:50:13 GMT 2024","TestFooter","test_footer","",""
"Check Sidebar Video Download title has correct text and is visible","50","TC 16.01.03 Verify Sidebar title Video Download is visible and contains text 'Video Download'","tests","Fri Dec 06 02:12:31 GMT 2024","passed","Fri Dec 06 02:12:31 GMT 2024","TestMainPage","test_training","",""
"Checks if Privacy and Cookie Policy link is visible on each page in DATA_1","1781","TC 02.01.09 - Check display of Privacy and Cookie Policy link on each page specified in DATA_1","tests","Fri Dec 06 01:48:36 GMT 2024","passed","Fri Dec 06 01:48:37 GMT 2024","TestFooter","test_footer","",""
"This test checks if Search Terms link is clickable on each page specified in DATA_1","2255","TC 02.01.05 - Check if Search Terms link is clickable on each page specified in DATA_1","tests","Fri Dec 06 01:48:19 GMT 2024","passed","Fri Dec 06 01:48:21 GMT 2024","TestFooter","test_footer","",""
"Checks if Subscribe section is present in the DOM tree on each page specified in DATA_1","0","TC 02.01.38 - Check Subscribe section is present in the DOM tree on each page specified in DATA_1","tests","Fri Dec 06 01:50:13 GMT 2024","skipped","Fri Dec 06 01:50:13 GMT 2024","TestFooter","test_footer","",""
"Check 'Hoodies & Sweatshirts' subsection link click in 'Men' section redirects to the         Hoodies & Sweatshirts-men page and the 'Hoodies & Sweatshirts' header is displayed","4539","TC 01.03.20 correctness of the ""Hoodies & Sweatshirts"" link of the ""Men"" section","tests","Fri Dec 06 01:55:19 GMT 2024","passed","Fri Dec 06 01:55:24 GMT 2024","TestHeader","test_header","",""
"Check New Customers Heading is present ","74","TC 03.01.19 Verify New Customers Heading","tests","Fri Dec 06 02:10:28 GMT 2024","passed","Fri Dec 06 02:10:28 GMT 2024","TestNewCustomers","test_sign_in","",""
"Check Sidebar Category title has correct text and is visible","84","TC 16.01.06 Verify Sidebar panel title My Wish List is visible and contains text 'My Wish List'","tests","Fri Dec 06 02:12:41 GMT 2024","passed","Fri Dec 06 02:12:41 GMT 2024","TestMainPage","test_training","",""
"Verify that the section Women in the header is visible and interactive","407","TC 01.03.03 display and interactivity of the ""Women"" section","tests","Fri Dec 06 01:52:57 GMT 2024","passed","Fri Dec 06 01:52:57 GMT 2024","TestHeader","test_header","",""
"Verify that the block 'Luma hoodies' is displayed on the Men page","0","TC 14.06.33 Verify the visibility of 'Luma hoodies' promo block.","tests","Fri Dec 06 02:03:46 GMT 2024","skipped","Fri Dec 06 02:03:46 GMT 2024","TestMenPagePromoBlock","test_men","",""
"This test checks if block 2 'home-t-shirts' in section 2 in the Promo Block is present
            in the DOM tree on the main page","1801","TC 13.01.45 - Check block 2 'home-t-shirts' in section 2 of the Promo Block is present in the DOM tree","tests","Fri Dec 06 02:01:04 GMT 2024","passed","Fri Dec 06 02:01:06 GMT 2024","TestMainPage","test_main_page","",""
"Checks if placeholder in Subscribe Email Field is visible on each page in DATA_1","0","TC 02.01.50 - Check display of placeholder in Subscribe Email Field on each page specified in DATA_1","tests","Fri Dec 06 01:50:13 GMT 2024","skipped","Fri Dec 06 01:50:13 GMT 2024","TestFooter","test_footer","",""
"Check that two elements in Gear Deals section are displayed and enabled","32","TC 10.03.02, 10.02.04 - Verify 2 links in Gear Deals section are visible and clickable","tests","Fri Dec 06 02:06:17 GMT 2024","passed","Fri Dec 06 02:06:17 GMT 2024","TestSalePage","test_sale","",""
"Check if all the fields are getting cleared after failed attempt to reset password with invalid captcha","0","TC 17.01.27 Verify all fields got cleared after the failed attempt to reset password","tests","Fri Dec 06 01:51:20 GMT 2024","skipped","Fri Dec 06 01:51:20 GMT 2024","TestForgotYourPasswordFunctionality","test_forgot_your_password","",""
"
            This test will check that after clicking on the add to wishlist button,
            you are redirected to the My Wishlist page
            User is not authorized
            ","5241","Check the transition to the page my wish after clicking on the button. User is not authorized","tests","Fri Dec 06 01:58:05 GMT 2024","passed","Fri Dec 06 01:58:10 GMT 2024","TestMainPage","test_main_page","",""
"Verify that the click on the block 'Luma shorts' correctly redirects to a new webpage","0","TC 14.06.26 Verify the click on the block 'Luma shorts' redirects to a correct page.","tests","Fri Dec 06 02:03:46 GMT 2024","skipped","Fri Dec 06 02:03:46 GMT 2024","TestMenPagePromoBlock","test_men","",""
"Check if Note is present under New Customers Heading","74","TC 03.01.20 Verify New Customers note","tests","Fri Dec 06 02:10:31 GMT 2024","passed","Fri Dec 06 02:10:31 GMT 2024","TestNewCustomers","test_sign_in","",""
"Verify that the link ""here"" redirects to the main page.","3636","tc 07.01.04 Verify that here link leads to the main page","tests","Fri Dec 06 02:07:31 GMT 2024","passed","Fri Dec 06 02:07:35 GMT 2024","TestShoppingCart","test_shopping_cart","",""
"This test checks if info block in section 2 block 2 'home-t-shirts' is displayed
            in the Promo Block under header on the main page","1698","TC 13.01.22 - Check the display of the info block in block 2 't-shirts' in the Promo Block","tests","Fri Dec 06 01:59:31 GMT 2024","passed","Fri Dec 06 01:59:33 GMT 2024","TestMainPage","test_main_page","",""
"Check 'Bottoms' subsection link in 'Women' section click redirects to the Bottoms page and         the 'Bottoms' header is displayed","5278","TC 01.03.12 correctness of the ""Bottoms"" link of the ""Women"" section","tests","Fri Dec 06 01:56:53 GMT 2024","passed","Fri Dec 06 01:56:58 GMT 2024","TestHeader","test_header","",""
"This test check the cursor change when hovering over the cart buttons","2191","test_tc_06_01_10_check_the_cursor_change_to_cart_button[add_to_wish_list]","tests","Fri Dec 06 01:57:41 GMT 2024","passed","Fri Dec 06 01:57:43 GMT 2024","TestMainPage","test_main_page","",""
"Verify that text-3 in 'Luma tees' block correctly displayed","0","TC 14.06.31 Verify that the 'Shop Tees' text is visible.","tests","Fri Dec 06 02:03:46 GMT 2024","skipped","Fri Dec 06 02:03:46 GMT 2024","TestMenPagePromoBlock","test_men","",""
"Checks if text of 'Subscribe to our mailing list' link is correct on each page in DATA_1","0","TC 02.01.56 - Check text of 'Subscribe to our mailing list' link on each page specified in DATA_1","tests","Fri Dec 06 01:50:13 GMT 2024","skipped","Fri Dec 06 01:50:13 GMT 2024","TestFooter","test_footer","",""
"Verify the link 'What's new' is visible and interactive","2690","TC 01.03.01 visible and interactive the link ""What is New""","tests","Fri Dec 06 01:52:51 GMT 2024","passed","Fri Dec 06 01:52:54 GMT 2024","TestHeader","test_header","",""
"Check title-text and content-text in 3-columns block - sale-20-off","127","TC 10.04.11 - Verify the text in 3-columns block- sale-20-off","tests","Fri Dec 06 02:07:16 GMT 2024","passed","Fri Dec 06 02:07:17 GMT 2024","TestSalePage","test_sale","",""
"Checks if Email field in Subscribe section is present in the DOM tree on each page specified in DATA_1","0","TC 02.01.47 - Check Email field in Subscribe section is present in the DOM tree on each page specified in DATA_1","tests","Fri Dec 06 01:50:13 GMT 2024","skipped","Fri Dec 06 01:50:13 GMT 2024","TestFooter","test_footer","",""
"Verify the 'My Wish List' subtitle is visible","2179","TC 18.01.02 subtitle is displayed text My Wish List","tests","Fri Dec 06 02:12:52 GMT 2024","passed","Fri Dec 06 02:12:54 GMT 2024","TestTrainingVideoDownload","test_training_video_download","",""
"Checking title of the Shopping Options section","1679","test_tc_19_01_01","tests","Fri Dec 06 02:03:57 GMT 2024","passed","Fri Dec 06 02:03:58 GMT 2024","TestPromotionPantsPage","test_promotion_pants","",""
"This test check the cursor change when hovering over the block training erin","0","TC 16.02.07 Check the cursor change to block training erin","tests","Fri Dec 06 02:12:45 GMT 2024","skipped","Fri Dec 06 02:12:45 GMT 2024","TestMainPage","test_training","",""
"Verify that the subhead 'BOTTOMS' is displayed","2576","TC 14.04.01 Verify the 'BOTTOMS' subhead is displayed","tests","Fri Dec 06 02:03:16 GMT 2024","passed","Fri Dec 06 02:03:19 GMT 2024","TestMenPage","test_men","",""
"This test checks if the info block title in section 2 block 1 'home-pants' is correct
            in the Promo Block under header on the Main Page","1794","TC 13.01.18 - Check the display of the title in block 1 'home-pants' in the Promo Block","tests","Fri Dec 06 01:59:15 GMT 2024","passed","Fri Dec 06 01:59:17 GMT 2024","TestMainPage","test_main_page","",""
"This test check the color change when hovering over the Add to Cart button","1919","TC 06.01.09 - check the color change to add to cart button","tests","Fri Dec 06 01:57:34 GMT 2024","passed","Fri Dec 06 01:57:36 GMT 2024","TestMainPage","test_main_page","",""
"Check that six links in Women's Deals section lead to the correct pages after click","1269","TC 10.01.03, 10.01.05, 10.01.07, 10.01.09, 10.01.11, 10.01.13 - Verify 6 links in Women's Deals open the correct pages","tests","Fri Dec 06 02:05:15 GMT 2024","broken","Fri Dec 06 02:05:17 GMT 2024","TestSalePage","test_sale","",""
"This test checks if Advanced Search link is clickable on each page specified in DATA_1","2036","TC 02.01.15 - Check if Advanced Search link is clickable on each page specified in DATA_1","tests","Fri Dec 06 01:49:09 GMT 2024","passed","Fri Dec 06 01:49:11 GMT 2024","TestFooter","test_footer","",""
"This test checks if an image in section 1 'home-main' is visible","2113","TC 13.01.03 - Check the display of an image in section 1 'home-main' in the Promo Block","tests","Fri Dec 06 01:58:22 GMT 2024","passed","Fri Dec 06 01:58:24 GMT 2024","TestMainPage","test_main_page","",""
"This test checks if the image in section 2 block 4 'home-performance' is correct","2742","TC 13.01.31_01 - Check correctness of the image in block 4 'home-performance' in the Promo Block","tests","Fri Dec 06 02:00:07 GMT 2024","passed","Fri Dec 06 02:00:10 GMT 2024","TestMainPage","test_main_page","",""
"Verify that the image in the block 'Last chance for pants' is displayed on the Men page","0","TC 14.06.16 Verify the visibility of the image in the 'Last chance for pants' promo block.","tests","Fri Dec 06 02:03:46 GMT 2024","skipped","Fri Dec 06 02:03:46 GMT 2024","TestMenPagePromoBlock","test_men","",""
"Verify title 'Video Download' is visible","1738","TC 18.02.01 title ""Video Download"" is visible","tests","Fri Dec 06 02:13:02 GMT 2024","passed","Fri Dec 06 02:13:04 GMT 2024","TestTrainingVideoDownload","test_training_video_download","",""
"Check if the 'Reload captcha' button is present","0","TC 17.01.14 Verify Reload captcha button is present","tests","Fri Dec 06 01:51:13 GMT 2024","skipped","Fri Dec 06 01:51:13 GMT 2024","TestForgotYourPassword","test_forgot_your_password","",""
"Check error message on attempt to reset password with empty captcha input field","0","TC 17.01.26 Verify error on resetting My Password with empty captcha","tests","Fri Dec 06 01:51:20 GMT 2024","skipped","Fri Dec 06 01:51:20 GMT 2024","TestForgotYourPasswordFunctionality","test_forgot_your_password","",""
"Verify that text-1 in 'Save up to $24!' block correctly displayed","0","TC 14.06.11 Verify that the 'Save up to $24!' text in the 'Save up to $24!' promo block is visible.","tests","Fri Dec 06 02:03:46 GMT 2024","skipped","Fri Dec 06 02:03:46 GMT 2024","TestMenPagePromoBlock","test_men","",""
"Checks if Copyright text is present in the DOM tree on each page specified in DATA_1","2887","TC 02.01.35 - Check Copyright text is present in the DOM tree on each page specified in DATA_1","tests","Fri Dec 06 01:50:03 GMT 2024","passed","Fri Dec 06 01:50:06 GMT 2024","TestFooter","test_footer","",""
" Verify that Password input field highlighted when clicked","767","TC 04_01_14 Verify Password input field highlighting on click","tests","Fri Dec 06 01:46:51 GMT 2024","passed","Fri Dec 06 01:46:52 GMT 2024","TestCreateAnAccount","test_create_an_account","",""
"Checks if 'Contact us' link is present in the DOM tree on each page specified in DATA_1","0","TC 02.01.23 - Check 'Contact us' link is present in the DOM tree on each page specified in DATA_1","tests","Fri Dec 06 01:49:45 GMT 2024","skipped","Fri Dec 06 01:49:45 GMT 2024","TestFooter","test_footer","",""
"","2218","TC 14.02.04 Verify the link 'Bottoms' is visible and clickable.","tests","Fri Dec 06 02:02:18 GMT 2024","passed","Fri Dec 06 02:02:20 GMT 2024","TestMenPage","test_men","",""
"This test checks if the sign in info block in section 2 block 2 'home-t-shirts' is correct
            in the Promo Block under header on the main page","1919","TC 13.01.25 - Check the display of the sign in block 2 'home-t-shirts' in the Promo Block","tests","Fri Dec 06 01:59:40 GMT 2024","passed","Fri Dec 06 01:59:42 GMT 2024","TestMainPage","test_main_page","",""
" Verify presence of Confirm Password label and the required asterisk ","895","TC 04_01_16 Verify presence of Confirm Password label and the required asterisk","tests","Fri Dec 06 01:46:59 GMT 2024","passed","Fri Dec 06 01:47:00 GMT 2024","TestCreateAnAccount","test_create_an_account","",""
"Check the ""Search"" field is activated with a vertical flashing symbol ""|"" and highlighted","2645","TC 01.02.01 display and interactivity of the ""Search"" field","tests","Fri Dec 06 01:52:29 GMT 2024","passed","Fri Dec 06 01:52:32 GMT 2024","TestHeader","test_header","",""
"This test checks Order ID input field is visible","61","TC 05.01.03 - Verify that 'Order ID' input field is visible","tests","Fri Dec 06 02:03:55 GMT 2024","passed","Fri Dec 06 02:03:55 GMT 2024","TestOrdersAndReturnsPage","test_orders_and_returns","",""
"Checks if text on Subscribe Button is present in the DOM tree on each page specified in DATA_1","0","TC 02.01.44 - Check text on Subscribe Button is present in the DOM tree on each page specified in DATA_1","tests","Fri Dec 06 01:50:13 GMT 2024","skipped","Fri Dec 06 01:50:13 GMT 2024","TestFooter","test_footer","",""
"This test checks if block 1 'home-pants' in section 2 in the Promo Block is present
            in the DOM tree on the main page","1730","TC 13.01.44 - Check block 1 'home-pants' in section 2 of the Promo Block is present in the DOM tree","tests","Fri Dec 06 02:01:01 GMT 2024","passed","Fri Dec 06 02:01:02 GMT 2024","TestMainPage","test_main_page","",""
"Verify the link 'What's new' redirected to the page and the 'What's new' header is displayed","3640","TC 01.03.02 correctly redirected the_link ""What is New""","tests","Fri Dec 06 01:53:05 GMT 2024","passed","Fri Dec 06 01:53:08 GMT 2024","TestHeader","test_header","",""
"Check that two links in Gear Deals section lead to the correct pages after click","1886","TC 10.03.03, 10.03.05 - Verify 2 links in Gear Deals open the correct pages","tests","Fri Dec 06 02:06:28 GMT 2024","passed","Fri Dec 06 02:06:30 GMT 2024","TestSalePage","test_sale","",""
"Verify that text-2 in 'Luma shorts' block correctly displayed","0","TC 14.06.24 Verify that the 'Cool it now' text is visible.","tests","Fri Dec 06 02:03:46 GMT 2024","skipped","Fri Dec 06 02:03:46 GMT 2024","TestMenPagePromoBlock","test_men","",""
"Checks if 'Subscribe to our mailing list' link is present in the DOM tree on each page
        specified in DATA_1","0","TC 02.01.52 - Check 'Subscribe to our mailing list' link is present in the DOM tree on each page specified in DATA_1","tests","Fri Dec 06 01:50:13 GMT 2024","skipped","Fri Dec 06 01:50:13 GMT 2024","TestFooter","test_footer","",""
"Check Sidebar Shop By title has correct text and is visible","97","TC 16.01.01 Verify Sidebar panel title Shop By is visible and contains text 'Shop By'","tests","Fri Dec 06 02:12:25 GMT 2024","passed","Fri Dec 06 02:12:25 GMT 2024","TestMainPage","test_training","",""
"This test checks if section 1 in the Promo Block is present in the DOM tree on the main page","3215","TC 13.01.42 - Check section 1 in the Promo Block is present in the DOM tree","tests","Fri Dec 06 02:00:53 GMT 2024","passed","Fri Dec 06 02:00:56 GMT 2024","TestMainPage","test_main_page","",""
"Check 'Pants' subsection link click in 'Men' section redirects to the Pants page and         the 'Pants' header is displayed","4259","TC 01.03.25 correctness of the ""Pants"" link of the ""Men"" section","tests","Fri Dec 06 01:53:24 GMT 2024","passed","Fri Dec 06 01:53:28 GMT 2024","TestHeader","test_header","",""
"Checks if Copyright section is visible on each page in DATA_1","1897","TC 02.01.34 - Check display of Copyright section on each page specified in DATA_1","tests","Fri Dec 06 01:49:53 GMT 2024","passed","Fri Dec 06 01:49:55 GMT 2024","TestFooter","test_footer","",""
"Checks if text of placeholder in Subscribe Email Field is correct on each page in DATA_1","0","TC 02.01.51 - Check text of placeholder in Subscribe Email Field on each page specified in DATA_1","tests","Fri Dec 06 01:50:13 GMT 2024","skipped","Fri Dec 06 01:50:13 GMT 2024","TestFooter","test_footer","",""
"Check img existence of Gear Deals section","74","TC 10.04.07 - Verify that the Gear Deals contains an image","tests","Fri Dec 06 02:06:39 GMT 2024","passed","Fri Dec 06 02:06:39 GMT 2024","TestSalePage","test_sale","",""
" Verify presence of Password Strength note ","54","TC 04_01_15 Verify presence of password strength hint","tests","Fri Dec 06 01:46:56 GMT 2024","passed","Fri Dec 06 01:46:56 GMT 2024","TestCreateAnAccount","test_create_an_account","",""
"Check that two links in Gear Deals section lead to the correct pages after click","1492","TC 10.04.03, 10.04.06, 10.04.09 - Verify that links in Main block, 2 columns block open the correct pages","tests","Fri Dec 06 02:06:53 GMT 2024","passed","Fri Dec 06 02:06:54 GMT 2024","TestSalePage","test_sale","",""
"This test checks if Orders and Returns link is clickable on each page specified in DATA_1","1867","TC 02.01.20 - Check if Orders and Returns link is clickable on each page specified in DATA_1","tests","Fri Dec 06 01:49:33 GMT 2024","passed","Fri Dec 06 01:49:35 GMT 2024","TestFooter","test_footer","",""
"Checks if text of Search Terms link is correct on each page in DATA_1","0","TC 02.01.07 - Check text of Search Terms link on each page specified in DATA_1","tests","Fri Dec 06 01:48:25 GMT 2024","skipped","Fri Dec 06 01:48:25 GMT 2024","TestFooter","test_footer","",""
"Checks if placeholder in Subscribe Email Field is visible on each page in DATA_1","0","TC 02.01.50 - Check display of placeholder in Subscribe Email Field on each page specified in DATA_1","tests","Fri Dec 06 01:50:13 GMT 2024","skipped","Fri Dec 06 01:50:13 GMT 2024","TestFooter","test_footer","",""
"Check that six elements in Women's Deals section are displayed and enabled","32","TC 10.01.02, 10.01.04, 10.01.06, 10.01.08, 10.01.10, 10.01.12 - Verify 6 links in Women's Deals section are visible and clickable","tests","Fri Dec 06 02:04:58 GMT 2024","passed","Fri Dec 06 02:04:58 GMT 2024","TestSalePage","test_sale","",""
"This test checks if the sign in info block in section 2 block 1 'home-pants' is correct
            in the Promo Block under header on the Main Page","1897","TC 13.01.20 - Check the display of the sign in block 1 'home-pants' in the Promo Block","tests","Fri Dec 06 01:59:21 GMT 2024","passed","Fri Dec 06 01:59:23 GMT 2024","TestMainPage","test_main_page","",""
"
        The user is NOT logged in, located in the product card, section ""Reviews""
        1. All required fields are filled with correct data
        2. Pressed 1 star
        3.The ""Submit Review"" button is pressed
        Result: Present in the DOM and visible on the page the message: ""You submitted your review for moderation.""
        This code works when run on Win, Mac, Ubuntu on a real laptop and has the features of working on GitHub Action.
        When interacting with the GitHub Action, it checks not for the text of the ""Success"" message, but for the ""Success"" URL""
        ","3365","TC 01_15_01 Verify possibility to vote with 1 star","tests","Fri Dec 06 02:04:03 GMT 2024","broken","Fri Dec 06 02:04:07 GMT 2024","TestReviews","test_reviews_page","",""
"Checks if Subscribe Button is present in the DOM tree on each page specified in DATA_1","0","TC 02.01.40 - Check Subscribe Button is present in the DOM tree on each page specified in DATA_1","tests","Fri Dec 06 01:50:13 GMT 2024","skipped","Fri Dec 06 01:50:13 GMT 2024","TestFooter","test_footer","",""
