"DESCRIPTION","DURATION IN MS","NAME","PARENT SUITE","START TIME","STATUS","STOP TIME","SUB SUITE","SUITE","TEST CLASS","TEST METHOD"
" Verify presence of First name label and the required asterisk ","75","TC 04_01_03 Verify presence of First name label and the required asterisk","tests","Sun May 04 01:23:52 GMT 2025","passed","Sun May 04 01:23:52 GMT 2025","TestCreateAnAccount","test_create_an_account","",""
"Check if 'Create an Account' button has correct link and is clickable","46","TC 03.01.22 Verify Create an Account button link","tests","Sun May 04 01:46:24 GMT 2025","passed","Sun May 04 01:46:24 GMT 2025","TestNewCustomers","test_sign_in","",""
" Verify that customer can't Create An Account with empty first name","447","test 04.02.02 create an account with empty first name","tests","Sun May 04 01:24:40 GMT 2025","passed","Sun May 04 01:24:40 GMT 2025","TestCreateAnAccount","test_create_an_account","",""
"Verify that the image in the block 'Save up to $24!' is displayed on the Men page","0","TC 14.06.10 Verify the visibility of the image in the 'Save up to $24!' promo block.","tests","Sun May 04 01:39:38 GMT 2025","skipped","Sun May 04 01:39:38 GMT 2025","TestMenPagePromoBlock","test_men","",""
"Verify the subtotal amounts in the item cart and in the summary cart are the same.","590","tc 07.02.05 Verify the subtotal amounts in the item cart and in the Summary cart are the same.","tests","Sun May 04 01:43:23 GMT 2025","passed","Sun May 04 01:43:23 GMT 2025","TestShoppingCartFull","test_shopping_cart","",""
"Check the 'Tops' subsection in 'Men' section is displayed and the 'Jackets', 'Shorts',         'Hoodies & Sweatshirts', 'Tees' and 'Tanks' subsections is displayed","1731","TC 01.03.17 display and interactivity of the ""Tops"" section of the ""Men"" section","tests","Sun May 04 01:29:26 GMT 2025","passed","Sun May 04 01:29:28 GMT 2025","TestHeader","test_header","",""
"Check if the captcha input field is present","0","TC 17.01.09 Verify FYP captcha input field is present","tests","Sun May 04 01:27:30 GMT 2025","skipped","Sun May 04 01:27:30 GMT 2025","TestForgotYourPassword","test_forgot_your_password","",""
"Check the list appears with sections 'My Account', 'My Wish List', 'Sign Out' after clicking the button,        then clicking on 'My Account' redirects to the account page with the header 'My Account' displayed","8116","TC 01.01.10 functionality of the ""My account"" section in the dropdown list","tests","Sun May 04 01:30:29 GMT 2025","broken","Sun May 04 01:30:37 GMT 2025","TestHeader","test_header","",""
"Check that fitness_equipment link is correct","1698","test_TC_11_01_05","tests","Sun May 04 01:27:47 GMT 2025","passed","Sun May 04 01:27:49 GMT 2025","TestGearPage","test_gear","",""
"This test checks if info block in section 2 block 2 'home-t-shirts' is displayed
            in the Promo Block under header on the main page","6339","TC 13.01.22 - Check the display of the info block in block 2 't-shirts' in the Promo Block","tests","Sun May 04 01:34:45 GMT 2025","broken","Sun May 04 01:34:51 GMT 2025","TestMainPage","test_main_page","",""
"Checks if text of 'Subscribe to our mailing list' link is correct on each page in DATA_1","0","TC 02.01.56 - Check text of 'Subscribe to our mailing list' link on each page specified in DATA_1","tests","Sun May 04 01:26:51 GMT 2025","skipped","Sun May 04 01:26:51 GMT 2025","TestFooter","test_footer","",""
"Check that two links in Gear Deals section lead to the correct pages after click","599","TC 10.04.03, 10.04.06, 10.04.09 - Verify that links in Main block, 2 columns block open the correct pages","tests","Sun May 04 01:42:30 GMT 2025","passed","Sun May 04 01:42:30 GMT 2025","TestSalePage","test_sale","",""
"Check that five links in Men's Deals section lead to the correct pages after click","672","TC 10.02.03, 10.02.05, 10.02.07, 10.02.09, 10.02.11 - Verify 5 links in Men's Deals open the correct pages","tests","Sun May 04 01:41:41 GMT 2025","passed","Sun May 04 01:41:42 GMT 2025","TestSalePage","test_sale","",""
"This test checks if the image in section 2 block 3 'home-erin' is visible","1150","TC 13.01.26 - Check the display of an image in block 3 'home-erin' in the Promo Block","tests","Sun May 04 01:35:01 GMT 2025","broken","Sun May 04 01:35:02 GMT 2025","TestMainPage","test_main_page","",""
"Check that Contact Us link in footer is correct","0","TC 02.02.05 - Check Contact Us link in footer leads to the correct page from each page specified in DATA_1","tests","Sun May 04 01:27:10 GMT 2025","skipped","Sun May 04 01:27:10 GMT 2025","TestFooter","test_footer","",""
"Checks if the Search Terms link is present in the DOM tree on each page specified in DATA_1","1226","TC 02.01.03 - Check Search Terms link is present in the DOM tree on each page specified in DATA_1","tests","Sun May 04 01:25:17 GMT 2025","passed","Sun May 04 01:25:18 GMT 2025","TestFooter","test_footer","",""
"Checks if Write for us link is visible on each page in DATA_1","0","TC 02.01.29 - Check display of Write for us link on each page specified in DATA_1","tests","Sun May 04 01:26:31 GMT 2025","skipped","Sun May 04 01:26:31 GMT 2025","TestFooter","test_footer","",""
"Verify 'Training' link click redirected to the page and the 'Training' header is displayed","1755","TC 01.03.33 correctly redirected the link ""Training""","tests","Sun May 04 01:28:29 GMT 2025","passed","Sun May 04 01:28:30 GMT 2025","TestHeader","test_header","",""
"Checks if text on Subscribe Button is visible on each page in DATA_1","0","TC 02.01.45 - Check display of text on Subscribe Button on each page specified in DATA_1","tests","Sun May 04 01:26:51 GMT 2025","skipped","Sun May 04 01:26:51 GMT 2025","TestFooter","test_footer","",""
"Check if the password input field is of correct format (input-text) and clickable","49","TC 03.01.10 Verify Password field is correct format and clickable","tests","Sun May 04 01:45:52 GMT 2025","passed","Sun May 04 01:45:52 GMT 2025","TestRegisteredCustomers","test_sign_in","",""
" Verify presence of Password Strength hint and warning color of weak password ","260","TC 04_02_09_13 Verify presence of strong password strength hint","tests","Sun May 04 01:25:09 GMT 2025","passed","Sun May 04 01:25:10 GMT 2025","TestCreateAnAccount","test_create_an_account","",""
"Checks if Orders and Returns link is present in the DOM tree on each page specified in DATA_1","1091","TC 02.01.18 - Check Orders and Returns link is present in the DOM tree on each page specified in DATA_1","tests","Sun May 04 01:26:16 GMT 2025","passed","Sun May 04 01:26:17 GMT 2025","TestFooter","test_footer","",""
"Checks if 'Contact us' link is present in the DOM tree on each page specified in DATA_1","0","TC 02.01.23 - Check 'Contact us' link is present in the DOM tree on each page specified in DATA_1","tests","Sun May 04 01:26:31 GMT 2025","skipped","Sun May 04 01:26:31 GMT 2025","TestFooter","test_footer","",""
"Verify that text-2 in 'Luma shorts' block correctly displayed","0","TC 14.06.24 Verify that the 'Cool it now' text is visible.","tests","Sun May 04 01:39:38 GMT 2025","skipped","Sun May 04 01:39:38 GMT 2025","TestMenPagePromoBlock","test_men","",""
"Check img existence of Women's Deals section","43","TC 10.04.01 - Verify that the Women Deals contains an image","tests","Sun May 04 01:42:11 GMT 2025","passed","Sun May 04 01:42:11 GMT 2025","TestSalePage","test_sale","",""
"Verify the 'My Wish List' subtitle is visible","940","TC 18.01.02 subtitle is displayed text My Wish List","tests","Sun May 04 01:48:09 GMT 2025","passed","Sun May 04 01:48:10 GMT 2025","TestTrainingVideoDownload","test_training_video_download","",""
"Check that six elements in Women's Deals section are displayed and enabled","27","TC 10.01.02, 10.01.04, 10.01.06, 10.01.08, 10.01.10, 10.01.12 - Verify 6 links in Women's Deals section are visible and clickable","tests","Sun May 04 01:41:04 GMT 2025","passed","Sun May 04 01:41:04 GMT 2025","TestSalePage","test_sale","",""
"Check that Write for us link in footer is correct","0","TC 02.02.06 - Check Write for us link in footer leads to the correct page from each page specified in DATA_1","tests","Sun May 04 01:27:10 GMT 2025","skipped","Sun May 04 01:27:10 GMT 2025","TestFooter","test_footer","",""
"This test checks if block 5 'home-eco' in section 2 in the Promo Block is present
            in the DOM tree on the main page","6690","TC 13.01.48 - Check block 5 'home-eco' in section 2 of the Promo Block is present in the DOM tree","tests","Sun May 04 01:37:04 GMT 2025","broken","Sun May 04 01:37:10 GMT 2025","TestMainPage","test_main_page","",""
"Check the 'Bottoms' subsection in 'Women' section is displayed and the 'Pants' and 'Shorts'         subsections is displayed","1907","TC 01.03.11 display and interactivity of the ""Bottoms"" section of the ""Women"" section","tests","Sun May 04 01:31:24 GMT 2025","passed","Sun May 04 01:31:26 GMT 2025","TestHeader","test_header","",""
" Verify that customer can't Create An Account with empty e-mail","405","test 04.02.04 create an account with empty e-mail","tests","Sun May 04 01:24:46 GMT 2025","passed","Sun May 04 01:24:46 GMT 2025","TestCreateAnAccount","test_create_an_account","",""
"","1188","TC 14.02.04 Verify the link 'Bottoms' is visible and clickable.","tests","Sun May 04 01:38:50 GMT 2025","passed","Sun May 04 01:38:51 GMT 2025","TestMenPage","test_men","",""
"This test checks if 'Subscribe to our mailing list' link is clickable on each page specified in DATA_1","0","TC 02.01.54 - Check if 'Subscribe to our mailing list' link is clickable on each page specified in DATA_1","tests","Sun May 04 01:26:51 GMT 2025","skipped","Sun May 04 01:26:51 GMT 2025","TestFooter","test_footer","",""
"This test checks if Subscribe Button is clickable on each page specified in DATA_1","0","TC 02.01.42 - Check if Subscribe Button is clickable on each page specified in DATA_1","tests","Sun May 04 01:26:51 GMT 2025","skipped","Sun May 04 01:26:51 GMT 2025","TestFooter","test_footer","",""
"Verify that text-3 in 'Save up to $24!' block correctly displayed","0","TC 14.06.13 Verify that the 'Shop Tees' text in the 'Save up to $24!' promo block is visible.","tests","Sun May 04 01:39:38 GMT 2025","skipped","Sun May 04 01:39:38 GMT 2025","TestMenPagePromoBlock","test_men","",""
"Checks if Search Terms link is visible on each page in DATA_1","1572","TC 02.01.04 - Check display of Search Terms link on each page specified in DATA_1","tests","Sun May 04 01:25:22 GMT 2025","passed","Sun May 04 01:25:24 GMT 2025","TestFooter","test_footer","",""
"Check the list appears with sections 'My Account', 'My Wish List', 'Sign Out' after clicking the button,        then clicking on 'My Wish List' redirects to the account page with the header 'My Wish List' displayed","8067","TC 01.01.11 functionality of the ""My Wish List"" section in the dropdown list","tests","Sun May 04 01:30:38 GMT 2025","broken","Sun May 04 01:30:46 GMT 2025","TestHeader","test_header","",""
"Verify that the subhead 'BOTTOMS' is displayed","1118","TC 14.04.01 Verify the 'BOTTOMS' subhead is displayed","tests","Sun May 04 01:39:22 GMT 2025","passed","Sun May 04 01:39:23 GMT 2025","TestMenPage","test_men","",""
"Check the 'Create an account' link is not displayed if the user is authorized","8314","TC 01.01.06 absence of the ""Create an account"" link display","tests","Sun May 04 01:29:29 GMT 2025","broken","Sun May 04 01:29:38 GMT 2025","TestHeader","test_header","",""
"
            This test will check that after clicking on the add to wishlist button,
            you are redirected to the My Wishlist page
            User is not authorized
            ","3044","Check the transition to the page my wish after clicking on the button. User is not authorized","tests","Sun May 04 01:32:44 GMT 2025","skipped","Sun May 04 01:32:47 GMT 2025","TestMainPage","test_main_page","",""
"Check if the Email input is of correct format (input-text) and clickable","44","TC 03.01.05 Verify Email field is correct format and clickable","tests","Sun May 04 01:45:38 GMT 2025","passed","Sun May 04 01:45:38 GMT 2025","TestRegisteredCustomers","test_sign_in","",""
"Check Success and Failed Login, no error validation","3049","TC 03.02.01 to 03_02_10 Verify Failed Login, no error validation","tests","Sun May 04 01:47:09 GMT 2025","passed","Sun May 04 01:47:12 GMT 2025","TestFailedLogin","test_sign_in","",""
"This test checks if Promo Block under header is displayed on the Main Page","1111","TC 13.01.01 - Check the display of the Promo Block under header on the Main Page","tests","Sun May 04 01:32:51 GMT 2025","passed","Sun May 04 01:32:53 GMT 2025","TestMainPage","test_main_page","",""
"Check Top Videos title has correct text and is visible","0","TC 16.02.05 Verify title Training is visible and contains text 'Top Videos'","tests","Sun May 04 01:48:03 GMT 2025","skipped","Sun May 04 01:48:03 GMT 2025","TestMainPage","test_training","",""
"Checks if Subscribe Button is visible on each page in DATA_1","0","TC 02.01.41 - Check display of Subscribe Button on each page specified in DATA_1","tests","Sun May 04 01:26:51 GMT 2025","skipped","Sun May 04 01:26:51 GMT 2025","TestFooter","test_footer","",""
"Verify that the click on the block 'Last chance for pants' correctly redirects to a new webpage","0","TC 14.06.20 Verify the click on the block 'Last chance for pants' redirects to a correct page.","tests","Sun May 04 01:39:38 GMT 2025","skipped","Sun May 04 01:39:38 GMT 2025","TestMenPagePromoBlock","test_men","",""
"Verify message ""We can not find products matching the selection."" is visible","1005","TC 18.02.02 Verify message ""We can not find products matching the selection."" is visible","tests","Sun May 04 01:48:18 GMT 2025","passed","Sun May 04 01:48:19 GMT 2025","TestTrainingVideoDownload","test_training_video_download","",""
"This test checks that the card has title","1494","test_verify_the_card_has_title","tests","Sun May 04 01:31:44 GMT 2025","passed","Sun May 04 01:31:46 GMT 2025","TestMainPage","test_main_page","",""
"This test checks if block 2 'home-t-shirts' in section 2 in the Promo Block is present
            in the DOM tree on the main page","6553","TC 13.01.45 - Check block 2 'home-t-shirts' in section 2 of the Promo Block is present in the DOM tree","tests","Sun May 04 01:36:39 GMT 2025","broken","Sun May 04 01:36:45 GMT 2025","TestMainPage","test_main_page","",""
"Check that two links in Gear Deals section lead to the correct pages after click","578","TC 10.03.03, 10.03.05 - Verify 2 links in Gear Deals open the correct pages","tests","Sun May 04 01:42:08 GMT 2025","passed","Sun May 04 01:42:08 GMT 2025","TestSalePage","test_sale","",""
"Verify that the image in the block 'Luma shorts' is displayed on the Men page","0","TC 14.06.22 Verify the visibility of the image in the 'Luma shorts' promo block.","tests","Sun May 04 01:39:38 GMT 2025","skipped","Sun May 04 01:39:38 GMT 2025","TestMenPagePromoBlock","test_men","",""
" Verify presence of Password Strength hint and warning color of weak password ","271","TC 04_02_09_13 Verify presence of strong password strength hint","tests","Sun May 04 01:25:07 GMT 2025","passed","Sun May 04 01:25:07 GMT 2025","TestCreateAnAccount","test_create_an_account","",""
"This test checks if the info block text in section 1 'home-main' is correct
            in the Promo Block under header on the Main Page","1161","TC 13.01.06 - Check the display of the info block text in section 1 'home-main' in the Promo Block","tests","Sun May 04 01:33:01 GMT 2025","passed","Sun May 04 01:33:02 GMT 2025","TestMainPage","test_main_page","",""
"Check 'Pants' subsection link click in 'Women' section redirects to the Pants page and         the 'Pants' header is displayed","2695","TC 01.03.13 correctness of the ""Pants"" link of the ""Women"" section","tests","Sun May 04 01:31:33 GMT 2025","passed","Sun May 04 01:31:36 GMT 2025","TestHeader","test_header","",""
"This test checks if Section 2 in Promo Block under header is displayed on the Main Page","6692","TC 13.01.09 - Check the display of Section 2 in the Promo Block","tests","Sun May 04 01:33:06 GMT 2025","broken","Sun May 04 01:33:13 GMT 2025","TestMainPage","test_main_page","",""
"Checks if Subscribe Email Field is visible on each page in DATA_1","0","TC 02.01.48 - Check display of Subscribe Email Field on each page specified in DATA_1","tests","Sun May 04 01:26:51 GMT 2025","skipped","Sun May 04 01:26:51 GMT 2025","TestFooter","test_footer","",""
"Verify that the block 'Luma shorts' is displayed on the Men page","0","TC 14.06.21 Verify the visibility of 'Luma shorts' promo block.","tests","Sun May 04 01:39:38 GMT 2025","skipped","Sun May 04 01:39:38 GMT 2025","TestMenPagePromoBlock","test_men","",""
"Check that table headers in item cart are visible","33","test_tc_07_02_02_Verify_table_headers_in_item_cart_are_visible[t_header0]","tests","Sun May 04 01:44:21 GMT 2025","passed","Sun May 04 01:44:21 GMT 2025","TestShoppingCartFull","test_shopping_cart","",""
"This test checks if section 2 in the Promo Block is present in the DOM tree on the main page","6364","TC 13.01.43 - Check section 2 in the Promo Block is present in the DOM tree","tests","Sun May 04 01:36:22 GMT 2025","broken","Sun May 04 01:36:28 GMT 2025","TestMainPage","test_main_page","",""
"Checks if Subscribe Button is present in the DOM tree on each page specified in DATA_1","0","TC 02.01.40 - Check Subscribe Button is present in the DOM tree on each page specified in DATA_1","tests","Sun May 04 01:26:51 GMT 2025","skipped","Sun May 04 01:26:51 GMT 2025","TestFooter","test_footer","",""
"This test checks if section 1 in the Promo Block is present in the DOM tree on the main page","1175","TC 13.01.42 - Check section 1 in the Promo Block is present in the DOM tree","tests","Sun May 04 01:36:20 GMT 2025","passed","Sun May 04 01:36:21 GMT 2025","TestMainPage","test_main_page","",""
"This test checks if block 2 'home-t-shirts' is displayed in section 2 of Promo Block under header
             on the Main Page","6481","TC 13.01.11 - Check display of block 2 'home-t-shirts' in section 2 in the Promo Block","tests","Sun May 04 01:33:22 GMT 2025","broken","Sun May 04 01:33:29 GMT 2025","TestMainPage","test_main_page","",""
"Checks if the footer is present in the DOM tree on each page specified in DATA_1","0","TC 02.01.01 - Check Footer is present in the DOM tree on each page specified in DATA_1","tests","Sun May 04 01:25:10 GMT 2025","skipped","Sun May 04 01:25:10 GMT 2025","TestFooter","test_footer","",""
"Checks if Subscribe Email Field is visible on each page in DATA_1","0","TC 02.01.48 - Check display of Subscribe Email Field on each page specified in DATA_1","tests","Sun May 04 01:26:51 GMT 2025","skipped","Sun May 04 01:26:51 GMT 2025","TestFooter","test_footer","",""
"This test checks if block 4 'home-performance' in section 2 in the Promo Block is present
            in the DOM tree on the main page","6624","TC 13.01.47 - Check block 4 'home-performance' in section 2 of the Promo Block is present in the DOM tree","tests","Sun May 04 01:36:55 GMT 2025","broken","Sun May 04 01:37:02 GMT 2025","TestMainPage","test_main_page","",""
"This test checks if the image in section 2 block 5 'home-eco' is correct
            in the Promo Block under header on the main page","6546","TC 13.01.36 - Check the display of the image in block 5 'home-eco' in the Promo Block","tests","Sun May 04 01:35:46 GMT 2025","broken","Sun May 04 01:35:53 GMT 2025","TestMainPage","test_main_page","",""
"Check title-text and content-text in 2 columns block - Men's Deals","78","TC 10.04.05 - Verify the text in 2 columns block - Men's Deals","tests","Sun May 04 01:42:20 GMT 2025","passed","Sun May 04 01:42:20 GMT 2025","TestSalePage","test_sale","",""
"Check Login Page Heading is present ","40","TC 03.01.01 Verify Sign In Page h1 Header","tests","Sun May 04 01:45:28 GMT 2025","passed","Sun May 04 01:45:28 GMT 2025","TestRegisteredCustomers","test_sign_in","",""
"Check the 'Bottoms' subsection in 'Men' section is displayed and the 'Pants' and 'Shorts'         subsections is displayed","1810","TC 01.03.23 display and interactivity of the ""Bottoms"" section of the ""Men"" section","tests","Sun May 04 01:28:53 GMT 2025","passed","Sun May 04 01:28:54 GMT 2025","TestHeader","test_header","",""
"Check Success and Failed Login, no error validation","2621","TC 03.02.01 to 03_02_10 Verify Failed Login, no error validation","tests","Sun May 04 01:47:05 GMT 2025","passed","Sun May 04 01:47:08 GMT 2025","TestFailedLogin","test_sign_in","",""
"Check if 'Create an Account' button is present","52","TC 03.01.21 Verify presence of Create an Account button ","tests","Sun May 04 01:46:21 GMT 2025","passed","Sun May 04 01:46:21 GMT 2025","TestNewCustomers","test_sign_in","",""
"This test checks that if a product has a review, then the product card has a rating","1496","test_check_card_rating","tests","Sun May 04 01:31:53 GMT 2025","passed","Sun May 04 01:31:54 GMT 2025","TestMainPage","test_main_page","",""
"Check Success and Failed Login, no error validation","1513","TC 03.02.01 to 03_02_10 Verify Failed Login, no error validation","tests","Sun May 04 01:46:59 GMT 2025","passed","Sun May 04 01:47:01 GMT 2025","TestFailedLogin","test_sign_in","",""
"Check that link in section 2 block 5 'home-eco' is correct","6672","TC 13.02.06 - Check the link in section 2 block 5 'home-eco' in the Promo Block leads to the correct page","tests","Sun May 04 01:38:36 GMT 2025","broken","Sun May 04 01:38:42 GMT 2025","TestMainPage","test_main_page","",""
"This test checks if the image in section 2 block 4 'home-performance' is correct","1352","TC 13.01.31_01 - Check correctness of the image in block 4 'home-performance' in the Promo Block","tests","Sun May 04 01:35:27 GMT 2025","broken","Sun May 04 01:35:28 GMT 2025","TestMainPage","test_main_page","",""
"Verify that text-1 in 'Luma hoodies' block correctly displayed","0","TC 14.06.35 Verify that the 'Luma hoodies' text is visible.","tests","Sun May 04 01:39:38 GMT 2025","skipped","Sun May 04 01:39:38 GMT 2025","TestMenPagePromoBlock","test_men","",""
"Verify the link 'Training' is visible and interactive and link 'Video Download' is visible","1496","TC_01_03_32_visible_and_interactive_the_link_""Training""","tests","Sun May 04 01:28:35 GMT 2025","passed","Sun May 04 01:28:36 GMT 2025","TestHeader","test_header","",""
"Check 'Pants' subsection link click in 'Men' section redirects to the Pants page and         the 'Pants' header is displayed","2481","TC 01.03.25 correctness of the ""Pants"" link of the ""Men"" section","tests","Sun May 04 01:28:59 GMT 2025","passed","Sun May 04 01:29:02 GMT 2025","TestHeader","test_header","",""
"Verify that text-3 in 'Luma hoodies' block correctly displayed","0","TC 14.06.37 Verify that the 'Shop Hoodies' text is visible.","tests","Sun May 04 01:39:38 GMT 2025","skipped","Sun May 04 01:39:38 GMT 2025","TestMenPagePromoBlock","test_men","",""
"This test check the cursor change when hovering over the block training main","0","TC 16.02.06 Check the cursor change to block training main ","tests","Sun May 04 01:48:03 GMT 2025","skipped","Sun May 04 01:48:03 GMT 2025","TestMainPage","test_training","",""
"Checks if 'Subscribe to our mailing list' link is visible on each page specified in DATA_1","0","TC 02.01.53 - Check 'Subscribe to our mailing list' link is visible on each page specified in DATA_1","tests","Sun May 04 01:26:51 GMT 2025","skipped","Sun May 04 01:26:51 GMT 2025","TestFooter","test_footer","",""
"This test checks if Write for us link is clickable on each page specified in DATA_1","0","TC 02.01.30 - Check if Write for us link is clickable on each page specified in DATA_1","tests","Sun May 04 01:26:31 GMT 2025","skipped","Sun May 04 01:26:31 GMT 2025","TestFooter","test_footer","",""
" Verify presence of Password label and the required asterisk ","717","TC 04_01_13 Verify presence of Password label and the required asterisk","tests","Sun May 04 01:24:20 GMT 2025","passed","Sun May 04 01:24:21 GMT 2025","TestCreateAnAccount","test_create_an_account","",""
"Verify that the link 'Tees' is displayed and clickable","1705","TC 14.03.06 Verify the link 'Tees' is visible and clickable.","tests","Sun May 04 01:39:10 GMT 2025","passed","Sun May 04 01:39:12 GMT 2025","TestMenPage","test_men","",""
"Check that bags link is correct","1938","test_TC_11_01_03","tests","Sun May 04 01:27:42 GMT 2025","passed","Sun May 04 01:27:44 GMT 2025","TestGearPage","test_gear","",""
"This test checks if the image in section 1 'home-main' is correct","1166","TC 13.01.04 - Check correctness of the image in section 1 'home-main' in the Promo Block","tests","Sun May 04 01:32:59 GMT 2025","passed","Sun May 04 01:33:00 GMT 2025","TestMainPage","test_main_page","",""
"This test checks if info block in section 2 block 4 'home-performance' is displayed in the Promo Block
            under header on the Main Page","6606","TC 13.01.32 - Check the display of the info block in block 4 'home-performance' in the Promo Block","tests","Sun May 04 01:35:29 GMT 2025","broken","Sun May 04 01:35:36 GMT 2025","TestMainPage","test_main_page","",""
"This test checks if the image in section 2 block 2 'home-t-shirts' is visible","1296","TC 13.01.21 - Check the display of an image in block 2 'home-t-shirts' in the Promo Block","tests","Sun May 04 01:34:39 GMT 2025","broken","Sun May 04 01:34:40 GMT 2025","TestMainPage","test_main_page","",""
"Check that link in section 2 block 2 'home-t-shirts' is correct","6898","TC 13.02.03 - Check the link in section 2 block 2 'home-t-shirts' in the Promo Block leads to the correct page","tests","Sun May 04 01:38:10 GMT 2025","broken","Sun May 04 01:38:17 GMT 2025","TestMainPage","test_main_page","",""
