"DESCRIPTION","DURATION IN MS","NAME","PARENT SUITE","START TIME","STATUS","STOP TIME","SUB SUITE","SUITE","TEST CLASS","TEST METHOD"
"This test checks if the info block title in section 1 'home-main' is correct
            in the Promo Block under header on the Main Page","1226","TC 13.01.07 - Check the display of the info block title in section 1 'home-main' in the Promo Block","tests","Sun May 04 01:33:04 GMT 2025","passed","Sun May 04 01:33:05 GMT 2025","TestMainPage","test_main_page","",""
"This test checks if the info block text in section 2 block 3 'home-erin' is correct
            in the Promo Block under header on the main page","1151","TC 13.01.29 - Check the display of the text in block 3 'home-erin' in the Promo Block","tests","Sun May 04 01:35:18 GMT 2025","broken","Sun May 04 01:35:20 GMT 2025","TestMainPage","test_main_page","",""
"Checks if Subscribe section is visible on each page in DATA_1","0","TC 02.01.39 - Check display of Subscribe section on each page specified in DATA_1","tests","Sun May 04 01:26:51 GMT 2025","skipped","Sun May 04 01:26:51 GMT 2025","TestFooter","test_footer","",""
"This test checks if info block in section 2 block 5 'home-eco' is displayed
            in the Promo Block under header on the Main Page","6803","TC 13.01.37 - Check the display of the info block in block 5 'home-eco' in the Promo Block","tests","Sun May 04 01:36:00 GMT 2025","broken","Sun May 04 01:36:07 GMT 2025","TestMainPage","test_main_page","",""
"Checks if Privacy and Cookie Policy link is present in the DOM tree on each page specified in DATA_1","1060","TC 02.01.08 - Check Privacy and Cookie Policy link is present in the DOM tree on each page specified in DATA_1","tests","Sun May 04 01:25:35 GMT 2025","passed","Sun May 04 01:25:36 GMT 2025","TestFooter","test_footer","",""
"Check that six links in Women's Deals section lead to the correct pages after click","632","TC 10.01.03, 10.01.05, 10.01.07, 10.01.09, 10.01.11, 10.01.13 - Verify 6 links in Women's Deals open the correct pages","tests","Sun May 04 01:41:09 GMT 2025","passed","Sun May 04 01:41:09 GMT 2025","TestSalePage","test_sale","",""
"Checks if Email field in Subscribe section is present in the DOM tree on each page specified in DATA_1","0","TC 02.01.47 - Check Email field in Subscribe section is present in the DOM tree on each page specified in DATA_1","tests","Sun May 04 01:26:51 GMT 2025","skipped","Sun May 04 01:26:51 GMT 2025","TestFooter","test_footer","",""
"
        The user is NOT logged in, located in the product card, section ""Reviews""
        1. All required fields are filled with correct data
        2. Pressed 3 star
        3.The ""Submit Review"" button is pressed
        Result: Present in the DOM and visible on the page the message: ""You submitted your review for moderation.
        This code works when run on Win, Mac, Ubuntu on a real laptop and has the features of working on GitHub Action.
        When interacting with the GitHub Action, it checks not for the text of the ""Success"" message, but for the ""Success"" URL""
        ","10428","TC 01_15_01 Verify possibility to vote with 3 stars","tests","Sun May 04 01:40:16 GMT 2025","passed","Sun May 04 01:40:26 GMT 2025","TestReviews","test_reviews_page","",""
"Check the 'Sign In' link is not displayed if the user is authorized","8318","TC 01.01.07 absence of the ""Sign In"" link display","tests","Sun May 04 01:29:39 GMT 2025","broken","Sun May 04 01:29:48 GMT 2025","TestHeader","test_header","",""
"Check that the cursor changes to a 'hand' indicating the logo is a clickable element,         and that clicking on it causes the page to reload and redirect to the main page","1544","TC 01.02.04 display and interactivity of the logo","tests","Sun May 04 01:28:08 GMT 2025","passed","Sun May 04 01:28:09 GMT 2025","TestHeader","test_header","",""
"Check if all the fields are getting cleared after failed attempt to reset password with invalid captcha","0","TC 17.01.27 Verify all fields got cleared after the failed attempt to reset password","tests","Sun May 04 01:27:36 GMT 2025","skipped","Sun May 04 01:27:36 GMT 2025","TestForgotYourPasswordFunctionality","test_forgot_your_password","",""
"Check 'Hoodies & Sweatshirts' subsection link click in 'Men' section redirects to the         Hoodies & Sweatshirts-men page and the 'Hoodies & Sweatshirts' header is displayed","2807","TC 01.03.20 correctness of the ""Hoodies & Sweatshirts"" link of the ""Men"" section","tests","Sun May 04 01:30:16 GMT 2025","passed","Sun May 04 01:30:19 GMT 2025","TestHeader","test_header","",""
"This test checks block-promo training-main is displayed","0","TC 16.02.02 - Check the display of block 1 main","tests","Sun May 04 01:48:03 GMT 2025","skipped","Sun May 04 01:48:03 GMT 2025","TestMainPage","test_training","",""
"Check the display of the dropdown list after clicking the button if the user is authorized","7945","TC 01.01.09 functionality of the dropdown list button","tests","Sun May 04 01:29:59 GMT 2025","broken","Sun May 04 01:30:07 GMT 2025","TestHeader","test_header","",""
"Checks if text of Write for us link is correct on each page in DATA_1","0","TC 02.01.32 - Check text of Write for us link on each page specified in DATA_1","tests","Sun May 04 01:26:31 GMT 2025","skipped","Sun May 04 01:26:31 GMT 2025","TestFooter","test_footer","",""
"Check title of Women's Deals section","44","TC 10.01.01 - Verify 'WOMEN'S DEALS' title is correct","tests","Sun May 04 01:40:52 GMT 2025","failed","Sun May 04 01:40:52 GMT 2025","TestSalePage","test_sale","",""
"Check that five elements in Men's Deals section are displayed and enabled","28","TC 10.02.02, 10.02.04, 10.02.06, 10.02.08, 10.02.10 - Verify 5 links in Men's Deals section are visible and clickable","tests","Sun May 04 01:41:36 GMT 2025","passed","Sun May 04 01:41:36 GMT 2025","TestSalePage","test_sale","",""
"Checks if Privacy and Cookie Policy link is visible on each page in DATA_1","1209","TC 02.01.09 - Check display of Privacy and Cookie Policy link on each page specified in DATA_1","tests","Sun May 04 01:25:39 GMT 2025","passed","Sun May 04 01:25:41 GMT 2025","TestFooter","test_footer","",""
"Check 'Shorts' subsection link click in 'Women' section redirects to the Shorts page and         the 'Shorts' header is displayed","3060","TC 01.03.14 correctness of the ""Shorts"" link of the ""Women"" section","tests","Sun May 04 01:31:37 GMT 2025","passed","Sun May 04 01:31:40 GMT 2025","TestHeader","test_header","",""
"Check title of Gear Deals section","46","TC 10.03.01 - Verify 'GEAR DEALS' title is correct","tests","Sun May 04 01:41:58 GMT 2025","failed","Sun May 04 01:41:58 GMT 2025","TestSalePage","test_sale","",""
"Checks if text on Subscribe Button is correct on each page in DATA_1","0","TC 02.01.46 - Check text on Subscribe Button on each page specified in DATA_1","tests","Sun May 04 01:26:51 GMT 2025","skipped","Sun May 04 01:26:51 GMT 2025","TestFooter","test_footer","",""
"Check if 'Create an Account' button link opens correct page","771","TC 03.01.23 Verify Create an Account button is functional","tests","Sun May 04 01:46:27 GMT 2025","passed","Sun May 04 01:46:27 GMT 2025","TestNewCustomers","test_sign_in","",""
"Verify that the link ""here"" redirects to the main page.","2103","tc 07.01.04 Verify that here link leads to the main page","tests","Sun May 04 01:42:53 GMT 2025","passed","Sun May 04 01:42:55 GMT 2025","TestShoppingCart","test_shopping_cart","",""
"Verify that the block 'Luma tees' is displayed on the Men page","0","TC 14.06.27 Verify the visibility of 'Luma tees' promo block.","tests","Sun May 04 01:39:38 GMT 2025","skipped","Sun May 04 01:39:38 GMT 2025","TestMenPagePromoBlock","test_men","",""
"This test checks if an image in section 1 'home-main' is visible","1197","TC 13.01.03 - Check the display of an image in section 1 'home-main' in the Promo Block","tests","Sun May 04 01:32:56 GMT 2025","passed","Sun May 04 01:32:57 GMT 2025","TestMainPage","test_main_page","",""
"Check 'Create an account' link click redirects to the accounts registration page and         the ""Create New Customer Account"" header is displayed","2069","TC 01.01.03 correctness of the ""Create an account"" link","tests","Sun May 04 01:27:58 GMT 2025","passed","Sun May 04 01:28:00 GMT 2025","TestHeader","test_header","",""
"Check that link in section 2 block 1 'home-pants' is correct","7427","TC 13.02.02 - Check the link in section 2 block 1 'home-pants' in the Promo Block leads to the correct page","tests","Sun May 04 01:38:00 GMT 2025","broken","Sun May 04 01:38:07 GMT 2025","TestMainPage","test_main_page","",""
"Verify that the 'Proceed to checkout' button redirects to the shipping page.","6019","tc 07.02.08 Verify that 'Proceed to checkout' button redirects to the shipping page","tests","Sun May 04 01:43:35 GMT 2025","passed","Sun May 04 01:43:41 GMT 2025","TestShoppingCartFull","test_shopping_cart","",""
"Check Success Login with correct credentials","1937","TC 03.02.09 Verify login with valid mail containing trailing leading_spaces - Positive","tests","Sun May 04 01:46:44 GMT 2025","passed","Sun May 04 01:46:46 GMT 2025","TestLogin","test_sign_in","",""
"Check if the password input field is present","44","TC 03.01.09 Verify Password field is present","tests","Sun May 04 01:45:49 GMT 2025","passed","Sun May 04 01:45:49 GMT 2025","TestRegisteredCustomers","test_sign_in","",""
" Verify that Last name input field highlighted when clicked","671","TC 04_01_08 Verify Last name input field highlighting on click","tests","Sun May 04 01:24:08 GMT 2025","passed","Sun May 04 01:24:08 GMT 2025","TestCreateAnAccount","test_create_an_account","",""
"Checks if Subscribe section is present in the DOM tree on each page specified in DATA_1","0","TC 02.01.38 - Check Subscribe section is present in the DOM tree on each page specified in DATA_1","tests","Sun May 04 01:26:51 GMT 2025","skipped","Sun May 04 01:26:51 GMT 2025","TestFooter","test_footer","",""
"Check that two links in Gear Deals section lead to the correct pages after click","513","TC 10.04.03, 10.04.06, 10.04.09 - Verify that links in Main block, 2 columns block open the correct pages","tests","Sun May 04 01:42:32 GMT 2025","passed","Sun May 04 01:42:33 GMT 2025","TestSalePage","test_sale","",""
"Verify the message 'You have no items in your wish list.' is visible","987","TC 18.01.04 message no items to compare is displayed","tests","Sun May 04 01:48:13 GMT 2025","passed","Sun May 04 01:48:14 GMT 2025","TestTrainingVideoDownload","test_training_video_download","",""
"This test checks for the same titles after clicking on the product card and going to the product page","2357","test_check_for_duplicate_titles_after_clicking_on_the_card","tests","Sun May 04 01:31:47 GMT 2025","passed","Sun May 04 01:31:49 GMT 2025","TestMainPage","test_main_page","",""
"Check hovering over the shopping cart icon changes the cursor to a ""hand,"" indicating that the cart is a         clickable element, click on it and the message ""You have no items in your shopping cart."" appears","1490","TC 01.02.05 display and interactivity of the cart icon","tests","Sun May 04 01:28:14 GMT 2025","passed","Sun May 04 01:28:15 GMT 2025","TestHeader","test_header","",""
"Check title-text and content-text in 3-columns block - sale-20-off","87","TC 10.04.11 - Verify the text in 3-columns block- sale-20-off","tests","Sun May 04 01:42:42 GMT 2025","passed","Sun May 04 01:42:42 GMT 2025","TestSalePage","test_sale","",""
"Check Category title is visible","1054","TC 12.02.01 Check side panel title Category is visible","tests","Sun May 04 01:48:22 GMT 2025","passed","Sun May 04 01:48:24 GMT 2025","TestWomenPage","test_women","",""
"Checks if text of Search Terms link is correct on each page in DATA_1","0","TC 02.01.07 - Check text of Search Terms link on each page specified in DATA_1","tests","Sun May 04 01:25:34 GMT 2025","skipped","Sun May 04 01:25:34 GMT 2025","TestFooter","test_footer","",""
"This test checks block-promo training-on-demand is displayed","0","TC 16.02.04 - Check the display of block 3 on demand","tests","Sun May 04 01:48:03 GMT 2025","skipped","Sun May 04 01:48:03 GMT 2025","TestMainPage","test_training","",""
"Check that fitness_equipment is displayed and enabled","1083","test_tc_11_01_04","tests","Sun May 04 01:27:45 GMT 2025","passed","Sun May 04 01:27:46 GMT 2025","TestGearPage","test_gear","",""
"Check error message on attempt to reset password with empty captcha input field","0","TC 17.01.26 Verify error on resetting My Password with empty captcha","tests","Sun May 04 01:27:36 GMT 2025","skipped","Sun May 04 01:27:36 GMT 2025","TestForgotYourPasswordFunctionality","test_forgot_your_password","",""
"This test checks if the info block title in section 2 block 3 'home-erin' is correct
            in the Promo Block under header on the main page","1515","TC 13.01.28 - Check the display of the title in block 3 'home-erin' in the Promo Block","tests","Sun May 04 01:35:15 GMT 2025","broken","Sun May 04 01:35:17 GMT 2025","TestMainPage","test_main_page","",""
"Checks if Search Terms link is visible on each page in DATA_1","1118","TC 02.01.04 - Check display of Search Terms link on each page specified in DATA_1","tests","Sun May 04 01:25:25 GMT 2025","passed","Sun May 04 01:25:26 GMT 2025","TestFooter","test_footer","",""
"Checks if text of Advanced Search link is correct on each page in DATA_1","1141","TC 02.01.17 - Check text of Advanced Search link on each page specified in DATA_1","tests","Sun May 04 01:26:08 GMT 2025","passed","Sun May 04 01:26:10 GMT 2025","TestFooter","test_footer","",""
"Check that Advanced Search link in footer is correct","2272","TC 02.02.03 - Check Advanced Search link in footer leads to the correct page from each page specified in DATA_1","tests","Sun May 04 01:26:58 GMT 2025","passed","Sun May 04 01:27:01 GMT 2025","TestFooter","test_footer","",""
" Verify presence of Password Strength note ","50","TC 04_01_15 Verify presence of password strength hint","tests","Sun May 04 01:24:26 GMT 2025","passed","Sun May 04 01:24:26 GMT 2025","TestCreateAnAccount","test_create_an_account","",""
"Checks if Write for us link is present in the DOM tree on each page specified in DATA_1","0","TC 02.01.28 - Check Write for us link is present in the DOM tree on each page specified in DATA_1","tests","Sun May 04 01:26:31 GMT 2025","skipped","Sun May 04 01:26:31 GMT 2025","TestFooter","test_footer","",""
"Check if items are visible","1062","TC 12.05.01/02/03/04 Check the Sidebar text is visible","tests","Sun May 04 01:48:25 GMT 2025","passed","Sun May 04 01:48:26 GMT 2025","TestWomenPage","test_women","",""
"Checks if text of Advanced Search link is correct on each page in DATA_1","1046","TC 02.01.17 - Check text of Advanced Search link on each page specified in DATA_1","tests","Sun May 04 01:26:11 GMT 2025","passed","Sun May 04 01:26:12 GMT 2025","TestFooter","test_footer","",""
"Check that five links in Men's Deals section lead to the correct pages after click","634","TC 10.02.03, 10.02.05, 10.02.07, 10.02.09, 10.02.11 - Verify 5 links in Men's Deals open the correct pages","tests","Sun May 04 01:41:50 GMT 2025","passed","Sun May 04 01:41:50 GMT 2025","TestSalePage","test_sale","",""
"Check 'Tops' subsection link click in 'Men' section redirects to the Tops-men page and         the 'Tops' header is displayed","2573","TC 01.03.18 correctness of the ""Tops"" link of the ""Men"" section","tests","Sun May 04 01:30:08 GMT 2025","passed","Sun May 04 01:30:11 GMT 2025","TestHeader","test_header","",""
"Check if Password field is appropriately labeled ","74","TC 03.01.11 Verify Password field is appropriately labeled","tests","Sun May 04 01:45:54 GMT 2025","passed","Sun May 04 01:45:54 GMT 2025","TestRegisteredCustomers","test_sign_in","",""
"Check Success and Failed Login, no error validation","2740","TC 03.02.01 to 03_02_10 Verify Failed Login, no error validation","tests","Sun May 04 01:47:24 GMT 2025","passed","Sun May 04 01:47:27 GMT 2025","TestFailedLogin","test_sign_in","",""
"Check the 'Tops' subsection in 'Women' section is displayed and the 'Jackets', 'Shorts',         'Hoodies & Sweatshirts', 'Tees' and 'Bras & Tanks' subsections is displayed","1965","TC 01.03.05 display and interactivity of the ""Tops"" section of the ""Women"" section","tests","Sun May 04 01:30:57 GMT 2025","passed","Sun May 04 01:30:59 GMT 2025","TestHeader","test_header","",""
"This test checks if Advanced Search link is clickable on each page specified in DATA_1","1123","TC 02.01.15 - Check if Advanced Search link is clickable on each page specified in DATA_1","tests","Sun May 04 01:26:04 GMT 2025","passed","Sun May 04 01:26:05 GMT 2025","TestFooter","test_footer","",""
"This test checks if the info block text in section 2 block 4 'home-performance' is correct
            in the Promo Block under header on the main page","1161","TC 13.01.34 - Check the display of the text in block 4 'home-performance' in the Promo Block","tests","Sun May 04 01:35:41 GMT 2025","broken","Sun May 04 01:35:42 GMT 2025","TestMainPage","test_main_page","",""
"Check 'Create an account' link is displayed and underlined","1652","TC 01.01.02 display and interactivity of the ""Create an account"" link","tests","Sun May 04 01:27:55 GMT 2025","passed","Sun May 04 01:27:57 GMT 2025","TestHeader","test_header","",""
"This test checks if the sign in info block in section 2 block 5 'home-eco' is correct
            in the Promo Block under header on the main page","1154","TC 13.01.40 - Check the display of the sign in block 5 'home-eco' in the Promo Block","tests","Sun May 04 01:36:15 GMT 2025","broken","Sun May 04 01:36:16 GMT 2025","TestMainPage","test_main_page","",""
"This test check the cursor change when hovering over the cart buttons","1514","test_tc_06_01_10_check_the_cursor_change_to_cart_button[add_to_wish_list]","tests","Sun May 04 01:32:04 GMT 2025","passed","Sun May 04 01:32:06 GMT 2025","TestMainPage","test_main_page","",""
"Check error message on attempt to log in with empty password","388","TC 03.02.05 Verify error on attempting to log in with empty email - Negative","tests","Sun May 04 01:46:37 GMT 2025","passed","Sun May 04 01:46:37 GMT 2025","TestLogin","test_sign_in","",""
"This test checks if section 1 in Promo Block under header is clickable","1262","TC 13.01.49 - Check if section 1 is clickable in the Promo Block on the main page","tests","Sun May 04 01:37:12 GMT 2025","passed","Sun May 04 01:37:13 GMT 2025","TestMainPage","test_main_page","",""
"Verify Order Total in Summary: Order Total = Subtotal - Discount + Tax and displayed correctly.","3495","tc 07.02.23 Verify Order Total in Summury displayed correctly.","tests","Sun May 04 01:44:04 GMT 2025","passed","Sun May 04 01:44:08 GMT 2025","TestShoppingCartFull","test_shopping_cart","",""
"This test checks if block 3 'home-erin' is displayed in section 2 of Promo Block under header
            on the Main Page","6078","TC 13.01.12 - Check display of block 3 'home-erin' in section 2 in the Promo Block","tests","Sun May 04 01:33:31 GMT 2025","broken","Sun May 04 01:33:37 GMT 2025","TestMainPage","test_main_page","",""
"This test checks the color change of the add to wishlist button and add to compare button on hover","1527","test_tc_06_01_12_the_color_change_my_wish_and_add_to_compare_button[add_to_wish_list]","tests","Sun May 04 01:32:10 GMT 2025","passed","Sun May 04 01:32:11 GMT 2025","TestMainPage","test_main_page","",""
"Verify that the link 'Tanks' correctly opens and redirects to a new webpage,         the header 'Tanks' is displayed","1744","TC 14.03.09 Verify the link 'Tanks' redirects to a correct page.","tests","Sun May 04 01:39:19 GMT 2025","passed","Sun May 04 01:39:21 GMT 2025","TestMenPage","test_men","",""
"This test checks if the info block text in section 2 block 2 'home-t-shirts' is correct
            in the Promo Block under header on the main page","1235","TC 13.01.24 - Check the display of the text in block 2 'home-t-shirts' in the Promo Block","tests","Sun May 04 01:34:56 GMT 2025","broken","Sun May 04 01:34:57 GMT 2025","TestMainPage","test_main_page","",""
"Verify that the link 'Hoodies&Sweatshirts' correctly opens and redirects to a new webpage, the header         'Hoodies&Sweatshirt' is displayed","1851","TC 14.03.03 Verify the link 'Hoodies&Sweatshirts' redirects to a correct page.","tests","Sun May 04 01:39:01 GMT 2025","passed","Sun May 04 01:39:03 GMT 2025","TestMenPage","test_men","",""
"Check Success and Failed Login, no error validation","1800","TC 03.02.01 to 03_02_10 Verify Failed Login, no error validation","tests","Sun May 04 01:47:02 GMT 2025","passed","Sun May 04 01:47:04 GMT 2025","TestFailedLogin","test_sign_in","",""
"Checks if text of Write for us link is correct on each page in DATA_1","0","TC 02.01.32 - Check text of Write for us link on each page specified in DATA_1","tests","Sun May 04 01:26:31 GMT 2025","skipped","Sun May 04 01:26:31 GMT 2025","TestFooter","test_footer","",""
"Check if the Email input field is present","41","TC 17.01.03 Verify FYP Email field is present","tests","Sun May 04 01:27:17 GMT 2025","passed","Sun May 04 01:27:17 GMT 2025","TestForgotYourPassword","test_forgot_your_password","",""
"Check that six links in Women's Deals section lead to the correct pages after click","636","TC 10.01.03, 10.01.05, 10.01.07, 10.01.09, 10.01.11, 10.01.13 - Verify 6 links in Women's Deals open the correct pages","tests","Sun May 04 01:41:18 GMT 2025","passed","Sun May 04 01:41:18 GMT 2025","TestSalePage","test_sale","",""
"Checks if Subscribe section is visible on each page in DATA_1","0","TC 02.01.39 - Check display of Subscribe section on each page specified in DATA_1","tests","Sun May 04 01:26:51 GMT 2025","skipped","Sun May 04 01:26:51 GMT 2025","TestFooter","test_footer","",""
"Verify that the link 'Bottoms' correctly opens and redirects to a new webpage, the header 'Bottoms' is
          displayed","2004","TC 14.02.05 Verify the link 'Bottoms' redirects to a correct page.","tests","Sun May 04 01:38:52 GMT 2025","passed","Sun May 04 01:38:54 GMT 2025","TestMenPage","test_men","",""
"Verify that the link 'Shorts' correctly opens and redirects to a new webpage, the header 'Pants' is
              displayed","1870","TC 14.04.05 Verify the link 'Shorts' redirects to a correct page.","tests","Sun May 04 01:39:34 GMT 2025","passed","Sun May 04 01:39:36 GMT 2025","TestMenPage","test_men","",""
"Check that five links in Men's Deals section lead to the correct pages after click","647","TC 10.02.03, 10.02.05, 10.02.07, 10.02.09, 10.02.11 - Verify 5 links in Men's Deals open the correct pages","tests","Sun May 04 01:41:47 GMT 2025","passed","Sun May 04 01:41:48 GMT 2025","TestSalePage","test_sale","",""
"Check that the list of items in the Shopping Cart contains title item which was added from More Choices","5547","TC 07.02.27 Verify that the list of items in the Shopping Cart is displayed correct","tests","Sun May 04 01:45:09 GMT 2025","passed","Sun May 04 01:45:14 GMT 2025","TestShoppingCartFull","test_shopping_cart","",""
"Verify that the link 'Tees' correctly opens and redirects to a new webpage, the header 'Tees' is
        displayed","1913","TC 14.03.07 Verify the link 'Tees' redirects to a correct page.","tests","Sun May 04 01:39:13 GMT 2025","passed","Sun May 04 01:39:15 GMT 2025","TestMenPage","test_men","",""
"Verify the link 'Fitness Equipment' redirected to the page and the 'Fitness Equipment' header is displayed","2139","TC 01.03.30 correctly redirected the link ""Gear - Fitness Equipment""","tests","Sun May 04 01:29:17 GMT 2025","passed","Sun May 04 01:29:19 GMT 2025","TestHeader","test_header","",""
"Check that five elements in Men's Deals section are displayed and enabled","28","TC 10.02.02, 10.02.04, 10.02.06, 10.02.08, 10.02.10 - Verify 5 links in Men's Deals section are visible and clickable","tests","Sun May 04 01:41:39 GMT 2025","passed","Sun May 04 01:41:39 GMT 2025","TestSalePage","test_sale","",""
"Check that six elements in Women's Deals section are displayed and enabled","34","TC 10.01.02, 10.01.04, 10.01.06, 10.01.08, 10.01.10, 10.01.12 - Verify 6 links in Women's Deals section are visible and clickable","tests","Sun May 04 01:41:02 GMT 2025","passed","Sun May 04 01:41:02 GMT 2025","TestSalePage","test_sale","",""
"Check that six elements in Women's Deals section are displayed and enabled","33","TC 10.01.02, 10.01.04, 10.01.06, 10.01.08, 10.01.10, 10.01.12 - Verify 6 links in Women's Deals section are visible and clickable","tests","Sun May 04 01:40:55 GMT 2025","passed","Sun May 04 01:40:55 GMT 2025","TestSalePage","test_sale","",""
"Verify the 'Compare Products' subtitle is visible","1024","TC 18.01.01 subtitle is displayed text compare products","tests","Sun May 04 01:48:07 GMT 2025","passed","Sun May 04 01:48:08 GMT 2025","TestTrainingVideoDownload","test_training_video_download","",""
"
            This test will check that the add to wishlist and add to compare buttons are visible on the screen
            ","11509","Check the display of the add to wish and add to compare buttons","tests","Sun May 04 01:32:31 GMT 2025","skipped","Sun May 04 01:32:43 GMT 2025","TestMainPage","test_main_page","",""
"Checks if text of Copyright section is correct on each page in DATA_1","0","TC 02.01.37 - Check text of Copyright section on each page specified in DATA_1","tests","Sun May 04 01:26:51 GMT 2025","skipped","Sun May 04 01:26:51 GMT 2025","TestFooter","test_footer","",""
"Check 'Bottoms' subsection link in 'Women' section click redirects to the Bottoms page and         the 'Bottoms' header is displayed","4387","TC 01.03.12 correctness of the ""Bottoms"" link of the ""Women"" section","tests","Sun May 04 01:31:27 GMT 2025","passed","Sun May 04 01:31:32 GMT 2025","TestHeader","test_header","",""
