"Status","Start Time","Stop Time","Duration in ms","Parent Suite","Suite","Sub Suite","Test Class","Test Method","Name","Description"
"passed","Sun Dec 17 01:15:08 GMT 2023","Sun Dec 17 01:15:09 GMT 2023","989","tests","test_footer","TestFooter","","","TC 02.01.12 - Check text of Privacy and Cookie Policy link on each page specified in DATA_1","Checks if text of Privacy and Cookie Policy link matches expected on each page in DATA_1"
"passed","Sun Dec 17 01:18:44 GMT 2023","Sun Dec 17 01:18:45 GMT 2023","1369","tests","test_header","TestHeader","","","TC 01.02.05 display and interactivity of the cart icon","Check hovering over the shopping cart icon changes the cursor to a ""hand,"" indicating that the cart is a         clickable element, click on it and the message ""You have no items in your shopping cart."" appears"
"passed","Sun Dec 17 01:15:34 GMT 2023","Sun Dec 17 01:15:35 GMT 2023","858","tests","test_footer","TestFooter","","","TC 02.01.20 - Check if Orders and Returns link is clickable on each page specified in DATA_1","This test checks if Orders and Returns link is clickable on each page specified in DATA_1"
"passed","Sun Dec 17 01:36:20 GMT 2023","Sun Dec 17 01:36:22 GMT 2023","2245","tests","test_sign_in","TestFailedLogin","","","TC 03.02.02 to 03_02_10 Verify Error on Failed Login with invalid credentials","Check error on Failed Login with invalid credentials, case-sensitive password and password with spaces"
"passed","Sun Dec 17 01:16:00 GMT 2023","Sun Dec 17 01:16:01 GMT 2023","864","tests","test_footer","TestFooter","","","TC 02.01.28 - Check Write for us link is present in the DOM tree on each page specified in DATA_1","Checks if Write for us link is present in the DOM tree on each page specified in DATA_1"
"skipped","Sun Dec 17 01:16:32 GMT 2023","Sun Dec 17 01:16:32 GMT 2023","0","tests","test_footer","TestFooter","","","TC 02.01.42 - Check if Subscribe Button is clickable on each page specified in DATA_1","This test checks if Subscribe Button is clickable on each page specified in DATA_1"
"passed","Sun Dec 17 01:20:39 GMT 2023","Sun Dec 17 01:20:42 GMT 2023","3215","tests","test_header","TestHeader","","","TC 01.03.21 correctness of the ""Tees"" link of the ""Men"" section","Check 'Tees' subsection link click in 'Men' section redirects to the Tees-men page and         the 'Tees' header is displayed"
"passed","Sun Dec 17 01:22:50 GMT 2023","Sun Dec 17 01:22:51 GMT 2023","970","tests","test_main_page","TestMainPage","","","TC 13.01.16 - Check correctness of the image in block 1 'home-pants' in the Promo Block","This test checks if the image in section 2 block 1 'home-pants' is correct"
"passed","Sun Dec 17 01:15:00 GMT 2023","Sun Dec 17 01:15:01 GMT 2023","927","tests","test_footer","TestFooter","","","TC 02.01.09 - Check display of Privacy and Cookie Policy link on each page specified in DATA_1","Checks if Privacy and Cookie Policy link is visible on each page in DATA_1"
"passed","Sun Dec 17 01:16:58 GMT 2023","Sun Dec 17 01:17:00 GMT 2023","2202","tests","test_footer","TestFooter","","","TC 02.02.02 - Check Privacy and Cookie Policy link in footer leads to the correct page from each page specified in DATA_1","Check that Privacy and Cookie Policy link in footer is correct"
"passed","Sun Dec 17 01:16:14 GMT 2023","Sun Dec 17 01:16:15 GMT 2023","973","tests","test_footer","TestFooter","","","TC 02.01.33 - Check Copyright section is present in the DOM tree on each page specified in DATA_1","Checks if Copyright section is present in the DOM tree on each page specified in DATA_1"
"passed","Sun Dec 17 01:33:51 GMT 2023","Sun Dec 17 01:33:54 GMT 2023","2282","tests","test_shopping_cart","TestShoppingCartFull","","","tc 07.02.24 Verify the Apply Discount Code is displayed","Check that Apply Discount Code is displayed."
"passed","Sun Dec 17 01:19:49 GMT 2023","Sun Dec 17 01:19:51 GMT 2023","2196","tests","test_header","TestHeader","","","TC 01.03.28 correctly redirected the link ""Gear""","Verify the link 'Gear' redirected to the page and the 'Gear' header is displayed"
"broken","Sun Dec 17 01:25:59 GMT 2023","Sun Dec 17 01:26:05 GMT 2023","5998","tests","test_men","TestMenPagePromoBlock","","","TC 14.06.14 Verify the click on the block 'Save up to $24!' redirects to a correct page.","Verify that the click on the block 'Save up to $24!' correctly redirects to a new webpage"
"passed","Sun Dec 17 01:19:52 GMT 2023","Sun Dec 17 01:19:55 GMT 2023","2511","tests","test_header","TestHeader","","","TC 01.03.29 correctly redirected the link ""Gear - Bags""","Verify the link 'Bags' redirected to the page and the 'Bags' header is displayed"
"passed","Sun Dec 17 01:14:05 GMT 2023","Sun Dec 17 01:14:05 GMT 2023","621","tests","test_create_an_account","TestCreateAnAccount","","","test 04.02.04 create an account with empty e-mail"," Verify that customer can't Create An Account with empty e-mail"
"passed","Sun Dec 17 01:16:43 GMT 2023","Sun Dec 17 01:16:44 GMT 2023","1034","tests","test_footer","TestFooter","","","TC 02.01.54 - Check if 'Subscribe to our mailing list' link is clickable on each page specified in DATA_1","This test checks if 'Subscribe to our mailing list' link is clickable on each page specified in DATA_1"
"passed","Sun Dec 17 01:21:59 GMT 2023","Sun Dec 17 01:22:01 GMT 2023","1347","tests","test_main_page","TestMainPage","","","test_tc_06_01_10_check_the_cursor_change_to_cart_button[add_to_card]","This test check the cursor change when hovering over the cart buttons"
"passed","Sun Dec 17 01:30:31 GMT 2023","Sun Dec 17 01:30:32 GMT 2023","1026","tests","test_sale","TestSalePage","","","TC 10.01.03, 10.01.05, 10.01.07, 10.01.09, 10.01.11, 10.01.13 - Verify 6 links in Women's Deals open the correct pages","Check that six links in Women's Deals section lead to the correct pages after click"
"broken","Sun Dec 17 01:28:24 GMT 2023","Sun Dec 17 01:28:30 GMT 2023","6000","tests","test_men","TestMenPagePromoBlock","","","TC 14.06.34 Verify the visibility of the image in the 'Luma hoodies' promo block.","Verify that the image in the block 'Luma hoodies' is displayed on the Men page"
"passed","Sun Dec 17 01:24:09 GMT 2023","Sun Dec 17 01:24:10 GMT 2023","1034","tests","test_main_page","TestMainPage","","","TC 13.01.51 - Check if block 2 'home-t-shirts' in section 2 is clickablein the Promo Block on the main page","This test checks if block 2 'home-t-shirts' in section 2 in Promo Block under header is clickable"
"passed","Sun Dec 17 01:24:15 GMT 2023","Sun Dec 17 01:24:16 GMT 2023","974","tests","test_main_page","TestMainPage","","","TC 13.01.54 - Check if block 5 'home-eco' in section 2 is clickablein the Promo Block on the main page","This test checks if block 5 'home-eco' in section 2 in Promo Block under header is clickable"
"skipped","Sun Dec 17 01:18:00 GMT 2023","Sun Dec 17 01:18:00 GMT 2023","0","tests","test_forgot_your_password","TestForgotYourPassword","","","TC 17.01.15 Verify Reload captcha button is clickable","Check that the 'Reload captcha' button is clickable"
"passed","Sun Dec 17 01:20:30 GMT 2023","Sun Dec 17 01:20:33 GMT 2023","3258","tests","test_header","TestHeader","","","TC 01.03.19 correctness of the ""Jackets"" link of the ""Men"" section","Check 'Jackets' subsection link click in 'Men' section redirects to the Jackets-men page and         the 'Jackets' header is displayed"
"passed","Sun Dec 17 01:31:55 GMT 2023","Sun Dec 17 01:31:56 GMT 2023","1699","tests","test_shopping_cart","TestShoppingCart","","","tc 07.01.04 Verify that here link leads to the main page","Verify that the link ""here"" redirects to the main page."
"broken","Sun Dec 17 01:26:13 GMT 2023","Sun Dec 17 01:26:19 GMT 2023","6033","tests","test_men","TestMenPagePromoBlock","","","TC 14.06.16 Verify the visibility of the image in the 'Last chance for pants' promo block.","Verify that the image in the block 'Last chance for pants' is displayed on the Men page"
"passed","Sun Dec 17 01:23:24 GMT 2023","Sun Dec 17 01:23:24 GMT 2023","957","tests","test_main_page","TestMainPage","","","TC 13.01.31 - Check the display of an image in block 4 'home-performance' in the Promo Block","This test checks if the image in section 2 block 4 'home-performance' is visible"
"passed","Sun Dec 17 01:23:16 GMT 2023","Sun Dec 17 01:23:17 GMT 2023","905","tests","test_main_page","TestMainPage","","","TC 13.01.27 - Check the display of the info block in block 3 'home-erin' in the Promo Block","This test checks if info block in section 2 block 3 'home-erin' is displayed in the Promo Block
             under header on the Main Page"
"passed","Sun Dec 17 01:35:55 GMT 2023","Sun Dec 17 01:35:56 GMT 2023","1547","tests","test_sign_in","TestFailedLogin","","","TC 03.02.01 to 03_02_10 Verify Failed Login, no error validation","Check Success and Failed Login, no error validation"
"passed","Sun Dec 17 01:21:20 GMT 2023","Sun Dec 17 01:21:23 GMT 2023","3261","tests","test_header","TestHeader","","","TC 01.03.09 correctness of the ""Tees"" link of the ""Women"" section","Check 'Tees' subsection link click in 'Women' section redirects to the Tees-women page and         the 'Tees' header is displayed"
"broken","Sun Dec 17 01:28:53 GMT 2023","Sun Dec 17 01:28:59 GMT 2023","5929","tests","test_men","TestMenPagePromoBlock","","","TC 14.06.38 Verify the click on the block 'Luma hoodies' redirects to a correct page.","Verify that the click on the block 'Luma hoodies' correctly redirects to a new webpage"
"broken","Sun Dec 17 01:28:09 GMT 2023","Sun Dec 17 01:28:15 GMT 2023","5998","tests","test_men","TestMenPagePromoBlock","","","TC 14.06.32 Verify the click on the block 'Luma tees' redirects to a correct page.","Verify that the click on the block 'Luma tees' correctly redirects to a new webpage"
"passed","Sun Dec 17 01:22:16 GMT 2023","Sun Dec 17 01:22:17 GMT 2023","1273","tests","test_main_page","TestMainPage","","","Check the display of the add to wish and add to compare buttons","
            This test will check that the add to wishlist and add to compare buttons are visible on the screen
            "
"skipped","Sun Dec 17 01:18:00 GMT 2023","Sun Dec 17 01:18:00 GMT 2023","0","tests","test_forgot_your_password","TestForgotYourPassword","","","TC 17.01.10 Verify FYP captcha input field is correct format and clickable","Check if the captcha input is of correct format (input-text) and clickable"
"passed","Sun Dec 17 01:14:10 GMT 2023","Sun Dec 17 01:14:11 GMT 2023","622","tests","test_create_an_account","TestCreateAnAccount","","","test 04.02.06 create an account with empty confirm password"," Verify that customer can't Create An Account with empty confirm password"
"passed","Sun Dec 17 01:16:37 GMT 2023","Sun Dec 17 01:16:38 GMT 2023","1010","tests","test_footer","TestFooter","","","TC 02.01.53 - Check 'Subscribe to our mailing list' link is visible on each page specified in DATA_1","Checks if 'Subscribe to our mailing list' link is visible on each page specified in DATA_1"
"passed","Sun Dec 17 01:22:28 GMT 2023","Sun Dec 17 01:22:29 GMT 2023","786","tests","test_main_page","TestMainPage","","","TC 13.01.03 - Check the display of an image in section 1 'home-main' in the Promo Block","This test checks if an image in section 1 'home-main' is visible"
"passed","Sun Dec 17 01:18:23 GMT 2023","Sun Dec 17 01:18:24 GMT 2023","974","tests","test_gear","TestGearPage","","","test_tc_11_01_06","Check that watches is displayed and enabled"
"passed","Sun Dec 17 01:14:50 GMT 2023","Sun Dec 17 01:14:51 GMT 2023","859","tests","test_footer","TestFooter","","","TC 02.01.07 - Check text of Search Terms link on each page specified in DATA_1","Checks if text of Search Terms link is correct on each page in DATA_1"
"skipped","Sun Dec 17 01:16:32 GMT 2023","Sun Dec 17 01:16:32 GMT 2023","0","tests","test_footer","TestFooter","","","TC 02.01.38 - Check Subscribe section is present in the DOM tree on each page specified in DATA_1","Checks if Subscribe section is present in the DOM tree on each page specified in DATA_1"
"passed","Sun Dec 17 01:17:43 GMT 2023","Sun Dec 17 01:17:43 GMT 2023","57","tests","test_forgot_your_password","TestForgotYourPassword","","","TC 17.01.01 Verify Forgot Your Password Page h1 Header","Check Login Page Heading is present "
"passed","Sun Dec 17 01:31:52 GMT 2023","Sun Dec 17 01:31:54 GMT 2023","1234","tests","test_shopping_cart","TestShoppingCart","","","tc 07.01.03 Verify that here link is displayed and clickable","Check that the here link is displayed and clickable."
"passed","Sun Dec 17 01:15:50 GMT 2023","Sun Dec 17 01:15:51 GMT 2023","882","tests","test_footer","TestFooter","","","TC 02.01.25 - Check if 'Contact us' link is clickable on each page specified in DATA_1","This test checks if 'Contact us' link is clickable on each page specified in DATA_1"
"passed","Sun Dec 17 01:25:21 GMT 2023","Sun Dec 17 01:25:21 GMT 2023","850","tests","test_men","TestMenPagePromoBlock","","","TC 14.06.01 Verify the 'Men' header is displayed","Verify that the header 'Men' is displayed"
"passed","Sun Dec 17 01:19:59 GMT 2023","Sun Dec 17 01:20:02 GMT 2023","2578","tests","test_header","TestHeader","","","TC 01.03.31 correctly redirected the link ""Gear - Watches""","Verify the link 'Fitness Equipment' redirected to the page and the 'Fitness Equipment' header is displayed"
"passed","Sun Dec 17 01:22:58 GMT 2023","Sun Dec 17 01:22:59 GMT 2023","907","tests","test_main_page","TestMainPage","","","TC 13.01.20 - Check the display of the sign in block 1 'home-pants' in the Promo Block","This test checks if the sign in info block in section 2 block 1 'home-pants' is correct
            in the Promo Block under header on the Main Page"
"passed","Sun Dec 17 01:24:25 GMT 2023","Sun Dec 17 01:24:27 GMT 2023","1673","tests","test_main_page","TestMainPage","","","TC 13.02.04 - Check the link in section 2 block 3 'home-erin' in the Promo Block leads to the correct page","Check that link in section 2 block 3 'home-erin' is correct"
"passed","Sun Dec 17 01:16:21 GMT 2023","Sun Dec 17 01:16:22 GMT 2023","893","tests","test_footer","TestFooter","","","TC 02.01.35 - Check Copyright text is present in the DOM tree on each page specified in DATA_1","Checks if Copyright text is present in the DOM tree on each page specified in DATA_1"
"passed","Sun Dec 17 01:21:48 GMT 2023","Sun Dec 17 01:21:49 GMT 2023","1556","tests","test_main_page","TestMainPage","","","test_check_for_duplicate_titles_after_clicking_on_the_card","This test checks for the same titles after clicking on the product card and going to the product page"
"passed","Sun Dec 17 01:16:47 GMT 2023","Sun Dec 17 01:16:48 GMT 2023","882","tests","test_footer","TestFooter","","","TC 02.01.56 - Check text of 'Subscribe to our mailing list' link on each page specified in DATA_1","Checks if text of 'Subscribe to our mailing list' link is correct on each page in DATA_1"
"passed","Sun Dec 17 01:13:30 GMT 2023","Sun Dec 17 01:13:31 GMT 2023","733","tests","test_create_an_account","TestCreateAnAccount","","","TC 04_01_08 Verify Last name input field highlighting on click"," Verify that Last name input field highlighted when clicked"
"failed","Sun Dec 17 01:14:27 GMT 2023","Sun Dec 17 01:14:27 GMT 2023","341","tests","test_create_an_account","TestCreateAnAccount","","","TC 04_02_09_13 Verify presence of strong password strength hint"," Verify presence of Password Strength hint and warning color of weak password "
"skipped","Sun Dec 17 01:16:32 GMT 2023","Sun Dec 17 01:16:32 GMT 2023","0","tests","test_footer","TestFooter","","","TC 02.01.50 - Check display of placeholder in Subscribe Email Field on each page specified in DATA_1","Checks if placeholder in Subscribe Email Field is visible on each page in DATA_1"
"passed","Sun Dec 17 01:16:49 GMT 2023","Sun Dec 17 01:16:51 GMT 2023","1977","tests","test_footer","TestFooter","","","TC 02.02.01 - Check Search Terms link in footer leads to the correct page from each page specified in DATA_1","Check that Search Terms link in footer is correct"
"skipped","Sun Dec 17 01:16:32 GMT 2023","Sun Dec 17 01:16:32 GMT 2023","0","tests","test_footer","TestFooter","","","TC 02.01.39 - Check display of Subscribe section on each page specified in DATA_1","Checks if Subscribe section is visible on each page in DATA_1"
"passed","Sun Dec 17 01:30:56 GMT 2023","Sun Dec 17 01:30:57 GMT 2023","728","tests","test_sale","TestSalePage","","","TC 10.02.03, 10.02.05, 10.02.07, 10.02.09, 10.02.11 - Verify 5 links in Men's Deals open the correct pages","Check that five links in Men's Deals section lead to the correct pages after click"
"passed","Sun Dec 17 01:24:03 GMT 2023","Sun Dec 17 01:24:04 GMT 2023","978","tests","test_main_page","TestMainPage","","","TC 13.01.48 - Check block 5 'home-eco' in section 2 of the Promo Block is present in the DOM tree","This test checks if block 5 'home-eco' in section 2 in the Promo Block is present
            in the DOM tree on the main page"
"passed","Sun Dec 17 01:22:54 GMT 2023","Sun Dec 17 01:22:55 GMT 2023","1004","tests","test_main_page","TestMainPage","","","TC 13.01.18 - Check the display of the title in block 1 'home-pants' in the Promo Block","This test checks if the info block title in section 2 block 1 'home-pants' is correct
            in the Promo Block under header on the Main Page"
"passed","Sun Dec 17 01:31:21 GMT 2023","Sun Dec 17 01:31:21 GMT 2023","41","tests","test_sale","TestSalePage","","","TC 10.04.04 - Verify that the Men's Deals contains an image","Check img existence of Men's Deals section"
"passed","Sun Dec 17 01:21:24 GMT 2023","Sun Dec 17 01:21:27 GMT 2023","3238","tests","test_header","TestHeader","","","TC 01.03.10 correctness of the ""Bras"" link of the ""Women"" section","Check 'Bras & Tanks' subsection link click in 'Women' section redirects to the Bras & Tanks-women page and         the 'Bras & Tanks' header is displayed"
"passed","Sun Dec 17 01:31:29 GMT 2023","Sun Dec 17 01:31:30 GMT 2023","137","tests","test_sale","TestSalePage","","","TC 10.04.08 - Verify the text in 2 columns block - Gear Deals","Check title-text and content-text in 2 columns block - Gear Deals"
"passed","Sun Dec 17 01:23:33 GMT 2023","Sun Dec 17 01:23:34 GMT 2023","696","tests","test_main_page","TestMainPage","","","TC 13.01.35 - Check the display of the sign in block 4 'home-performance' in the Promo Block","This test checks if the sign in info block in section 2 block 4 'home-performance' is correct
            in the Promo Block under header on the main page"
"passed","Sun Dec 17 01:19:21 GMT 2023","Sun Dec 17 01:19:23 GMT 2023","2124","tests","test_header","TestHeader","","","TC 01.03.04 correct redirection of the link ""Women""","Verify that the link 'Women' correctly opens and redirects to a new webpage, the header 'Women' is
        displayed"
"passed","Sun Dec 17 01:31:37 GMT 2023","Sun Dec 17 01:31:37 GMT 2023","657","tests","test_sale","TestSalePage","","","TC 10.04.03, 10.04.06, 10.04.09 - Verify that links in Main block, 2 columns block open the correct pages","Check that two links in Gear Deals section lead to the correct pages after click"
"skipped","Sun Dec 17 01:16:32 GMT 2023","Sun Dec 17 01:16:32 GMT 2023","0","tests","test_footer","TestFooter","","","TC 02.01.51 - Check text of placeholder in Subscribe Email Field on each page specified in DATA_1","Checks if text of placeholder in Subscribe Email Field is correct on each page in DATA_1"
"skipped","Sun Dec 17 01:16:32 GMT 2023","Sun Dec 17 01:16:32 GMT 2023","0","tests","test_footer","TestFooter","","","TC 02.01.46 - Check text on Subscribe Button on each page specified in DATA_1","Checks if text on Subscribe Button is correct on each page in DATA_1"
"passed","Sun Dec 17 01:38:00 GMT 2023","Sun Dec 17 01:38:01 GMT 2023","925","tests","test_women","TestWomenPage","","","TC 12.02.01 Check side panel title Category is visible","Check Category title is visible"
"passed","Sun Dec 17 01:23:08 GMT 2023","Sun Dec 17 01:23:09 GMT 2023","879","tests","test_main_page","TestMainPage","","","TC 13.01.24 - Check the display of the text in block 2 'home-t-shirts' in the Promo Block","This test checks if the info block text in section 2 block 2 'home-t-shirts' is correct
            in the Promo Block under header on the main page"
"broken","Sun Dec 17 01:28:45 GMT 2023","Sun Dec 17 01:28:51 GMT 2023","5989","tests","test_men","TestMenPagePromoBlock","","","TC 14.06.37 Verify that the 'Shop Hoodies' text is visible.","Verify that text-3 in 'Luma hoodies' block correctly displayed"
"broken","Sun Dec 17 01:25:51 GMT 2023","Sun Dec 17 01:25:57 GMT 2023","5890","tests","test_men","TestMenPagePromoBlock","","","TC 14.06.13 Verify that the 'Shop Tees' text in the 'Save up to $24!' promo block is visible.","Verify that text-3 in 'Save up to $24!' block correctly displayed"
"passed","Sun Dec 17 01:34:55 GMT 2023","Sun Dec 17 01:34:55 GMT 2023","69","tests","test_sign_in","TestRegisteredCustomers","","","TC 03.01.11 Verify Password field is appropriately labeled","Check if Password field is appropriately labeled "
"passed","Sun Dec 17 01:38:06 GMT 2023","Sun Dec 17 01:38:07 GMT 2023","884","tests","test_women","TestWomenPage","","","TC 12.05.01/02/03/04 Check the Sidebar text is visible","Check if items are visible"
"skipped","Sun Dec 17 01:16:32 GMT 2023","Sun Dec 17 01:16:32 GMT 2023","0","tests","test_footer","TestFooter","","","TC 02.01.38 - Check Subscribe section is present in the DOM tree on each page specified in DATA_1","Checks if Subscribe section is present in the DOM tree on each page specified in DATA_1"
"passed","Sun Dec 17 01:24:01 GMT 2023","Sun Dec 17 01:24:02 GMT 2023","915","tests","test_main_page","TestMainPage","","","TC 13.01.47 - Check block 4 'home-performance' in section 2 of the Promo Block is present in the DOM tree","This test checks if block 4 'home-performance' in section 2 in the Promo Block is present
            in the DOM tree on the main page"
"passed","Sun Dec 17 01:31:41 GMT 2023","Sun Dec 17 01:31:41 GMT 2023","28","tests","test_sale","TestSalePage","","","TC 10.04.12 - Verify that the sale-free-shipping contains an image","Check img existence of 2nd column in 3-columns Promo Block section"
"broken","Sun Dec 17 01:27:40 GMT 2023","Sun Dec 17 01:27:46 GMT 2023","5918","tests","test_men","TestMenPagePromoBlock","","","TC 14.06.28 Verify the visibility of the image in the 'Luma tees' promo block.","Verify that the image in the block 'Luma tees' is displayed on the Men page"
"passed","Sun Dec 17 01:17:54 GMT 2023","Sun Dec 17 01:17:55 GMT 2023","749","tests","test_forgot_your_password","TestForgotYourPassword","","","TC 17.01.06 Verify FYP Email field highlighting on click","
        Check the Email field is activated with a cursor and gets highlighted when clicked
        "
"passed","Sun Dec 17 01:36:46 GMT 2023","Sun Dec 17 01:36:46 GMT 2023","41","tests","test_training","TestMainPage","","","TC 16.01.04 Verify Sidebar panel title Video Download contains URL","Check Sidebar Video Download contains URL"
"passed","Sun Dec 17 01:33:34 GMT 2023","Sun Dec 17 01:33:34 GMT 2023","226","tests","test_shopping_cart","TestShoppingCartFull","","","test_tc_07_02_02_Verify_table_headers_in_item_cart_are_visible[t_header1]","Check that table headers in item cart are visible"
"passed","Sun Dec 17 01:23:51 GMT 2023","Sun Dec 17 01:23:52 GMT 2023","919","tests","test_main_page","TestMainPage","","","TC 13.01.42 - Check section 1 in the Promo Block is present in the DOM tree","This test checks if section 1 in the Promo Block is present in the DOM tree on the main page"
"passed","Sun Dec 17 01:21:28 GMT 2023","Sun Dec 17 01:21:31 GMT 2023","2201","tests","test_header","TestHeader","","","TC 01.03.11 display and interactivity of the ""Bottoms"" section of the ""Women"" section","Check the 'Bottoms' subsection in 'Women' section is displayed and the 'Pants' and 'Shorts'         subsections is displayed"
"passed","Sun Dec 17 01:22:56 GMT 2023","Sun Dec 17 01:22:57 GMT 2023","1028","tests","test_main_page","TestMainPage","","","TC 13.01.19 - Check the display of the text in block 1 'home-pants' in the Promo Block","This test checks if the info block text in section 2 block 1 'home-pants' is correct
            in the Promo Block under header on the Main Page"
"passed","Sun Dec 17 01:18:33 GMT 2023","Sun Dec 17 01:18:34 GMT 2023","1168","tests","test_header","TestHeader","","","TC 01.01.04 display and interactivity of the ""Sign In"" link","Check 'Sign In' link is displayed and underlined"
"passed","Sun Dec 17 01:16:20 GMT 2023","Sun Dec 17 01:16:20 GMT 2023","697","tests","test_footer","TestFooter","","","TC 02.01.34 - Check display of Copyright section on each page specified in DATA_1","Checks if Copyright section is visible on each page in DATA_1"
"skipped","Sun Dec 17 01:16:32 GMT 2023","Sun Dec 17 01:16:32 GMT 2023","0","tests","test_footer","TestFooter","","","TC 02.01.46 - Check text on Subscribe Button on each page specified in DATA_1","Checks if text on Subscribe Button is correct on each page in DATA_1"
"passed","Sun Dec 17 01:18:30 GMT 2023","Sun Dec 17 01:18:32 GMT 2023","2045","tests","test_header","TestHeader","","","TC 01.01.03 correctness of the ""Create an account"" link","Check 'Create an account' link click redirects to the accounts registration page and         the ""Create New Customer Account"" header is displayed"
"passed","Sun Dec 17 01:13:17 GMT 2023","Sun Dec 17 01:13:17 GMT 2023","73","tests","test_create_an_account","TestCreateAnAccount","","","TC 04_01_03 Verify presence of First name label and the required asterisk"," Verify presence of First name label and the required asterisk "
"passed","Sun Dec 17 01:15:02 GMT 2023","Sun Dec 17 01:15:03 GMT 2023","1038","tests","test_footer","TestFooter","","","TC 02.01.10 - Check if Privacy and Cookie Policy link is clickable on each page specified in DATA_1","This test checks if Privacy and Cookie Policy link is clickable on each page specified in DATA_1"
