"Status","Start Time","Stop Time","Duration in ms","Parent Suite","Suite","Sub Suite","Test Class","Test Method","Name","Description"
"passed","Sun Dec 17 01:29:57 GMT 2023","Sun Dec 17 01:30:10 GMT 2023","12557","tests","test_reviews_page","TestReviews","","","test_tc_01_15_05_check_that_it_is_possible_to_vote_for_5_star","
        The user is NOT logged in, located in the product card, section ""Reviews""
        1. All required fields are filled with correct data
        2. Pressed 5 star
        3.The ""Submit Review"" button is pressed
        Result: Present in the DOM and visible on the page the message: ""You submitted your review for moderation.
        This code works when run on Win, Mac, Ubuntu on a real laptop and has the features of working on GitHub Action.
        When interacting with the GitHub Action, it checks not for the text of the ""Success"" message, but for the ""Success"" URL""
        "
"passed","Sun Dec 17 01:14:30 GMT 2023","Sun Dec 17 01:14:31 GMT 2023","932","tests","test_footer","TestFooter","","","TC 02.01.01 - Check Footer is present in the DOM tree on each page specified in DATA_1","Checks if the footer is present in the DOM tree on each page specified in DATA_1"
"passed","Sun Dec 17 01:22:48 GMT 2023","Sun Dec 17 01:22:49 GMT 2023","878","tests","test_main_page","TestMainPage","","","TC 13.01.15 - Check the display of an image in block 1 'home-pants' in the Promo Block","This test checks if the image in section 2 block 1 'home-pants' is visible"
"passed","Sun Dec 17 01:19:03 GMT 2023","Sun Dec 17 01:19:05 GMT 2023","1788","tests","test_header","TestHeader","","","TC 01.03.35 visible and interactive the link ""Sale""","Verify the link 'Sale' is visible and interactive"
"passed","Sun Dec 17 01:35:08 GMT 2023","Sun Dec 17 01:35:09 GMT 2023","351","tests","test_sign_in","TestRegisteredCustomers","","","TC 03.01.18 Verify Email field for correct email format","Check error message for incorrect email format in email field"
"broken","Sun Dec 17 01:26:35 GMT 2023","Sun Dec 17 01:26:41 GMT 2023","6072","tests","test_men","TestMenPagePromoBlock","","","TC 14.06.19 Verify that the 'Shop Pants' text is visible.","Verify that text-3 in 'Last chance for pants' block correctly displayed"
"passed","Sun Dec 17 01:16:06 GMT 2023","Sun Dec 17 01:16:07 GMT 2023","1025","tests","test_footer","TestFooter","","","TC 02.01.30 - Check if Write for us link is clickable on each page specified in DATA_1","This test checks if Write for us link is clickable on each page specified in DATA_1"
"passed","Sun Dec 17 01:36:49 GMT 2023","Sun Dec 17 01:36:49 GMT 2023","41","tests","test_training","TestMainPage","","","TC 16.01.05 Verify Sidebar panel title Compare Products is visible and contains text 'Compare Products'","Check Sidebar Category title has correct text and is visible"
"passed","Sun Dec 17 01:36:24 GMT 2023","Sun Dec 17 01:36:26 GMT 2023","2137","tests","test_sign_in","TestFailedLogin","","","TC 03.02.02 to 03_02_10 Verify Error on Failed Login with invalid credentials","Check error on Failed Login with invalid credentials, case-sensitive password and password with spaces"
"passed","Sun Dec 17 01:21:15 GMT 2023","Sun Dec 17 01:21:19 GMT 2023","3403","tests","test_header","TestHeader","","","TC 01.03.08 correctness of the ""Hoodies & Sweatshirts"" link of the ""Women"" section","Check 'Hoodies & Sweatshirts' subsection link click in 'Women' section redirects to the         Hoodies & Sweatshirts-women page and the 'Hoodies & Sweatshirts' header is displayed"
"passed","Sun Dec 17 01:16:10 GMT 2023","Sun Dec 17 01:16:11 GMT 2023","972","tests","test_footer","TestFooter","","","TC 02.01.32 - Check text of Write for us link on each page specified in DATA_1","Checks if text of Write for us link is correct on each page in DATA_1"
"passed","Sun Dec 17 01:19:38 GMT 2023","Sun Dec 17 01:19:41 GMT 2023","3035","tests","test_header","TestHeader","","","TC 01.03.25 correctness of the ""Pants"" link of the ""Men"" section","Check 'Pants' subsection link click in 'Men' section redirects to the Pants page and         the 'Pants' header is displayed"
"passed","Sun Dec 17 01:31:14 GMT 2023","Sun Dec 17 01:31:15 GMT 2023","589","tests","test_sale","TestSalePage","","","TC 10.03.03, 10.03.05 - Verify 2 links in Gear Deals open the correct pages","Check that two links in Gear Deals section lead to the correct pages after click"
"passed","Sun Dec 17 01:15:26 GMT 2023","Sun Dec 17 01:15:27 GMT 2023","870","tests","test_footer","TestFooter","","","TC 02.01.18 - Check Orders and Returns link is present in the DOM tree on each page specified in DATA_1","Checks if Orders and Returns link is present in the DOM tree on each page specified in DATA_1"
"passed","Sun Dec 17 01:35:06 GMT 2023","Sun Dec 17 01:35:06 GMT 2023","807","tests","test_sign_in","TestRegisteredCustomers","","","TC 03.01.17 Verify Forgot Your Password link is functional","Verify that click 'Forgot your password?' link opens correct page"
"passed","Sun Dec 17 01:34:41 GMT 2023","Sun Dec 17 01:34:41 GMT 2023","39","tests","test_sign_in","TestRegisteredCustomers","","","TC 03.01.05 Verify Email field is correct format and clickable","Check if the Email input is of correct format (input-text) and clickable"
"passed","Sun Dec 17 01:23:27 GMT 2023","Sun Dec 17 01:23:28 GMT 2023","856","tests","test_main_page","TestMainPage","","","TC 13.01.32 - Check the display of the info block in block 4 'home-performance' in the Promo Block","This test checks if info block in section 2 block 4 'home-performance' is displayed in the Promo Block
            under header on the Main Page"
"passed","Sun Dec 17 01:34:50 GMT 2023","Sun Dec 17 01:34:51 GMT 2023","34","tests","test_sign_in","TestRegisteredCustomers","","","TC 03.01.09 Verify Password field is present","Check if the password input field is present"
"passed","Sun Dec 17 01:18:38 GMT 2023","Sun Dec 17 01:18:39 GMT 2023","1200","tests","test_header","TestHeader","","","TC 01.02.04 display and interactivity of the logo","Check that the cursor changes to a 'hand' indicating the logo is a clickable element,         and that clicking on it causes the page to reload and redirect to the main page"
"passed","Sun Dec 17 01:19:01 GMT 2023","Sun Dec 17 01:19:02 GMT 2023","1572","tests","test_header","TestHeader","","","TC 01.02.01 display and interactivity of the ""Search"" field","Check the ""Search"" field is activated with a vertical flashing symbol ""|"" and highlighted"
"passed","Sun Dec 17 01:14:32 GMT 2023","Sun Dec 17 01:14:33 GMT 2023","895","tests","test_footer","TestFooter","","","TC 02.01.02 - Check Footer display on each page specified in DATA_1","Checks if Footer is visible on each page specified in DATA_1"
"passed","Sun Dec 17 01:35:15 GMT 2023","Sun Dec 17 01:35:15 GMT 2023","57","tests","test_sign_in","TestNewCustomers","","","TC 03.01.21 Verify presence of Create an Account button ","Check if 'Create an Account' button is present"
"skipped","Sun Dec 17 01:18:00 GMT 2023","Sun Dec 17 01:18:00 GMT 2023","0","tests","test_forgot_your_password","TestForgotYourPassword","","","TC 17.01.12 Verify FYP captcha field highlighting on click","
        Check the captcha field is activated with a cursor and gets highlighted when clicked
        "
"passed","Sun Dec 17 01:22:46 GMT 2023","Sun Dec 17 01:22:47 GMT 2023","1047","tests","test_main_page","TestMainPage","","","TC 13.01.14 - Check display of block 5 'home-eco' in section 2 in the Promo Block","This test checks if block 5 'home-eco' is displayed in section 2
            of Promo Block under header on the main page"
"skipped","Sun Dec 17 01:16:32 GMT 2023","Sun Dec 17 01:16:32 GMT 2023","0","tests","test_footer","TestFooter","","","TC 02.01.50 - Check display of placeholder in Subscribe Email Field on each page specified in DATA_1","Checks if placeholder in Subscribe Email Field is visible on each page in DATA_1"
"broken","Sun Dec 17 01:28:31 GMT 2023","Sun Dec 17 01:28:37 GMT 2023","6016","tests","test_men","TestMenPagePromoBlock","","","TC 14.06.35 Verify that the 'Luma hoodies' text is visible.","Verify that text-1 in 'Luma hoodies' block correctly displayed"
"passed","Sun Dec 17 01:32:34 GMT 2023","Sun Dec 17 01:32:38 GMT 2023","4378","tests","test_shopping_cart","TestShoppingCartFull","","","tc 07.02.08 Verify that 'Proceed to checkout' button redirects to the shipping page","Verify that the 'Proceed to checkout' button redirects to the shipping page."
"passed","Sun Dec 17 01:14:42 GMT 2023","Sun Dec 17 01:14:43 GMT 2023","910","tests","test_footer","TestFooter","","","TC 02.01.04 - Check display of Search Terms link on each page specified in DATA_1","Checks if Search Terms link is visible on each page in DATA_1"
"passed","Sun Dec 17 01:13:22 GMT 2023","Sun Dec 17 01:13:23 GMT 2023","709","tests","test_create_an_account","TestCreateAnAccount","","","TC 04_01_05 Verify First name input field highlighting on click"," Verify that First name input field highlighted when clicked"
"passed","Sun Dec 17 01:13:33 GMT 2023","Sun Dec 17 01:13:33 GMT 2023","43","tests","test_create_an_account","TestCreateAnAccount","","","TC 04_01_10 Verify Sign in Information heading"," Verify that Sign in Information heading is present"
"passed","Sun Dec 17 01:30:52 GMT 2023","Sun Dec 17 01:30:52 GMT 2023","26","tests","test_sale","TestSalePage","","","TC 10.02.02, 10.02.04, 10.02.06, 10.02.08, 10.02.10 - Verify 5 links in Men's Deals section are visible and clickable","Check that five elements in Men's Deals section are displayed and enabled"
"passed","Sun Dec 17 01:34:27 GMT 2023","Sun Dec 17 01:34:31 GMT 2023","4048","tests","test_shopping_cart","TestShoppingCartFull","","","TC 07.02.28 Verify that the price in list of items in the Shopping Cart is displayed correct","Check that the price in list of items in the Shopping Cart
        contains item with correct price which was added from More Choices"
"passed","Sun Dec 17 01:30:59 GMT 2023","Sun Dec 17 01:31:00 GMT 2023","1011","tests","test_sale","TestSalePage","","","TC 10.02.03, 10.02.05, 10.02.07, 10.02.09, 10.02.11 - Verify 5 links in Men's Deals open the correct pages","Check that five links in Men's Deals section lead to the correct pages after click"
"passed","Sun Dec 17 01:21:04 GMT 2023","Sun Dec 17 01:21:06 GMT 2023","2083","tests","test_header","TestHeader","","","TC 01.03.05 display and interactivity of the ""Tops"" section of the ""Women"" section","Check the 'Tops' subsection in 'Women' section is displayed and the 'Jackets', 'Shorts',         'Hoodies & Sweatshirts', 'Tees' and 'Bras & Tanks' subsections is displayed"
"passed","Sun Dec 17 01:14:46 GMT 2023","Sun Dec 17 01:14:47 GMT 2023","844","tests","test_footer","TestFooter","","","TC 02.01.05 - Check if Search Terms link is clickable on each page specified in DATA_1","This test checks if Search Terms link is clickable on each page specified in DATA_1"
"passed","Sun Dec 17 01:24:34 GMT 2023","Sun Dec 17 01:24:35 GMT 2023","987","tests","test_men","TestMenPage","","","TC 14.02.02 Verify the link Tops is visible and clickable.",""
"passed","Sun Dec 17 01:35:41 GMT 2023","Sun Dec 17 01:35:50 GMT 2023","8822","tests","test_sign_in","TestFailedLogin","","","TC 03.02.01 to 03_02_10 Verify Failed Login, no error validation","Check Success and Failed Login, no error validation"
"broken","Sun Dec 17 01:18:04 GMT 2023","Sun Dec 17 01:18:11 GMT 2023","6841","tests","test_forgot_your_password","TestForgotYourPasswordFunctionality","","","TC 17.01.25 Verify error on resetting My Password with empty email","Check error message on attempt to reset password with empty email field"
"passed","Sun Dec 17 01:34:17 GMT 2023","Sun Dec 17 01:34:21 GMT 2023","3771","tests","test_shopping_cart","TestShoppingCartFull","","","TC 07.02.27 Verify that the list of items in the Shopping Cart is displayed correct","Check that the list of items in the Shopping Cart contains title item which was added from More Choices"
"passed","Sun Dec 17 01:15:58 GMT 2023","Sun Dec 17 01:15:59 GMT 2023","948","tests","test_footer","TestFooter","","","TC 02.01.28 - Check Write for us link is present in the DOM tree on each page specified in DATA_1","Checks if Write for us link is present in the DOM tree on each page specified in DATA_1"
"passed","Sun Dec 17 01:30:48 GMT 2023","Sun Dec 17 01:30:48 GMT 2023","26","tests","test_sale","TestSalePage","","","TC 10.02.02, 10.02.04, 10.02.06, 10.02.08, 10.02.10 - Verify 5 links in Men's Deals section are visible and clickable","Check that five elements in Men's Deals section are displayed and enabled"
"skipped","Sun Dec 17 01:16:32 GMT 2023","Sun Dec 17 01:16:32 GMT 2023","0","tests","test_footer","TestFooter","","","TC 02.01.41 - Check display of Subscribe Button on each page specified in DATA_1","Checks if Subscribe Button is visible on each page in DATA_1"
"passed","Sun Dec 17 01:35:02 GMT 2023","Sun Dec 17 01:35:02 GMT 2023","40","tests","test_sign_in","TestRegisteredCustomers","","","TC 03.01.14 Verify Sign in button is present",""
"passed","Sun Dec 17 01:38:02 GMT 2023","Sun Dec 17 01:38:03 GMT 2023","991","tests","test_women","TestWomenPage","","","TC 12.05.01/02/03/04 Check the Sidebar text is visible","Check if items are visible"
"passed","Sun Dec 17 01:22:26 GMT 2023","Sun Dec 17 01:22:27 GMT 2023","962","tests","test_main_page","TestMainPage","","","TC 13.01.02 - Check the display of Section 1 in the Promo Block","This test checks if Section 1 in Promo Block under header is displayed on the Main Page"
"broken","Sun Dec 17 01:28:38 GMT 2023","Sun Dec 17 01:28:44 GMT 2023","6041","tests","test_men","TestMenPagePromoBlock","","","TC 14.06.36 Verify that the 'Dress for fitness' text is visible.","Verify that text-2 in 'Luma hoodies' block correctly displayed"
"broken","Sun Dec 17 01:28:16 GMT 2023","Sun Dec 17 01:28:22 GMT 2023","6109","tests","test_men","TestMenPagePromoBlock","","","TC 14.06.33 Verify the visibility of 'Luma hoodies' promo block.","Verify that the block 'Luma hoodies' is displayed on the Men page"
"passed","Sun Dec 17 01:31:23 GMT 2023","Sun Dec 17 01:31:23 GMT 2023","96","tests","test_sale","TestSalePage","","","TC 10.04.07 - Verify that the Gear Deals contains an image","Check img existence of Gear Deals section"
"skipped","Sun Dec 17 01:16:32 GMT 2023","Sun Dec 17 01:16:32 GMT 2023","0","tests","test_footer","TestFooter","","","TC 02.01.47 - Check Email field in Subscribe section is present in the DOM tree on each page specified in DATA_1","Checks if Email field in Subscribe section is present in the DOM tree on each page specified in DATA_1"
"passed","Sun Dec 17 01:16:18 GMT 2023","Sun Dec 17 01:16:18 GMT 2023","966","tests","test_footer","TestFooter","","","TC 02.01.34 - Check display of Copyright section on each page specified in DATA_1","Checks if Copyright section is visible on each page in DATA_1"
"passed","Sun Dec 17 01:20:34 GMT 2023","Sun Dec 17 01:20:37 GMT 2023","3362","tests","test_header","TestHeader","","","TC 01.03.20 correctness of the ""Hoodies & Sweatshirts"" link of the ""Men"" section","Check 'Hoodies & Sweatshirts' subsection link click in 'Men' section redirects to the         Hoodies & Sweatshirts-men page and the 'Hoodies & Sweatshirts' header is displayed"
"passed","Sun Dec 17 01:24:22 GMT 2023","Sun Dec 17 01:24:24 GMT 2023","1830","tests","test_main_page","TestMainPage","","","TC 13.02.03 - Check the link in section 2 block 2 'home-t-shirts' in the Promo Block leads to the correct page","Check that link in section 2 block 2 'home-t-shirts' is correct"
"broken","Sun Dec 17 01:27:18 GMT 2023","Sun Dec 17 01:27:24 GMT 2023","6066","tests","test_men","TestMenPagePromoBlock","","","TC 14.06.25 Verify that the 'Shop Shorts' text is visible.","Verify that text-3 in 'Luma shorts' block correctly displayed"
"passed","Sun Dec 17 01:13:38 GMT 2023","Sun Dec 17 01:13:39 GMT 2023","760","tests","test_create_an_account","TestCreateAnAccount","","","TC 04_01_12 Verify Email input field highlighting on click"," Verify that Email input field highlighted when clicked"
"passed","Sun Dec 17 01:14:36 GMT 2023","Sun Dec 17 01:14:37 GMT 2023","974","tests","test_footer","TestFooter","","","TC 02.01.03 - Check Search Terms link is present in the DOM tree on each page specified in DATA_1","Checks if the Search Terms link is present in the DOM tree on each page specified in DATA_1"
"passed","Sun Dec 17 01:35:17 GMT 2023","Sun Dec 17 01:35:17 GMT 2023","44","tests","test_sign_in","TestNewCustomers","","","TC 03.01.22 Verify Create an Account button link","Check if 'Create an Account' button has correct link and is clickable"
"passed","Sun Dec 17 01:13:44 GMT 2023","Sun Dec 17 01:13:45 GMT 2023","812","tests","test_create_an_account","TestCreateAnAccount","","","TC 04_01_14 Verify Password input field highlighting on click"," Verify that Password input field highlighted when clicked"
"passed","Sun Dec 17 01:36:44 GMT 2023","Sun Dec 17 01:36:44 GMT 2023","43","tests","test_training","TestMainPage","","","TC 16.01.03 Verify Sidebar title Video Download is visible and contains text 'Video Download'","Check Sidebar Video Download title has correct text and is visible"
"passed","Sun Dec 17 01:37:48 GMT 2023","Sun Dec 17 01:37:49 GMT 2023","972","tests","test_training_video_download","TestTrainingVideoDownload","","","TC 18.01.02 subtitle is displayed text My Wish List","Verify the 'My Wish List' subtitle is visible"
"skipped","Sun Dec 17 01:16:32 GMT 2023","Sun Dec 17 01:16:32 GMT 2023","0","tests","test_footer","TestFooter","","","TC 02.01.48 - Check display of Subscribe Email Field on each page specified in DATA_1","Checks if Subscribe Email Field is visible on each page in DATA_1"
"passed","Sun Dec 17 01:15:06 GMT 2023","Sun Dec 17 01:15:07 GMT 2023","909","tests","test_footer","TestFooter","","","TC 02.01.12 - Check text of Privacy and Cookie Policy link on each page specified in DATA_1","Checks if text of Privacy and Cookie Policy link matches expected on each page in DATA_1"
"passed","Sun Dec 17 01:15:22 GMT 2023","Sun Dec 17 01:15:23 GMT 2023","937","tests","test_footer","TestFooter","","","TC 02.01.17 - Check text of Advanced Search link on each page specified in DATA_1","Checks if text of Advanced Search link is correct on each page in DATA_1"
"passed","Sun Dec 17 01:22:39 GMT 2023","Sun Dec 17 01:22:41 GMT 2023","1086","tests","test_main_page","TestMainPage","","","TC 13.01.11 - Check display of block 2 'home-t-shirts' in section 2 in the Promo Block","This test checks if block 2 'home-t-shirts' is displayed in section 2 of Promo Block under header
             on the Main Page"
"passed","Sun Dec 17 01:17:04 GMT 2023","Sun Dec 17 01:17:06 GMT 2023","1705","tests","test_footer","TestFooter","","","TC 02.02.03 - Check Advanced Search link in footer leads to the correct page from each page specified in DATA_1","Check that Advanced Search link in footer is correct"
"passed","Sun Dec 17 01:33:28 GMT 2023","Sun Dec 17 01:33:28 GMT 2023","253","tests","test_shopping_cart","TestShoppingCartFull","","","test_tc_07_02_02_Verify_table_headers_in_item_cart_are_visible[t_header0]","Check that table headers in item cart are visible"
"passed","Sun Dec 17 01:30:25 GMT 2023","Sun Dec 17 01:30:26 GMT 2023","770","tests","test_sale","TestSalePage","","","TC 10.01.03, 10.01.05, 10.01.07, 10.01.09, 10.01.11, 10.01.13 - Verify 6 links in Women's Deals open the correct pages","Check that six links in Women's Deals section lead to the correct pages after click"
"passed","Sun Dec 17 01:14:52 GMT 2023","Sun Dec 17 01:14:53 GMT 2023","885","tests","test_footer","TestFooter","","","TC 02.01.07 - Check text of Search Terms link on each page specified in DATA_1","Checks if text of Search Terms link is correct on each page in DATA_1"
"passed","Sun Dec 17 01:18:02 GMT 2023","Sun Dec 17 01:18:02 GMT 2023","52","tests","test_forgot_your_password","TestForgotYourPassword","","","TC 17.01.20 Verify Reset My Password button is clickable","Check that the 'Reset My Password' button is clickable"
"passed","Sun Dec 17 01:15:12 GMT 2023","Sun Dec 17 01:15:13 GMT 2023","958","tests","test_footer","TestFooter","","","TC 02.01.13 - Check Advanced Search link is present in the DOM tree on each page specified in DATA_1","Checks if Advanced Search link is present in the DOM tree on each page specified in DATA_1"
"broken","Sun Dec 17 01:27:04 GMT 2023","Sun Dec 17 01:27:10 GMT 2023","5950","tests","test_men","TestMenPagePromoBlock","","","TC 14.06.23 Verify that the 'Luma shorts' text is visible.","Verify that text-1 in 'Luma shorts' block correctly displayed"
"passed","Sun Dec 17 01:36:36 GMT 2023","Sun Dec 17 01:36:38 GMT 2023","2144","tests","test_sign_in","TestFailedLogin","","","TC 03.02.02 to 03_02_10 Verify Error on Failed Login with invalid credentials","Check error on Failed Login with invalid credentials, case-sensitive password and password with spaces"
"passed","Sun Dec 17 01:17:57 GMT 2023","Sun Dec 17 01:17:57 GMT 2023","228","tests","test_forgot_your_password","TestForgotYourPassword","","","TC 17.01.07 Verify displayed email matches the entered email in FYP Email field","Check if the displayed email matches the entered email in Email field"
"passed","Sun Dec 17 01:20:03 GMT 2023","Sun Dec 17 01:20:05 GMT 2023","2166","tests","test_header","TestHeader","","","TC 01.03.16 correctness of the ""Men"" section link","Check the 'Men' section click redirects to the Men page and the 'Men' header is displayed"
"broken","Sun Dec 17 01:26:56 GMT 2023","Sun Dec 17 01:27:02 GMT 2023","6040","tests","test_men","TestMenPagePromoBlock","","","TC 14.06.22 Verify the visibility of the image in the 'Luma shorts' promo block.","Verify that the image in the block 'Luma shorts' is displayed on the Men page"
"broken","Sun Dec 17 01:27:25 GMT 2023","Sun Dec 17 01:27:31 GMT 2023","5937","tests","test_men","TestMenPagePromoBlock","","","TC 14.06.26 Verify the click on the block 'Luma shorts' redirects to a correct page.","Verify that the click on the block 'Luma shorts' correctly redirects to a new webpage"
"passed","Sun Dec 17 01:13:41 GMT 2023","Sun Dec 17 01:13:42 GMT 2023","742","tests","test_create_an_account","TestCreateAnAccount","","","TC 04_01_13 Verify presence of Password label and the required asterisk"," Verify presence of Password label and the required asterisk "
"passed","Sun Dec 17 01:17:20 GMT 2023","Sun Dec 17 01:17:23 GMT 2023","2857","tests","test_footer","TestFooter","","","TC 02.02.06 - Check Write for us link in footer leads to the correct page from each page specified in DATA_1","Check that Write for us link in footer is correct"
"passed","Sun Dec 17 01:38:08 GMT 2023","Sun Dec 17 01:38:09 GMT 2023","986","tests","test_women","TestWomenPage","","","TC 12.05.01/02/03/04 Check the Sidebar text is visible","Check if items are visible"
"passed","Sun Dec 17 01:25:18 GMT 2023","Sun Dec 17 01:25:20 GMT 2023","1961","tests","test_men","TestMenPage","","","TC 14.04.05 Verify the link 'Shorts' redirects to a correct page.","Verify that the link 'Shorts' correctly opens and redirects to a new webpage, the header 'Pants' is
              displayed"
"passed","Sun Dec 17 01:36:00 GMT 2023","Sun Dec 17 01:36:03 GMT 2023","3031","tests","test_sign_in","TestFailedLogin","","","TC 03.02.01 to 03_02_10 Verify Failed Login, no error validation","Check Success and Failed Login, no error validation"
"passed","Sun Dec 17 01:14:28 GMT 2023","Sun Dec 17 01:14:29 GMT 2023","957","tests","test_footer","TestFooter","","","TC 02.01.01 - Check Footer is present in the DOM tree on each page specified in DATA_1","Checks if the footer is present in the DOM tree on each page specified in DATA_1"
"passed","Sun Dec 17 01:22:42 GMT 2023","Sun Dec 17 01:22:43 GMT 2023","1022","tests","test_main_page","TestMainPage","","","TC 13.01.12 - Check display of block 3 'home-erin' in section 2 in the Promo Block","This test checks if block 3 'home-erin' is displayed in section 2 of Promo Block under header
            on the Main Page"
"passed","Sun Dec 17 01:31:08 GMT 2023","Sun Dec 17 01:31:08 GMT 2023","43","tests","test_sale","TestSalePage","","","TC 10.03.01 - Verify 'GEAR DEALS' title is correct","Check title of Gear Deals section"
"passed","Sun Dec 17 01:15:38 GMT 2023","Sun Dec 17 01:15:39 GMT 2023","888","tests","test_footer","TestFooter","","","TC 02.01.22 - Check text of Orders and Returns link on each page specified in DATA_1","Checks if text of Orders and Returns link is correct on each page in DATA_1"
"passed","Sun Dec 17 01:37:54 GMT 2023","Sun Dec 17 01:37:55 GMT 2023","874","tests","test_training_video_download","TestTrainingVideoDownload","","","TC 18.02.01 title ""Video Download"" is visible","Verify title 'Video Download' is visible"
"passed","Sun Dec 17 01:24:11 GMT 2023","Sun Dec 17 01:24:12 GMT 2023","870","tests","test_main_page","TestMainPage","","","TC 13.01.52 - Check if block 3 'home-erin' in section 2 is clickablein the Promo Block on the main page","This test checks if block 3 'home-erin' in section 2 in Promo Block under header is clickable"
"passed","Sun Dec 17 01:15:04 GMT 2023","Sun Dec 17 01:15:05 GMT 2023","986","tests","test_footer","TestFooter","","","TC 02.01.10 - Check if Privacy and Cookie Policy link is clickable on each page specified in DATA_1","This test checks if Privacy and Cookie Policy link is clickable on each page specified in DATA_1"
"passed","Sun Dec 17 01:16:02 GMT 2023","Sun Dec 17 01:16:03 GMT 2023","997","tests","test_footer","TestFooter","","","TC 02.01.29 - Check display of Write for us link on each page specified in DATA_1","Checks if Write for us link is visible on each page in DATA_1"
"passed","Sun Dec 17 01:23:22 GMT 2023","Sun Dec 17 01:23:22 GMT 2023","916","tests","test_main_page","TestMainPage","","","TC 13.01.30 - Check the display of the sign in block 3 'home-erin' in the Promo Block","This test checks if the sign in info block in section 2 block 3 'home-erin' is correct
            in the Promo Block under header on the main page"
