"Status","Start Time","Stop Time","Duration in ms","Parent Suite","Suite","Sub Suite","Test Class","Test Method","Name","Description"
"skipped","Sun Nov 05 01:14:56 GMT 2023","Sun Nov 05 01:14:56 GMT 2023","0","tests","test_footer","TestFooter","","","TC 02.01.44 - Check text on Subscribe Button is present in the DOM tree on each page specified in DATA_1","Checks if text on Subscribe Button is present in the DOM tree on each page specified in DATA_1"
"passed","Sun Nov 05 01:25:33 GMT 2023","Sun Nov 05 01:25:35 GMT 2023","1178","tests","test_main_page","TestMainPage","","","TC 13.01.36 - Check the display of an image in block 5 'home-eco' in the Promo Block","This test checks if the image in section 2 block 5 'home-eco' is visible"
"passed","Sun Nov 05 01:19:24 GMT 2023","Sun Nov 05 01:19:26 GMT 2023","1594","tests","test_header","TestHeader","","","TC 01.01.04 display and interactivity of the ""Sign In"" link","Check 'Sign In' link is displayed and underlined"
"passed","Sun Nov 05 01:13:38 GMT 2023","Sun Nov 05 01:13:39 GMT 2023","1326","tests","test_footer","TestFooter","","","TC 02.01.19 - Check display of Orders and Returns link on each page specified in DATA_1","Checks if Orders and Returns link is visible on each page in DATA_1"
"passed","Sun Nov 05 01:21:45 GMT 2023","Sun Nov 05 01:21:49 GMT 2023","4024","tests","test_header","TestHeader","","","TC 01.03.21 correctness of the ""Tees"" link of the ""Men"" section","Check 'Tees' subsection link click in 'Men' section redirects to the Tees-men page and         the 'Tees' header is displayed"
"passed","Sun Nov 05 01:23:49 GMT 2023","Sun Nov 05 01:23:50 GMT 2023","1774","tests","test_main_page","TestMainPage","","","Check the display of the add to wish and add to compare buttons","
            This test will check that the add to wishlist and add to compare buttons are visible on the screen
            "
"failed","Sun Nov 05 01:12:18 GMT 2023","Sun Nov 05 01:12:19 GMT 2023","722","tests","test_create_an_account","TestCreateAnAccount","","","TC 04_02_09_13 Verify presence of strong password strength hint"," Verify presence of Password Strength hint and warning color of weak password "
"passed","Sun Nov 05 01:31:08 GMT 2023","Sun Nov 05 01:31:09 GMT 2023","1314","tests","test_sale","TestSalePage","","","TC 10.01.03, 10.01.05, 10.01.07, 10.01.09, 10.01.11, 10.01.13 - Verify 6 links in Women's Deals open the correct pages","Check that six links in Women's Deals section lead to the correct pages after click"
"passed","Sun Nov 05 01:37:41 GMT 2023","Sun Nov 05 01:37:42 GMT 2023","291","tests","test_training","TestMainPage","","","TC 16.01.03 Verify Sidebar title Video Download is visible and contains text 'Video Download'","Check Sidebar Video Download title has correct text and is visible"
"skipped","Sun Nov 05 01:37:34 GMT 2023","Sun Nov 05 01:37:34 GMT 2023","0","tests","test_sign_in","TestFailedLogin","","","TC 03.02.02 to 03_02_10 Verify Error on Failed Login with invalid credentials","Check error on Failed Login with invalid credentials, case-sensitive password and password with spaces"
"passed","Sun Nov 05 01:24:30 GMT 2023","Sun Nov 05 01:24:31 GMT 2023","1358","tests","test_main_page","TestMainPage","","","TC 13.01.15 - Check the display of an image in block 1 'home-pants' in the Promo Block","This test checks if the image in section 2 block 1 'home-pants' is visible"
"passed","Sun Nov 05 01:29:09 GMT 2023","Sun Nov 05 01:29:10 GMT 2023","1405","tests","test_men","TestMenPagePromoBlock","","","TC 14.06.29 Verify that the 'Luma tees' text is visible.","Verify that text-1 in 'Luma tees' block correctly displayed"
"passed","Sun Nov 05 01:32:33 GMT 2023","Sun Nov 05 01:32:33 GMT 2023","424","tests","test_sale","TestSalePage","","","TC 10.04.08 - Verify the text in 2 columns block - Gear Deals","Check title-text and content-text in 2 columns block - Gear Deals"
"passed","Sun Nov 05 01:28:15 GMT 2023","Sun Nov 05 01:28:16 GMT 2023","1509","tests","test_men","TestMenPagePromoBlock","","","TC 14.06.10 Verify the visibility of the image in the 'Save up to $24!' promo block.","Verify that the image in the block 'Save up to $24!' is displayed on the Men page"
"passed","Sun Nov 05 01:31:41 GMT 2023","Sun Nov 05 01:31:41 GMT 2023","76","tests","test_sale","TestSalePage","","","TC 10.02.02, 10.02.04, 10.02.06, 10.02.08, 10.02.10 - Verify 5 links in Men's Deals section are visible and clickable","Check that five elements in Men's Deals section are displayed and enabled"
"passed","Sun Nov 05 01:16:36 GMT 2023","Sun Nov 05 01:16:36 GMT 2023","174","tests","test_forgot_your_password","TestForgotYourPassword","","","TC 17.01.04 Verify FYP Email field is correct format and clickable","Check if the Email input is of correct format (input-text) and clickable"
"skipped","Sun Nov 05 01:14:56 GMT 2023","Sun Nov 05 01:14:56 GMT 2023","0","tests","test_footer","TestFooter","","","TC 02.01.46 - Check text on Subscribe Button on each page specified in DATA_1","Checks if text on Subscribe Button is correct on each page in DATA_1"
"passed","Sun Nov 05 01:14:10 GMT 2023","Sun Nov 05 01:14:11 GMT 2023","1180","tests","test_footer","TestFooter","","","TC 02.01.27 - Check text of 'Contact us' link on each page specified in DATA_1","Checks if text of 'Contact us' link is correct on each page in DATA_1"
"passed","Sun Nov 05 01:33:06 GMT 2023","Sun Nov 05 01:33:09 GMT 2023","2437","tests","test_shopping_cart","TestShoppingCart","","","tc 07.01.04 Verify that here link leads to the main page","Verify that the link ""here"" redirects to the main page."
"broken","Sun Nov 05 01:18:44 GMT 2023","Sun Nov 05 01:18:50 GMT 2023","5742","tests","test_forgot_your_password","TestForgotYourPasswordFunctionality","","","TC 17.01.27 Verify all fields got cleared after the failed attempt to reset password","Check if all the fields are getting cleared after failed attempt to reset password with invalid captcha"
"passed","Sun Nov 05 01:29:11 GMT 2023","Sun Nov 05 01:29:13 GMT 2023","1319","tests","test_men","TestMenPagePromoBlock","","","TC 14.06.30 Verify that the 'Grab a tee or two!' text is visible.","Verify that text-2 in 'Luma tees' block correctly displayed"
"passed","Sun Nov 05 01:22:40 GMT 2023","Sun Nov 05 01:22:44 GMT 2023","4243","tests","test_header","TestHeader","","","TC 01.03.10 correctness of the ""Bras"" link of the ""Women"" section","Check 'Bras & Tanks' subsection link click in 'Women' section redirects to the Bras & Tanks-women page and         the 'Bras & Tanks' header is displayed"
"passed","Sun Nov 05 01:38:35 GMT 2023","Sun Nov 05 01:38:36 GMT 2023","1264","tests","test_women","TestWomenPage","","","TC 12.02.01 Check side panel title Category is visible","Check Category title is visible"
"passed","Sun Nov 05 01:12:37 GMT 2023","Sun Nov 05 01:12:39 GMT 2023","1369","tests","test_footer","TestFooter","","","TC 02.01.04 - Check display of Search Terms link on each page specified in DATA_1","Checks if Search Terms link is visible on each page in DATA_1"
"passed","Sun Nov 05 01:38:12 GMT 2023","Sun Nov 05 01:38:13 GMT 2023","662","tests","test_training","TestMainPage","","","TC 16.02.08 Check the cursor change to block training on demand","This test check the cursor change when hovering over the block training on demand"
"skipped","Sun Nov 05 01:14:56 GMT 2023","Sun Nov 05 01:14:56 GMT 2023","0","tests","test_footer","TestFooter","","","TC 02.01.42 - Check if Subscribe Button is clickable on each page specified in DATA_1","This test checks if Subscribe Button is clickable on each page specified in DATA_1"
"passed","Sun Nov 05 01:24:43 GMT 2023","Sun Nov 05 01:24:45 GMT 2023","1582","tests","test_main_page","TestMainPage","","","TC 13.01.20 - Check the display of the sign in block 1 'home-pants' in the Promo Block","This test checks if the sign in info block in section 2 block 1 'home-pants' is correct
            in the Promo Block under header on the Main Page"
"skipped","Sun Nov 05 01:14:56 GMT 2023","Sun Nov 05 01:14:56 GMT 2023","0","tests","test_footer","TestFooter","","","TC 02.01.40 - Check Subscribe Button is present in the DOM tree on each page specified in DATA_1","Checks if Subscribe Button is present in the DOM tree on each page specified in DATA_1"
"passed","Sun Nov 05 01:37:52 GMT 2023","Sun Nov 05 01:37:52 GMT 2023","122","tests","test_training","TestMainPage","","","TC 16.02.01 Verify title Training is visible and contains text 'Training'","Check Training title has correct text and is visible"
"passed","Sun Nov 05 01:38:09 GMT 2023","Sun Nov 05 01:38:09 GMT 2023","626","tests","test_training","TestMainPage","","","TC 16.02.07 Check the cursor change to block training erin","This test check the cursor change when hovering over the block training erin"
"passed","Sun Nov 05 01:23:30 GMT 2023","Sun Nov 05 01:23:32 GMT 2023","1660","tests","test_main_page","TestMainPage","","","test_tc_06_01_10_check_the_cursor_change_to_cart_button[add_to_compare]","This test check the cursor change when hovering over the cart buttons"
"passed","Sun Nov 05 01:14:35 GMT 2023","Sun Nov 05 01:14:36 GMT 2023","1180","tests","test_footer","TestFooter","","","TC 02.01.33 - Check Copyright section is present in the DOM tree on each page specified in DATA_1","Checks if Copyright section is present in the DOM tree on each page specified in DATA_1"
"skipped","Sun Nov 05 01:37:34 GMT 2023","Sun Nov 05 01:37:34 GMT 2023","0","tests","test_sign_in","TestFailedLogin","","","TC 03.02.01 to 03_02_10 Verify and Failed Login, no error validation","Check Success and Failed Login, no error validation"
"passed","Sun Nov 05 01:33:23 GMT 2023","Sun Nov 05 01:33:25 GMT 2023","1468","tests","test_shopping_cart","TestShoppingCartFull","","","tc 07.02.03 Verify that quantity field is displayed and clickable","Check that quantity field is displayed and clickable."
"passed","Sun Nov 05 01:10:34 GMT 2023","Sun Nov 05 01:10:35 GMT 2023","507","tests","test_create_an_account","TestCreateAnAccount","","","TC 04_01_01 Verify Create An Account Page h1 Header"," Verify that the Create An Account page heading is present. "
"passed","Sun Nov 05 01:23:16 GMT 2023","Sun Nov 05 01:23:17 GMT 2023","1244","tests","test_main_page","TestMainPage","","","test_check_card_rating","This test checks that if a product has a review, then the product card has a rating"
"passed","Sun Nov 05 01:25:53 GMT 2023","Sun Nov 05 01:25:54 GMT 2023","1128","tests","test_main_page","TestMainPage","","","TC 13.01.43 - Check section 2 in the Promo Block is present in the DOM tree","This test checks if section 2 in the Promo Block is present in the DOM tree on the main page"
"passed","Sun Nov 05 01:19:17 GMT 2023","Sun Nov 05 01:19:19 GMT 2023","1593","tests","test_header","TestHeader","","","TC 01.01.02 display and interactivity of the ""Create an account"" link","Check 'Create an account' link is displayed and underlined"
"passed","Sun Nov 05 01:19:44 GMT 2023","Sun Nov 05 01:19:46 GMT 2023","2751","tests","test_header","TestHeader","","","TC 01.02.02 functionality of the ""Search"" field","Check the ""Search"" field is activated and the drop-down list appears with various product"
"skipped","Sun Nov 05 01:37:34 GMT 2023","Sun Nov 05 01:37:34 GMT 2023","0","tests","test_sign_in","TestFailedLogin","","","TC 03.02.01 to 03_02_10 Verify and Failed Login, no error validation","Check Success and Failed Login, no error validation"
"passed","Sun Nov 05 01:19:51 GMT 2023","Sun Nov 05 01:19:53 GMT 2023","2082","tests","test_header","TestHeader","","","TC 01.03.35 visible and interactive the link ""Sale""","Verify the link 'Sale' is visible and interactive"
"passed","Sun Nov 05 01:31:27 GMT 2023","Sun Nov 05 01:31:28 GMT 2023","1259","tests","test_sale","TestSalePage","","","TC 10.01.03, 10.01.05, 10.01.07, 10.01.09, 10.01.11, 10.01.13 - Verify 6 links in Women's Deals open the correct pages","Check that six links in Women's Deals section lead to the correct pages after click"
"broken","Sun Nov 05 01:17:08 GMT 2023","Sun Nov 05 01:17:13 GMT 2023","5147","tests","test_forgot_your_password","TestForgotYourPassword","","","TC 17.01.11 Verify FYP captcha input field is appropriately labeled","Check if Email field is appropriately labeled "
"passed","Sun Nov 05 01:25:51 GMT 2023","Sun Nov 05 01:25:52 GMT 2023","1111","tests","test_main_page","TestMainPage","","","TC 13.01.42 - Check section 1 in the Promo Block is present in the DOM tree","This test checks if section 1 in the Promo Block is present in the DOM tree on the main page"
"passed","Sun Nov 05 01:36:27 GMT 2023","Sun Nov 05 01:36:28 GMT 2023","938","tests","test_sign_in","TestRegisteredCustomers","","","TC 03.01.07 Verify Email field highlighting on click","
        Check the Email field is activated with a cursor and gets highlighted when clicked
        "
"passed","Sun Nov 05 01:38:40 GMT 2023","Sun Nov 05 01:38:41 GMT 2023","1102","tests","test_women","TestWomenPage","","","TC 12.05.01/02/03/04 Check the Sidebar text is visible","Check if items are visible"
"passed","Sun Nov 05 01:11:15 GMT 2023","Sun Nov 05 01:11:16 GMT 2023","946","tests","test_create_an_account","TestCreateAnAccount","","","TC 04_01_12 Verify Email input field highlighting on click"," Verify that Email input field highlighted when clicked"
"passed","Sun Nov 05 01:36:11 GMT 2023","Sun Nov 05 01:36:11 GMT 2023","183","tests","test_sign_in","TestRegisteredCustomers","","","TC 03.01.01 Verify Sign In Page h1 Header","Check Login Page Heading is present "
"passed","Sun Nov 05 01:13:20 GMT 2023","Sun Nov 05 01:13:21 GMT 2023","1313","tests","test_footer","TestFooter","","","TC 02.01.14 - Check display of Advanced Search link on each page specified in DATA_1","Checks if Advanced Search link is visible on each page in DATA_1"
"passed","Sun Nov 05 01:36:16 GMT 2023","Sun Nov 05 01:36:16 GMT 2023","143","tests","test_sign_in","TestRegisteredCustomers","","","TC 03.01.03 Verify Registered Customers note","Check Registered Customers note is present "
"passed","Sun Nov 05 01:20:20 GMT 2023","Sun Nov 05 01:20:23 GMT 2023","2211","tests","test_header","TestHeader","","","TC 01.03.27 visible and interactive the link ""Gear""","Verify the link 'Gear' is visible and interactive"
"passed","Sun Nov 05 01:16:39 GMT 2023","Sun Nov 05 01:16:39 GMT 2023","421","tests","test_forgot_your_password","TestForgotYourPassword","","","TC 17.01.05 Verify FYP Email field is appropriately labeled","Check if Email field is appropriately labeled "
"passed","Sun Nov 05 01:14:25 GMT 2023","Sun Nov 05 01:14:26 GMT 2023","1241","tests","test_footer","TestFooter","","","TC 02.01.30 - Check if Write for us link is clickable on each page specified in DATA_1","This test checks if Write for us link is clickable on each page specified in DATA_1"
"passed","Sun Nov 05 01:12:04 GMT 2023","Sun Nov 05 01:12:05 GMT 2023","786","tests","test_create_an_account","TestCreateAnAccount","","","TC 04_02_09_13 Verify presence of strong password strength hint"," Verify presence of Password Strength hint and warning color of weak password "
"skipped","Sun Nov 05 01:14:56 GMT 2023","Sun Nov 05 01:14:56 GMT 2023","0","tests","test_footer","TestFooter","","","TC 02.01.41 - Check display of Subscribe Button on each page specified in DATA_1","Checks if Subscribe Button is visible on each page in DATA_1"
"passed","Sun Nov 05 01:13:05 GMT 2023","Sun Nov 05 01:13:07 GMT 2023","1248","tests","test_footer","TestFooter","","","TC 02.01.10 - Check if Privacy and Cookie Policy link is clickable on each page specified in DATA_1","This test checks if Privacy and Cookie Policy link is clickable on each page specified in DATA_1"
"broken","Sun Nov 05 01:11:01 GMT 2023","Sun Nov 05 01:11:06 GMT 2023","5158","tests","test_create_an_account","TestCreateAnAccount","","","TC 04_01_09 Verify checkbox is present and unchecked"," Verify that checkbox is present and unchecked"
"passed","Sun Nov 05 01:20:27 GMT 2023","Sun Nov 05 01:20:31 GMT 2023","3134","tests","test_header","TestHeader","","","TC 01.03.24 correctness of the ""Bottoms"" link of the ""Men"" section","Check 'Bottoms' subsection link in 'Men' section click redirects to the Bottoms page and         the 'Bottoms' header is displayed"
"passed","Sun Nov 05 01:31:39 GMT 2023","Sun Nov 05 01:31:39 GMT 2023","109","tests","test_sale","TestSalePage","","","TC 10.02.02, 10.02.04, 10.02.06, 10.02.08, 10.02.10 - Verify 5 links in Men's Deals section are visible and clickable","Check that five elements in Men's Deals section are displayed and enabled"
"passed","Sun Nov 05 01:35:52 GMT 2023","Sun Nov 05 01:35:57 GMT 2023","4824","tests","test_shopping_cart","TestShoppingCartFull","","","TC 07.02.27 Verify that the list of items in the Shopping Cart is displayed correct","Check that the list of items in the Shopping Cart contains title item which was added from More Choices"
"passed","Sun Nov 05 01:13:48 GMT 2023","Sun Nov 05 01:13:49 GMT 2023","1143","tests","test_footer","TestFooter","","","TC 02.01.22 - Check text of Orders and Returns link on each page specified in DATA_1","Checks if text of Orders and Returns link is correct on each page in DATA_1"
"passed","Sun Nov 05 01:16:33 GMT 2023","Sun Nov 05 01:16:33 GMT 2023","237","tests","test_forgot_your_password","TestForgotYourPassword","","","TC 17.01.03 Verify FYP Email field is present","Check if the Email input field is present"
"passed","Sun Nov 05 01:27:10 GMT 2023","Sun Nov 05 01:27:13 GMT 2023","2470","tests","test_men","TestMenPage","","","TC 14.03.04 Verify the link 'Jackets' is visible and clickable.","Verify that the link 'Jackets' is displayed and clickable"
"passed","Sun Nov 05 01:19:48 GMT 2023","Sun Nov 05 01:19:50 GMT 2023","2063","tests","test_header","TestHeader","","","TC 01.02.01 display and interactivity of the ""Search"" field","Check the ""Search"" field is activated with a vertical flashing symbol ""|"" and highlighted"
"passed","Sun Nov 05 01:36:41 GMT 2023","Sun Nov 05 01:36:42 GMT 2023","1040","tests","test_sign_in","TestRegisteredCustomers","","","TC 03.01.12 Verify Password field highlighting on click","
        Check the Password field is activated with a cursor and gets highlighted when clicked
        "
"passed","Sun Nov 05 01:28:01 GMT 2023","Sun Nov 05 01:28:04 GMT 2023","3068","tests","test_men","TestMenPage","","","TC 14.04.04 Verify the link 'Shorts' is visible and clickable.","Verify that the link 'Shorts' is displayed and clickable"
"passed","Sun Nov 05 01:14:30 GMT 2023","Sun Nov 05 01:14:31 GMT 2023","1079","tests","test_footer","TestFooter","","","TC 02.01.32 - Check text of Write for us link on each page specified in DATA_1","Checks if text of Write for us link is correct on each page in DATA_1"
"passed","Sun Nov 05 01:33:15 GMT 2023","Sun Nov 05 01:33:17 GMT 2023","1666","tests","test_shopping_cart","TestShoppingCartFull","","","tc 07.02.01 Verify that title Shopping Cart is displayed correctly when it is full","Check Shopping Cart title is displayed correctly"
"passed","Sun Nov 05 01:23:18 GMT 2023","Sun Nov 05 01:23:20 GMT 2023","1889","tests","test_main_page","TestMainPage","","","test_tc_06_01_08_check_btn_add_to_cart_is_visible","This test checks that button Add to Cart is visible on the product card when hover by product"
"broken","Sun Nov 05 01:17:47 GMT 2023","Sun Nov 05 01:17:52 GMT 2023","5209","tests","test_forgot_your_password","TestForgotYourPassword","","","TC 17.01.16 Verify click Reload captcha button generates a new captcha image","
        Check that the 'Reload captcha' button generates a new captcha image
        and ensure the new image source is different from the original image source
        "
"passed","Sun Nov 05 01:14:22 GMT 2023","Sun Nov 05 01:14:24 GMT 2023","1205","tests","test_footer","TestFooter","","","TC 02.01.30 - Check if Write for us link is clickable on each page specified in DATA_1","This test checks if Write for us link is clickable on each page specified in DATA_1"
"passed","Sun Nov 05 01:11:09 GMT 2023","Sun Nov 05 01:11:09 GMT 2023","179","tests","test_create_an_account","TestCreateAnAccount","","","TC 04_01_10 Verify Sign in Information heading"," Verify that Sign in Information heading is present"
"skipped","Sun Nov 05 01:14:56 GMT 2023","Sun Nov 05 01:14:56 GMT 2023","0","tests","test_footer","TestFooter","","","TC 02.01.47 - Check Email field in Subscribe section is present in the DOM tree on each page specified in DATA_1","Checks if Email field in Subscribe section is present in the DOM tree on each page specified in DATA_1"
"passed","Sun Nov 05 01:32:43 GMT 2023","Sun Nov 05 01:32:44 GMT 2023","998","tests","test_sale","TestSalePage","","","TC 10.04.03, 10.04.06, 10.04.09 - Verify that links in Main block, 2 columns block open the correct pages","Check that two links in Gear Deals section lead to the correct pages after click"
"passed","Sun Nov 05 01:36:33 GMT 2023","Sun Nov 05 01:36:33 GMT 2023","169","tests","test_sign_in","TestRegisteredCustomers","","","TC 03.01.09 Verify Password field is present","Check if the password input field is present"
"passed","Sun Nov 05 01:33:39 GMT 2023","Sun Nov 05 01:33:40 GMT 2023","1203","tests","test_shopping_cart","TestShoppingCartFull","","","tc 07.02.05 Verify the subtotal amounts in the item cart and in the Summary cart are the same.","Verify the subtotal amounts in the item cart and in the summary cart are the same."
"passed","Sun Nov 05 01:14:05 GMT 2023","Sun Nov 05 01:14:06 GMT 2023","1230","tests","test_footer","TestFooter","","","TC 02.01.25 - Check if 'Contact us' link is clickable on each page specified in DATA_1","This test checks if 'Contact us' link is clickable on each page specified in DATA_1"
"passed","Sun Nov 05 01:38:15 GMT 2023","Sun Nov 05 01:38:15 GMT 2023","6","tests","test_training","TestMainPage","","","TC 16.02.08 Check the title page","This test check the title page"
"passed","Sun Nov 05 01:15:57 GMT 2023","Sun Nov 05 01:16:01 GMT 2023","4197","tests","test_footer","TestFooter","","","TC 02.02.06 - Check Write for us link in footer leads to the correct page from each page specified in DATA_1","Check that Write for us link in footer is correct"
"passed","Sun Nov 05 01:38:25 GMT 2023","Sun Nov 05 01:38:26 GMT 2023","1167","tests","test_training_video_download","TestTrainingVideoDownload","","","TC 18.01.04 message no items to compare is displayed","Verify the message 'You have no items in your wish list.' is visible"
"passed","Sun Nov 05 01:22:58 GMT 2023","Sun Nov 05 01:23:03 GMT 2023","4192","tests","test_header","TestHeader","","","TC 01.03.14 correctness of the ""Shorts"" link of the ""Women"" section","Check 'Shorts' subsection link click in 'Women' section redirects to the Shorts page and         the 'Shorts' header is displayed"
"passed","Sun Nov 05 01:23:13 GMT 2023","Sun Nov 05 01:23:15 GMT 2023","1326","tests","test_main_page","TestMainPage","","","test_check_card_price","This test checks that the card has a price and a price in USD"
"passed","Sun Nov 05 01:20:45 GMT 2023","Sun Nov 05 01:20:48 GMT 2023","2722","tests","test_header","TestHeader","","","TC 01.03.28 correctly redirected the link ""Gear""","Verify the link 'Gear' redirected to the page and the 'Gear' header is displayed"
"skipped","Sun Nov 05 01:37:34 GMT 2023","Sun Nov 05 01:37:34 GMT 2023","0","tests","test_sign_in","TestFailedLogin","","","TC 03.02.01 to 03_02_10 Verify and Failed Login, no error validation","Check Success and Failed Login, no error validation"
"passed","Sun Nov 05 01:38:22 GMT 2023","Sun Nov 05 01:38:24 GMT 2023","1242","tests","test_training_video_download","TestTrainingVideoDownload","","","TC 18.01.03 message ""You have no items to compare."" is displayed","Verify message 'You have no items to compare.' is visible"
"skipped","Sun Nov 05 01:14:56 GMT 2023","Sun Nov 05 01:14:56 GMT 2023","0","tests","test_footer","TestFooter","","","TC 02.01.51 - Check text of placeholder in Subscribe Email Field on each page specified in DATA_1","Checks if text of placeholder in Subscribe Email Field is correct on each page in DATA_1"
"passed","Sun Nov 05 01:24:04 GMT 2023","Sun Nov 05 01:24:06 GMT 2023","1352","tests","test_main_page","TestMainPage","","","TC 13.01.03 - Check the display of an image in section 1 'home-main' in the Promo Block","This test checks if an image in section 1 'home-main' is visible"
"passed","Sun Nov 05 01:11:12 GMT 2023","Sun Nov 05 01:11:13 GMT 2023","1117","tests","test_create_an_account","TestCreateAnAccount","","","TC 04_01_11 Verify presence of email label and the required asterisk"," Verify presence of Email label and the required asterisk "
"passed","Sun Nov 05 01:14:32 GMT 2023","Sun Nov 05 01:14:33 GMT 2023","1175","tests","test_footer","TestFooter","","","TC 02.01.33 - Check Copyright section is present in the DOM tree on each page specified in DATA_1","Checks if Copyright section is present in the DOM tree on each page specified in DATA_1"
"passed","Sun Nov 05 01:37:39 GMT 2023","Sun Nov 05 01:37:39 GMT 2023","239","tests","test_training","TestMainPage","","","TC 16.01.02 Verify Sidebar panel title Category is visible and contains text 'Category'","Check Sidebar Category title has correct text and is visible"
"passed","Sun Nov 05 01:29:47 GMT 2023","Sun Nov 05 01:29:48 GMT 2023","1182","tests","test_promotion_pants","TestPromotionPantsPage","","","test_tc_19_01_02","Checking title of the Style section"
"passed","Sun Nov 05 01:13:35 GMT 2023","Sun Nov 05 01:13:36 GMT 2023","1130","tests","test_footer","TestFooter","","","TC 02.01.18 - Check Orders and Returns link is present in the DOM tree on each page specified in DATA_1","Checks if Orders and Returns link is present in the DOM tree on each page specified in DATA_1"
