"Status","Start Time","Stop Time","Duration in ms","Parent Suite","Suite","Sub Suite","Test Class","Test Method","Name","Description"
"passed","Sun Dec 17 01:17:52 GMT 2023","Sun Dec 17 01:17:52 GMT 2023","65","tests","test_forgot_your_password","TestForgotYourPassword","","","TC 17.01.05 Verify FYP Email field is appropriately labeled","Check if Email field is appropriately labeled "
"passed","Sun Dec 17 01:17:35 GMT 2023","Sun Dec 17 01:17:41 GMT 2023","6265","tests","test_footer","TestFooter","","","TC 02.03.01 - Check correct transfers by clicking on links in the footer","Check that transfers between pages by clicking on links in the footer are correct"
"passed","Sun Dec 17 01:15:46 GMT 2023","Sun Dec 17 01:15:47 GMT 2023","987","tests","test_footer","TestFooter","","","TC 02.01.24 - Check display of 'Contact us' link on each page specified in DATA_1","Checks if 'Contact us' link is visible on each page in DATA_1"
"passed","Sun Dec 17 01:30:15 GMT 2023","Sun Dec 17 01:30:15 GMT 2023","43","tests","test_sale","TestSalePage","","","TC 10.01.02, 10.01.04, 10.01.06, 10.01.08, 10.01.10, 10.01.12 - Verify 6 links in Women's Deals section are visible and clickable","Check that six elements in Women's Deals section are displayed and enabled"
"passed","Sun Dec 17 01:14:19 GMT 2023","Sun Dec 17 01:14:19 GMT 2023","468","tests","test_create_an_account","TestCreateAnAccount","","","TC 04_02_09_13 Verify presence of strong password strength hint"," Verify presence of Password Strength hint and warning color of weak password "
"broken","Sun Dec 17 01:27:33 GMT 2023","Sun Dec 17 01:27:39 GMT 2023","5997","tests","test_men","TestMenPagePromoBlock","","","TC 14.06.27 Verify the visibility of 'Luma tees' promo block.","Verify that the block 'Luma tees' is displayed on the Men page"
"passed","Sun Dec 17 01:31:47 GMT 2023","Sun Dec 17 01:31:47 GMT 2023","72","tests","test_sale","TestSalePage","","","TC 10.04.13 - Verify the text in 3-columns block - sale-free-shipping","Check title-text and content-text in 3-columns block - sale-free-shipping"
"passed","Sun Dec 17 01:30:36 GMT 2023","Sun Dec 17 01:30:37 GMT 2023","794","tests","test_sale","TestSalePage","","","TC 10.01.03, 10.01.05, 10.01.07, 10.01.09, 10.01.11, 10.01.13 - Verify 6 links in Women's Deals open the correct pages","Check that six links in Women's Deals section lead to the correct pages after click"
"passed","Sun Dec 17 01:23:00 GMT 2023","Sun Dec 17 01:23:01 GMT 2023","902","tests","test_main_page","TestMainPage","","","TC 13.01.21 - Check the display of an image in block 2 'home-t-shirts' in the Promo Block","This test checks if the image in section 2 block 2 'home-t-shirts' is visible"
"passed","Sun Dec 17 01:24:43 GMT 2023","Sun Dec 17 01:24:44 GMT 2023","961","tests","test_men","TestMenPage","","","TC 14.03.01 Verify the 'TOPS' subhead is displayed","Verify that the subhead 'TOPS' is displayed"
"passed","Sun Dec 17 01:21:55 GMT 2023","Sun Dec 17 01:21:56 GMT 2023","1267","tests","test_main_page","TestMainPage","","","test_tc_06_01_08_check_btn_add_to_cart_is_visible","This test checks that button Add to Cart is visible on the product card when hover by product"
"passed","Sun Dec 17 01:18:40 GMT 2023","Sun Dec 17 01:18:43 GMT 2023","2177","tests","test_header","TestHeader","","","TC 01.03.36 correctly redirected the link sale","Verify 'Sale' link click redirected to the page and the 'Sale' header is displayed"
"skipped","Sun Dec 17 01:16:32 GMT 2023","Sun Dec 17 01:16:32 GMT 2023","0","tests","test_footer","TestFooter","","","TC 02.01.45 - Check display of text on Subscribe Button on each page specified in DATA_1","Checks if text on Subscribe Button is visible on each page in DATA_1"
"passed","Sun Dec 17 01:34:44 GMT 2023","Sun Dec 17 01:34:44 GMT 2023","67","tests","test_sign_in","TestRegisteredCustomers","","","TC 03.01.06 Verify Email field is appropriately labeled","Check if Email field is appropriately labeled "
"skipped","Sun Dec 17 01:18:00 GMT 2023","Sun Dec 17 01:18:00 GMT 2023","0","tests","test_forgot_your_password","TestForgotYourPassword","","","TC 17.01.13 Verify displayed captcha matches the entered value in FYP captcha field","The test checks if the displayed captcha matches the entered value in the captcha field"
"passed","Sun Dec 17 01:15:14 GMT 2023","Sun Dec 17 01:15:15 GMT 2023","900","tests","test_footer","TestFooter","","","TC 02.01.14 - Check display of Advanced Search link on each page specified in DATA_1","Checks if Advanced Search link is visible on each page in DATA_1"
"passed","Sun Dec 17 01:36:15 GMT 2023","Sun Dec 17 01:36:18 GMT 2023","2635","tests","test_sign_in","TestFailedLogin","","","TC 03.02.01 to 03_02_10 Verify Failed Login, no error validation","Check Success and Failed Login, no error validation"
"passed","Sun Dec 17 01:17:24 GMT 2023","Sun Dec 17 01:17:27 GMT 2023","2815","tests","test_footer","TestFooter","","","TC 02.02.06 - Check Write for us link in footer leads to the correct page from each page specified in DATA_1","Check that Write for us link in footer is correct"
"passed","Sun Dec 17 01:35:57 GMT 2023","Sun Dec 17 01:35:59 GMT 2023","1548","tests","test_sign_in","TestFailedLogin","","","TC 03.02.01 to 03_02_10 Verify Failed Login, no error validation","Check Success and Failed Login, no error validation"
"passed","Sun Dec 17 01:21:11 GMT 2023","Sun Dec 17 01:21:14 GMT 2023","3257","tests","test_header","TestHeader","","","TC 01.03.07 correctness of the ""Jackets"" link of the ""Women"" section","Check 'Jackets' subsection link click in 'Women' section redirects to the Jackets-women page and         the 'Jackets' header is displayed"
"passed","Sun Dec 17 01:34:35 GMT 2023","Sun Dec 17 01:34:35 GMT 2023","71","tests","test_sign_in","TestRegisteredCustomers","","","TC 03.01.02 Verify Registered Customers Heading","Check Registered Customers Heading is present "
"passed","Sun Dec 17 01:14:34 GMT 2023","Sun Dec 17 01:14:35 GMT 2023","943","tests","test_footer","TestFooter","","","TC 02.01.02 - Check Footer display on each page specified in DATA_1","Checks if Footer is visible on each page specified in DATA_1"
"passed","Sun Dec 17 01:37:52 GMT 2023","Sun Dec 17 01:37:53 GMT 2023","887","tests","test_training_video_download","TestTrainingVideoDownload","","","TC 18.01.04 message no items to compare is displayed","Verify the message 'You have no items in your wish list.' is visible"
"passed","Sun Dec 17 01:37:46 GMT 2023","Sun Dec 17 01:37:47 GMT 2023","950","tests","test_training_video_download","TestTrainingVideoDownload","","","TC 18.01.01 subtitle is displayed text compare products","Verify the 'Compare Products' subtitle is visible"
"passed","Sun Dec 17 01:21:53 GMT 2023","Sun Dec 17 01:21:54 GMT 2023","873","tests","test_main_page","TestMainPage","","","test_check_card_rating","This test checks that if a product has a review, then the product card has a rating"
"passed","Sun Dec 17 01:15:52 GMT 2023","Sun Dec 17 01:15:53 GMT 2023","923","tests","test_footer","TestFooter","","","TC 02.01.25 - Check if 'Contact us' link is clickable on each page specified in DATA_1","This test checks if 'Contact us' link is clickable on each page specified in DATA_1"
"passed","Sun Dec 17 01:33:01 GMT 2023","Sun Dec 17 01:33:15 GMT 2023","14158","tests","test_shopping_cart","TestShoppingCartFull","","","tc 07.02.23 Verify Order Total in Summury displayed correctly.","Verify Order Total in Summary: Order Total = Subtotal - Discount + Tax and displayed correctly."
"passed","Sun Dec 17 01:22:38 GMT 2023","Sun Dec 17 01:22:38 GMT 2023","893","tests","test_main_page","TestMainPage","","","TC 13.01.10 - Check display of block 1 'home-pants' in section 2 in the Promo Block","This test checks if block 1 'home-pants' is displayed in section 2 of Promo Block under header
            on the Main Page"
"passed","Sun Dec 17 01:36:40 GMT 2023","Sun Dec 17 01:36:40 GMT 2023","44","tests","test_training","TestMainPage","","","TC 16.01.01 Verify Sidebar panel title Shop By is visible and contains text 'Shop By'","Check Sidebar Shop By title has correct text and is visible"
"passed","Sun Dec 17 01:32:16 GMT 2023","Sun Dec 17 01:32:16 GMT 2023","536","tests","test_shopping_cart","TestShoppingCartFull","","","tc 07.02.04 Verify that entered quantity displayed correctly after changing","Check that entered quantity displayed correctly after changing."
"passed","Sun Dec 17 01:20:47 GMT 2023","Sun Dec 17 01:20:51 GMT 2023","4174","tests","test_header","TestHeader","","","TC 01.01.10 functionality of the ""My account"" section in the dropdown list","Check the list appears with sections 'My Account', 'My Wish List', 'Sign Out' after clicking the button,        then clicking on 'My Account' redirects to the account page with the header 'My Account' displayed"
"broken","Sun Dec 17 01:27:11 GMT 2023","Sun Dec 17 01:27:17 GMT 2023","5961","tests","test_men","TestMenPagePromoBlock","","","TC 14.06.24 Verify that the 'Cool it now' text is visible.","Verify that text-2 in 'Luma shorts' block correctly displayed"
"passed","Sun Dec 17 01:23:02 GMT 2023","Sun Dec 17 01:23:03 GMT 2023","988","tests","test_main_page","TestMainPage","","","TC 13.01.21_01 - Check correctness of the image in block 2 'home-t-shirts' in the Promo Block","This test checks if the image in section 2 block 2 'home-t-shirts' is correct"
"passed","Sun Dec 17 01:19:24 GMT 2023","Sun Dec 17 01:19:26 GMT 2023","2084","tests","test_header","TestHeader","","","TC 01.03.02 correctly redirected the_link ""What is New""","Verify the link 'What's new' redirected to the page and the 'What's new' header is displayed"
"passed","Sun Dec 17 01:35:37 GMT 2023","Sun Dec 17 01:35:40 GMT 2023","2948","tests","test_sign_in","TestFailedLogin","","","TC 03.02.01 to 03_02_10 Verify Failed Login, no error validation","Check Success and Failed Login, no error validation"
"skipped","Sun Dec 17 01:16:32 GMT 2023","Sun Dec 17 01:16:32 GMT 2023","0","tests","test_footer","TestFooter","","","TC 02.01.40 - Check Subscribe Button is present in the DOM tree on each page specified in DATA_1","Checks if Subscribe Button is present in the DOM tree on each page specified in DATA_1"
"broken","Sun Dec 17 01:37:02 GMT 2023","Sun Dec 17 01:37:07 GMT 2023","5090","tests","test_training","TestMainPage","","","TC 16.02.03 - Check the display of block 2 erin","This test checks block-promo training-erin is displayed"
"passed","Sun Dec 17 01:31:31 GMT 2023","Sun Dec 17 01:31:32 GMT 2023","881","tests","test_sale","TestSalePage","","","TC 10.04.03, 10.04.06, 10.04.09 - Verify that links in Main block, 2 columns block open the correct pages","Check that two links in Gear Deals section lead to the correct pages after click"
"passed","Sun Dec 17 01:14:38 GMT 2023","Sun Dec 17 01:14:39 GMT 2023","860","tests","test_footer","TestFooter","","","TC 02.01.03 - Check Search Terms link is present in the DOM tree on each page specified in DATA_1","Checks if the Search Terms link is present in the DOM tree on each page specified in DATA_1"
"passed","Sun Dec 17 01:18:46 GMT 2023","Sun Dec 17 01:18:47 GMT 2023","1000","tests","test_header","TestHeader","","","TC 01.02.03 presence of a  placeholder in the ""Search"" field","Check the ""Search"" field in the header contains the placeholder 'Search entire store here...'"
"passed","Sun Dec 17 01:14:58 GMT 2023","Sun Dec 17 01:14:59 GMT 2023","989","tests","test_footer","TestFooter","","","TC 02.01.09 - Check display of Privacy and Cookie Policy link on each page specified in DATA_1","Checks if Privacy and Cookie Policy link is visible on each page in DATA_1"
"broken","Sun Dec 17 01:26:49 GMT 2023","Sun Dec 17 01:26:55 GMT 2023","5965","tests","test_men","TestMenPagePromoBlock","","","TC 14.06.21 Verify the visibility of 'Luma shorts' promo block.","Verify that the block 'Luma shorts' is displayed on the Men page"
"passed","Sun Dec 17 01:20:22 GMT 2023","Sun Dec 17 01:20:25 GMT 2023","3265","tests","test_header","TestHeader","","","TC 01.01.09 functionality of the dropdown list button","Check the display of the dropdown list after clicking the button if the user is authorized"
"passed","Sun Dec 17 01:23:06 GMT 2023","Sun Dec 17 01:23:07 GMT 2023","963","tests","test_main_page","TestMainPage","","","TC 13.01.23 - Check the display of the title in block 2 'home-t-shirts' in the Promo Block","This test checks if the info block title in section 2 block 2 'home-t-shirts' is correct
            in the Promo Block under header on the main page"
"passed","Sun Dec 17 01:31:19 GMT 2023","Sun Dec 17 01:31:19 GMT 2023","41","tests","test_sale","TestSalePage","","","TC 10.04.01 - Verify that the Women Deals contains an image","Check img existence of Women's Deals section"
"skipped","Sun Dec 17 01:16:32 GMT 2023","Sun Dec 17 01:16:32 GMT 2023","0","tests","test_footer","TestFooter","","","TC 02.01.41 - Check display of Subscribe Button on each page specified in DATA_1","Checks if Subscribe Button is visible on each page in DATA_1"
"passed","Sun Dec 17 01:19:42 GMT 2023","Sun Dec 17 01:19:45 GMT 2023","3176","tests","test_header","TestHeader","","","TC 01.03.26 correctness ""Shorts"" link","Check 'Shorts' subsection link in 'Men' section click redirects to the Shorts page and             the 'Shorts' header is displayed"
"passed","Sun Dec 17 01:16:23 GMT 2023","Sun Dec 17 01:16:24 GMT 2023","962","tests","test_footer","TestFooter","","","TC 02.01.35 - Check Copyright text is present in the DOM tree on each page specified in DATA_1","Checks if Copyright text is present in the DOM tree on each page specified in DATA_1"
"passed","Sun Dec 17 01:16:41 GMT 2023","Sun Dec 17 01:16:42 GMT 2023","944","tests","test_footer","TestFooter","","","TC 02.01.54 - Check if 'Subscribe to our mailing list' link is clickable on each page specified in DATA_1","This test checks if 'Subscribe to our mailing list' link is clickable on each page specified in DATA_1"
"passed","Sun Dec 17 01:19:06 GMT 2023","Sun Dec 17 01:19:08 GMT 2023","2191","tests","test_header","TestHeader","","","TC 01.03.33 correctly redirected the link ""Training""","Verify 'Training' link click redirected to the page and the 'Training' header is displayed"
"skipped","Sun Dec 17 01:13:57 GMT 2023","Sun Dec 17 01:13:57 GMT 2023","0","tests","test_create_an_account","TestCreateAnAccount","","","test 04.02.01 create an account with correct data"," Verify that customer can Create An Account with correct data"
"passed","Sun Dec 17 01:35:34 GMT 2023","Sun Dec 17 01:35:36 GMT 2023","1750","tests","test_sign_in","TestLogin","","","TC 03.02.09 Verify login with valid mail containing trailing leading_spaces - Positive","Check Success Login with correct credentials"
"passed","Sun Dec 17 01:36:04 GMT 2023","Sun Dec 17 01:36:07 GMT 2023","2810","tests","test_sign_in","TestFailedLogin","","","TC 03.02.01 to 03_02_10 Verify Failed Login, no error validation","Check Success and Failed Login, no error validation"
"passed","Sun Dec 17 01:13:49 GMT 2023","Sun Dec 17 01:13:50 GMT 2023","776","tests","test_create_an_account","TestCreateAnAccount","","","TC 04_01_16 Verify presence of Confirm Password label and the required asterisk"," Verify presence of Confirm Password label and the required asterisk "
"passed","Sun Dec 17 01:21:32 GMT 2023","Sun Dec 17 01:21:34 GMT 2023","2471","tests","test_header","TestHeader","","","TC 01.03.12 correctness of the ""Bottoms"" link of the ""Women"" section","Check 'Bottoms' subsection link in 'Women' section click redirects to the Bottoms page and         the 'Bottoms' header is displayed"
"passed","Sun Dec 17 01:20:43 GMT 2023","Sun Dec 17 01:20:46 GMT 2023","3221","tests","test_header","TestHeader","","","TC 01.03.22 correctness of the ""Tanks"" link of the ""Men"" section","Check 'Tanks' subsection link click in 'Men' section redirects to the Tanks-men page and         the 'Tanks' header is displayed"
"skipped","Sun Dec 17 01:18:00 GMT 2023","Sun Dec 17 01:18:00 GMT 2023","0","tests","test_forgot_your_password","TestForgotYourPassword","","","TC 17.01.16 Verify click Reload captcha button generates a new captcha image","
        Check that the 'Reload captcha' button generates a new captcha image
        and ensure the new image source is different from the original image source
        "
"passed","Sun Dec 17 01:21:57 GMT 2023","Sun Dec 17 01:21:58 GMT 2023","1356","tests","test_main_page","TestMainPage","","","TC 06.01.09 - check the color change to add to cart button","This test check the color change when hovering over the Add to Cart button"
"passed","Sun Dec 17 01:25:05 GMT 2023","Sun Dec 17 01:25:06 GMT 2023","1767","tests","test_men","TestMenPage","","","TC 14.03.09 Verify the link 'Tanks' redirects to a correct page.","Verify that the link 'Tanks' correctly opens and redirects to a new webpage,         the header 'Tanks' is displayed"
"skipped","Sun Dec 17 01:18:02 GMT 2023","Sun Dec 17 01:18:02 GMT 2023","0","tests","test_forgot_your_password","TestForgotYourPasswordFunctionality","","","TC 17.01.24 Verify Error on resetting My Password with invalid captcha","Check error message on attempt to reset password with invalid captcha"
"passed","Sun Dec 17 01:23:12 GMT 2023","Sun Dec 17 01:23:13 GMT 2023","1009","tests","test_main_page","TestMainPage","","","TC 13.01.26 - Check the display of an image in block 3 'home-erin' in the Promo Block","This test checks if the image in section 2 block 3 'home-erin' is visible"
"passed","Sun Dec 17 01:30:21 GMT 2023","Sun Dec 17 01:30:21 GMT 2023","26","tests","test_sale","TestSalePage","","","TC 10.01.02, 10.01.04, 10.01.06, 10.01.08, 10.01.10, 10.01.12 - Verify 6 links in Women's Deals section are visible and clickable","Check that six elements in Women's Deals section are displayed and enabled"
"skipped","Sun Dec 17 01:18:00 GMT 2023","Sun Dec 17 01:18:00 GMT 2023","0","tests","test_forgot_your_password","TestForgotYourPassword","","","TC 17.01.09 Verify FYP captcha input field is present","Check if the captcha input field is present"
"passed","Sun Dec 17 01:13:19 GMT 2023","Sun Dec 17 01:13:20 GMT 2023","707","tests","test_create_an_account","TestCreateAnAccount","","","TC 04_01_04 Verify First name input field highlighting on label click"," Verify that First name input field highlighted when label is clicked"
"passed","Sun Dec 17 01:23:04 GMT 2023","Sun Dec 17 01:23:05 GMT 2023","965","tests","test_main_page","TestMainPage","","","TC 13.01.22 - Check the display of the info block in block 2 't-shirts' in the Promo Block","This test checks if info block in section 2 block 2 'home-t-shirts' is displayed
            in the Promo Block under header on the main page"
"skipped","Sun Dec 17 01:30:42 GMT 2023","Sun Dec 17 01:30:42 GMT 2023","42","tests","test_sale","TestSalePage","","","TC 10.02.01 - Verify 'MEN'S DEALS' title is correct","Check title of Men's Deals section"
"skipped","Sun Dec 17 01:18:00 GMT 2023","Sun Dec 17 01:18:00 GMT 2023","0","tests","test_forgot_your_password","TestForgotYourPassword","","","TC 17.01.14 Verify Reload captcha button is present","Check if the 'Reload captcha' button is present"
"passed","Sun Dec 17 01:16:35 GMT 2023","Sun Dec 17 01:16:36 GMT 2023","873","tests","test_footer","TestFooter","","","TC 02.01.52 - Check 'Subscribe to our mailing list' link is present in the DOM tree on each page specified in DATA_1","Checks if 'Subscribe to our mailing list' link is present in the DOM tree on each page
        specified in DATA_1"
"passed","Sun Dec 17 01:20:09 GMT 2023","Sun Dec 17 01:20:13 GMT 2023","3349","tests","test_header","TestHeader","","","TC 01.01.06 absence of the ""Create an account"" link display","Check the 'Create an account' link is not displayed if the user is authorized"
"passed","Sun Dec 17 01:22:30 GMT 2023","Sun Dec 17 01:22:31 GMT 2023","852","tests","test_main_page","TestMainPage","","","TC 13.01.04 - Check correctness of the image in section 1 'home-main' in the Promo Block","This test checks if the image in section 1 'home-main' is correct"
"passed","Sun Dec 17 01:29:19 GMT 2023","Sun Dec 17 01:29:30 GMT 2023","11673","tests","test_reviews_page","TestReviews","","","test_tc_01_15_02_check_that_it_is_possible_to_vote_for_2_star","
        The user is NOT logged in, located in the product card, section ""Reviews""
        1. All required fields are filled with correct data
        2. Pressed 2 star
        3.The ""Submit Review"" button is pressed
        Result: Present in the DOM and visible on the page the message: ""You submitted your review for moderation.
        This code works when run on Win, Mac, Ubuntu on a real laptop and has the features of working on GitHub Action.
        When interacting with the GitHub Action, it checks not for the text of the ""Success"" message, but for the ""Success"" URL""
        "
"passed","Sun Dec 17 01:19:56 GMT 2023","Sun Dec 17 01:19:58 GMT 2023","2462","tests","test_header","TestHeader","","","TC 01.03.30 correctly redirected the link ""Gear - Fitness Equipment""","Verify the link 'Fitness Equipment' redirected to the page and the 'Fitness Equipment' header is displayed"
"passed","Sun Dec 17 01:23:37 GMT 2023","Sun Dec 17 01:23:38 GMT 2023","991","tests","test_main_page","TestMainPage","","","TC 13.01.36 - Check the display of an image in block 5 'home-eco' in the Promo Block","This test checks if the image in section 2 block 5 'home-eco' is visible"
"passed","Sun Dec 17 01:23:53 GMT 2023","Sun Dec 17 01:23:54 GMT 2023","879","tests","test_main_page","TestMainPage","","","TC 13.01.43 - Check section 2 in the Promo Block is present in the DOM tree","This test checks if section 2 in the Promo Block is present in the DOM tree on the main page"
"passed","Sun Dec 17 01:31:39 GMT 2023","Sun Dec 17 01:31:39 GMT 2023","20","tests","test_sale","TestSalePage","","","TC 10.04.10 - Verify that the sale-20-off contains an image","Check img existence of 1st column in 3-columns Promo Block section"
"passed","Sun Dec 17 01:18:28 GMT 2023","Sun Dec 17 01:18:29 GMT 2023","1222","tests","test_header","TestHeader","","","TC 01.01.02 display and interactivity of the ""Create an account"" link","Check 'Create an account' link is displayed and underlined"
"passed","Sun Dec 17 01:25:15 GMT 2023","Sun Dec 17 01:25:17 GMT 2023","1478","tests","test_men","TestMenPage","","","TC 14.04.04 Verify the link 'Shorts' is visible and clickable.","Verify that the link 'Shorts' is displayed and clickable"
"passed","Sun Dec 17 01:34:53 GMT 2023","Sun Dec 17 01:34:53 GMT 2023","38","tests","test_sign_in","TestRegisteredCustomers","","","TC 03.01.10 Verify Password field is correct format and clickable","Check if the password input field is of correct format (input-text) and clickable"
"passed","Sun Dec 17 01:17:47 GMT 2023","Sun Dec 17 01:17:48 GMT 2023","37","tests","test_forgot_your_password","TestForgotYourPassword","","","TC 17.01.03 Verify FYP Email field is present","Check if the Email input field is present"
"passed","Sun Dec 17 01:24:48 GMT 2023","Sun Dec 17 01:24:50 GMT 2023","1538","tests","test_men","TestMenPage","","","TC 14.03.03 Verify the link 'Hoodies&Sweatshirts' redirects to a correct page.","Verify that the link 'Hoodies&Sweatshirts' correctly opens and redirects to a new webpage, the header         'Hoodies&Sweatshirt' is displayed"
"passed","Sun Dec 17 01:23:14 GMT 2023","Sun Dec 17 01:23:15 GMT 2023","933","tests","test_main_page","TestMainPage","","","TC 13.01.26_01 - Check correctness of the image in block 3 'home-erin' in the Promo Block","This test checks if the image in section 2 block 3 'home-erin' is correct"
"passed","Sun Dec 17 01:23:35 GMT 2023","Sun Dec 17 01:23:36 GMT 2023","1037","tests","test_main_page","TestMainPage","","","TC 13.01.36 - Check the display of the image in block 5 'home-eco' in the Promo Block","This test checks if the image in section 2 block 5 'home-eco' is correct
            in the Promo Block under header on the main page"
"skipped","Sun Dec 17 01:13:31 GMT 2023","Sun Dec 17 01:13:31 GMT 2023","0","tests","test_create_an_account","TestCreateAnAccount","","","TC 04_01_09 Verify checkbox is present and unchecked"," Verify that checkbox is present and unchecked"
"passed","Sun Dec 17 01:18:12 GMT 2023","Sun Dec 17 01:18:13 GMT 2023","1012","tests","test_gear","TestGearPage","","","test_tc_10_01_01","Checking title of the Category section"
"passed","Sun Dec 17 01:31:10 GMT 2023","Sun Dec 17 01:31:10 GMT 2023","65","tests","test_sale","TestSalePage","","","TC 10.03.02, 10.02.04 - Verify 2 links in Gear Deals section are visible and clickable","Check that two elements in Gear Deals section are displayed and enabled"
"passed","Sun Dec 17 01:18:25 GMT 2023","Sun Dec 17 01:18:27 GMT 2023","1568","tests","test_gear","TestGearPage","","","test_TC_11_01_07","Check that watches link is correct"
"passed","Sun Dec 17 01:25:10 GMT 2023","Sun Dec 17 01:25:11 GMT 2023","1697","tests","test_men","TestMenPage","","","TC 14.04.02 Verify the link 'Pants' is visible and clickable.","Verify that the link 'Pants' is displayed and clickable"
"passed","Sun Dec 17 01:15:10 GMT 2023","Sun Dec 17 01:15:11 GMT 2023","841","tests","test_footer","TestFooter","","","TC 02.01.13 - Check Advanced Search link is present in the DOM tree on each page specified in DATA_1","Checks if Advanced Search link is present in the DOM tree on each page specified in DATA_1"
"skipped","Sun Dec 17 01:18:11 GMT 2023","Sun Dec 17 01:18:11 GMT 2023","0","tests","test_forgot_your_password","TestForgotYourPasswordFunctionality","","","TC 17.01.26 Verify error on resetting My Password with empty captcha","Check error message on attempt to reset password with empty captcha input field"
"passed","Sun Dec 17 01:15:16 GMT 2023","Sun Dec 17 01:15:17 GMT 2023","1054","tests","test_footer","TestFooter","","","TC 02.01.14 - Check display of Advanced Search link on each page specified in DATA_1","Checks if Advanced Search link is visible on each page in DATA_1"
