"Status","Start Time","Stop Time","Duration in ms","Parent Suite","Suite","Sub Suite","Test Class","Test Method","Name","Description"
"passed","Fri Oct 27 01:36:37 GMT 2023","Fri Oct 27 01:36:38 GMT 2023","364","tests","test_training","TestMainPage","","","TC 16.01.01 Verify Sidebar panel title Shop By is visible and contains text 'Shop By'","Check Sidebar Shop By title has correct text and is visible"
"passed","Fri Oct 27 01:23:32 GMT 2023","Fri Oct 27 01:23:33 GMT 2023","1464","tests","test_main_page","TestMainPage","","","TC 13.01.15 - Check the display of an image in block 1 'home-pants' in the Promo Block","This test checks if the image in section 2 block 1 'home-pants' is visible"
"passed","Fri Oct 27 01:37:27 GMT 2023","Fri Oct 27 01:37:29 GMT 2023","1387","tests","test_training_video_download","TestTrainingVideoDownload","","","TC 18.01.04 message no items to compare is displayed","Verify the message 'You have no items in your wish list.' is visible"
"passed","Fri Oct 27 01:28:40 GMT 2023","Fri Oct 27 01:28:41 GMT 2023","362","tests","test_orders_and_returns","TestOrdersAndReturnsPage","","","TC 05.01.03 - Verify that 'Order ID' input field is visible","This test checks Order ID input field is visible"
"skipped","Fri Oct 27 01:36:35 GMT 2023","Fri Oct 27 01:36:35 GMT 2023","0","tests","test_sign_in","TestFailedLogin","","","TC 03.02.02 to 03_02_10 Verify Error on Failed Login with invalid credentials","Check error on Failed Login with invalid credentials, case-sensitive password and password with spaces"
"passed","Fri Oct 27 01:17:29 GMT 2023","Fri Oct 27 01:17:31 GMT 2023","1305","tests","test_gear","TestGearPage","","","test_tc_11_01_06","Check that watches is displayed and enabled"
"passed","Fri Oct 27 01:26:10 GMT 2023","Fri Oct 27 01:26:12 GMT 2023","1387","tests","test_men","TestMenPage","","","TC 14.03.01 Verify the 'TOPS' subhead is displayed","Verify that the subhead 'TOPS' is displayed"
"passed","Fri Oct 27 01:21:48 GMT 2023","Fri Oct 27 01:21:50 GMT 2023","1809","tests","test_main_page","TestMainPage","","","test_tc_06_01_08_check_btn_add_to_cart_is_visible","This test checks that button Add to Cart is visible on the product card when hover by product"
"passed","Fri Oct 27 01:11:02 GMT 2023","Fri Oct 27 01:11:03 GMT 2023","1207","tests","test_footer","TestFooter","","","TC 02.01.07 - Check text of Search Terms link on each page specified in DATA_1","Checks if text of Search Terms link is correct on each page in DATA_1"
"passed","Fri Oct 27 01:32:31 GMT 2023","Fri Oct 27 01:32:33 GMT 2023","1206","tests","test_shopping_cart","TestShoppingCartFull","","","tc 07.02.03 Verify that quantity field is displayed and clickable","Check that quantity field is displayed and clickable."
"passed","Fri Oct 27 01:10:56 GMT 2023","Fri Oct 27 01:10:58 GMT 2023","1880","tests","test_footer","TestFooter","","","TC 02.01.06 Check if Search Terms link is interactive","This test checks if Search Terms link is underlined while hovering over it"
"passed","Fri Oct 27 01:26:21 GMT 2023","Fri Oct 27 01:26:23 GMT 2023","2276","tests","test_men","TestMenPage","","","TC 14.03.04 Verify the link 'Jackets' is visible and clickable.","Verify that the link 'Jackets' is displayed and clickable"
"passed","Fri Oct 27 01:37:09 GMT 2023","Fri Oct 27 01:37:09 GMT 2023","584","tests","test_training","TestMainPage","","","TC 16.02.06 Check the cursor change to block training main ","This test check the cursor change when hovering over the block training main"
"passed","Fri Oct 27 01:26:06 GMT 2023","Fri Oct 27 01:26:09 GMT 2023","3263","tests","test_men","TestMenPage","","","TC 14.02.05 Verify the link 'Bottoms' redirects to a correct page.","Verify that the link 'Bottoms' correctly opens and redirects to a new webpage, the header 'Bottoms' is
          displayed"
"passed","Fri Oct 27 01:35:29 GMT 2023","Fri Oct 27 01:35:30 GMT 2023","763","tests","test_sign_in","TestRegisteredCustomers","","","TC 03.01.08 Verify displayed email matches the entered email in Email field","Check if the displayed email matches the entered email in Email field"
"passed","Fri Oct 27 01:24:13 GMT 2023","Fri Oct 27 01:24:14 GMT 2023","1350","tests","test_main_page","TestMainPage","","","TC 13.01.28 - Check the display of the title in block 3 'home-erin' in the Promo Block","This test checks if the info block title in section 2 block 3 'home-erin' is correct
            in the Promo Block under header on the main page"
"passed","Fri Oct 27 01:26:54 GMT 2023","Fri Oct 27 01:26:56 GMT 2023","2289","tests","test_men","TestMenPage","","","TC 14.04.04 Verify the link 'Shorts' is visible and clickable.","Verify that the link 'Shorts' is displayed and clickable"
"passed","Fri Oct 27 01:11:30 GMT 2023","Fri Oct 27 01:11:32 GMT 2023","1431","tests","test_footer","TestFooter","","","TC 02.01.14 - Check display of Advanced Search link on each page specified in DATA_1","Checks if Advanced Search link is visible on each page in DATA_1"
"broken","Fri Oct 27 01:16:03 GMT 2023","Fri Oct 27 01:16:08 GMT 2023","5178","tests","test_forgot_your_password","TestForgotYourPassword","","","TC 17.01.15 Verify Reload captcha button is clickable","Check that the 'Reload captcha' button is clickable"
"passed","Fri Oct 27 01:31:14 GMT 2023","Fri Oct 27 01:31:14 GMT 2023","273","tests","test_sale","TestSalePage","","","TC 10.03.02, 10.02.04 - Verify 2 links in Gear Deals section are visible and clickable","Check that two elements in Gear Deals section are displayed and enabled"
"passed","Fri Oct 27 01:18:49 GMT 2023","Fri Oct 27 01:18:51 GMT 2023","2259","tests","test_header","TestHeader","","","TC 01.03.23 display and interactivity of the ""Bottoms"" section of the ""Men"" section","Check the 'Bottoms' subsection in 'Men' section is displayed and the 'Pants' and 'Shorts'         subsections is displayed"
"passed","Fri Oct 27 01:18:41 GMT 2023","Fri Oct 27 01:18:44 GMT 2023","2662","tests","test_header","TestHeader","","","TC 01.03.02 correctly redirected the_link ""What is New""","Verify the link 'What's new' redirected to the page and the 'What's new' header is displayed"
"skipped","Fri Oct 27 01:13:14 GMT 2023","Fri Oct 27 01:13:14 GMT 2023","0","tests","test_footer","TestFooter","","","TC 02.01.38 - Check Subscribe section is present in the DOM tree on each page specified in DATA_1","Checks if Subscribe section is present in the DOM tree on each page specified in DATA_1"
"passed","Fri Oct 27 01:27:54 GMT 2023","Fri Oct 27 01:27:57 GMT 2023","2483","tests","test_men","TestMenPagePromoBlock","","","TC 14.06.26 Verify the click on the block 'Luma shorts' redirects to a correct page.","Verify that the click on the block 'Luma shorts' correctly redirects to a new webpage"
"passed","Fri Oct 27 01:23:07 GMT 2023","Fri Oct 27 01:23:08 GMT 2023","1162","tests","test_main_page","TestMainPage","","","TC 13.01.04 - Check correctness of the image in section 1 'home-main' in the Promo Block","This test checks if the image in section 1 'home-main' is correct"
"passed","Fri Oct 27 01:31:32 GMT 2023","Fri Oct 27 01:31:32 GMT 2023","351","tests","test_sale","TestSalePage","","","TC 10.04.07 - Verify that the Gear Deals contains an image","Check img existence of Gear Deals section"
"passed","Fri Oct 27 01:27:13 GMT 2023","Fri Oct 27 01:27:15 GMT 2023","1542","tests","test_men","TestMenPagePromoBlock","","","TC 14.06.12 Verify that the 'Buy 3 Luma tees' text in the 'Save up to $24!' promo block is visible.","Verify that text-2 in 'Save up to $24!' block correctly displayed"
"skipped","Fri Oct 27 01:13:14 GMT 2023","Fri Oct 27 01:13:14 GMT 2023","0","tests","test_footer","TestFooter","","","TC 02.01.46 - Check text on Subscribe Button on each page specified in DATA_1","Checks if text on Subscribe Button is correct on each page in DATA_1"
"passed","Fri Oct 27 01:10:10 GMT 2023","Fri Oct 27 01:10:11 GMT 2023","881","tests","test_create_an_account","TestCreateAnAccount","","","TC 04_02_09_13 Verify presence of strong password strength hint"," Verify presence of Password Strength hint and warning color of weak password "
"passed","Fri Oct 27 01:25:17 GMT 2023","Fri Oct 27 01:25:18 GMT 2023","1279","tests","test_main_page","TestMainPage","","","TC 13.01.50 - Check if block 1 'home-pants' in section 2 is clickablein the Promo Block on the main page","This test checks if block 1 'home-pants' in section 2 in Promo Block under header is clickable"
"passed","Fri Oct 27 01:29:59 GMT 2023","Fri Oct 27 01:30:00 GMT 2023","206","tests","test_sale","TestSalePage","","","TC 10.01.02, 10.01.04, 10.01.06, 10.01.08, 10.01.10, 10.01.12 - Verify 6 links in Women's Deals section are visible and clickable","Check that six elements in Women's Deals section are displayed and enabled"
"passed","Fri Oct 27 01:11:18 GMT 2023","Fri Oct 27 01:11:19 GMT 2023","1406","tests","test_footer","TestFooter","","","TC 02.01.10 - Check if Privacy and Cookie Policy link is clickable on each page specified in DATA_1","This test checks if Privacy and Cookie Policy link is clickable on each page specified in DATA_1"
"passed","Fri Oct 27 01:35:12 GMT 2023","Fri Oct 27 01:35:12 GMT 2023","246","tests","test_sign_in","TestRegisteredCustomers","","","TC 03.01.02 Verify Registered Customers Heading","Check Registered Customers Heading is present "
"passed","Fri Oct 27 01:31:03 GMT 2023","Fri Oct 27 01:31:04 GMT 2023","1406","tests","test_sale","TestSalePage","","","TC 10.02.03, 10.02.05, 10.02.07, 10.02.09, 10.02.11 - Verify 5 links in Men's Deals open the correct pages","Check that five links in Men's Deals section lead to the correct pages after click"
"passed","Fri Oct 27 01:25:51 GMT 2023","Fri Oct 27 01:25:54 GMT 2023","2812","tests","test_main_page","TestMainPage","","","TC 13.02.06 - Check the link in section 2 block 5 'home-eco' in the Promo Block leads to the correct page","Check that link in section 2 block 5 'home-eco' is correct"
"passed","Fri Oct 27 01:20:08 GMT 2023","Fri Oct 27 01:20:12 GMT 2023","3957","tests","test_header","TestHeader","","","TC 01.03.20 correctness of the ""Hoodies & Sweatshirts"" link of the ""Men"" section","Check 'Hoodies & Sweatshirts' subsection link click in 'Men' section redirects to the         Hoodies & Sweatshirts-men page and the 'Hoodies & Sweatshirts' header is displayed"
"passed","Fri Oct 27 01:28:27 GMT 2023","Fri Oct 27 01:28:29 GMT 2023","1503","tests","test_men","TestMenPagePromoBlock","","","TC 14.06.37 Verify that the 'Shop Hoodies' text is visible.","Verify that text-3 in 'Luma hoodies' block correctly displayed"
"passed","Fri Oct 27 01:36:40 GMT 2023","Fri Oct 27 01:36:40 GMT 2023","434","tests","test_training","TestMainPage","","","TC 16.01.02 Verify Sidebar panel title Category is visible and contains text 'Category'","Check Sidebar Category title has correct text and is visible"
"passed","Fri Oct 27 01:16:34 GMT 2023","Fri Oct 27 01:16:35 GMT 2023","408","tests","test_forgot_your_password","TestForgotYourPassword","","","TC 17.01.19 Verify Reset My Password button is present","Check if the 'Reload captcha' button is present"
"passed","Fri Oct 27 01:22:59 GMT 2023","Fri Oct 27 01:23:00 GMT 2023","1332","tests","test_main_page","TestMainPage","","","TC 13.01.01 - Check the display of the Promo Block under header on the Main Page","This test checks if Promo Block under header is displayed on the Main Page"
"passed","Fri Oct 27 01:28:30 GMT 2023","Fri Oct 27 01:28:33 GMT 2023","2406","tests","test_men","TestMenPagePromoBlock","","","TC 14.06.38 Verify the click on the block 'Luma hoodies' redirects to a correct page.","Verify that the click on the block 'Luma hoodies' correctly redirects to a new webpage"
"passed","Fri Oct 27 01:19:19 GMT 2023","Fri Oct 27 01:19:22 GMT 2023","2996","tests","test_header","TestHeader","","","TC 01.03.30 correctly redirected the link ""Gear - Fitness Equipment""","Verify the link 'Fitness Equipment' redirected to the page and the 'Fitness Equipment' header is displayed"
"passed","Fri Oct 27 01:30:38 GMT 2023","Fri Oct 27 01:30:39 GMT 2023","198","tests","test_sale","TestSalePage","","","TC 10.02.02, 10.02.04, 10.02.06, 10.02.08, 10.02.10 - Verify 5 links in Men's Deals section are visible and clickable","Check that five elements in Men's Deals section are displayed and enabled"
"passed","Fri Oct 27 01:23:42 GMT 2023","Fri Oct 27 01:23:44 GMT 2023","1345","tests","test_main_page","TestMainPage","","","TC 13.01.19 - Check the display of the text in block 1 'home-pants' in the Promo Block","This test checks if the info block text in section 2 block 1 'home-pants' is correct
            in the Promo Block under header on the Main Page"
"passed","Fri Oct 27 01:12:08 GMT 2023","Fri Oct 27 01:12:09 GMT 2023","1076","tests","test_footer","TestFooter","","","TC 02.01.23 - Check 'Contact us' link is present in the DOM tree on each page specified in DATA_1","Checks if 'Contact us' link is present in the DOM tree on each page specified in DATA_1"
"passed","Fri Oct 27 01:25:07 GMT 2023","Fri Oct 27 01:25:08 GMT 2023","1103","tests","test_main_page","TestMainPage","","","TC 13.01.46 - Check block 3 'home-erin' in section 2 of the Promo Block is present in the DOM tree","This test checks if block 3 'home-erin' in section 2 in the Promo Block is present
            in the DOM tree on the main page"
"passed","Fri Oct 27 01:24:02 GMT 2023","Fri Oct 27 01:24:04 GMT 2023","1237","tests","test_main_page","TestMainPage","","","TC 13.01.25 - Check the display of the sign in block 2 'home-t-shirts' in the Promo Block","This test checks if the sign in info block in section 2 block 2 'home-t-shirts' is correct
            in the Promo Block under header on the main page"
"passed","Fri Oct 27 01:22:08 GMT 2023","Fri Oct 27 01:22:10 GMT 2023","1759","tests","test_main_page","TestMainPage","","","test_tc_06_01_12_the_color_change_my_wish_and_add_to_compare_button[add_to_compare]","This test checks the color change of the add to wishlist button and add to compare button on hover"
"passed","Fri Oct 27 01:20:30 GMT 2023","Fri Oct 27 01:20:36 GMT 2023","5436","tests","test_header","TestHeader","","","TC 01.01.11 functionality of the ""My Wish List"" section in the dropdown list","Check the list appears with sections 'My Account', 'My Wish List', 'Sign Out' after clicking the button,        then clicking on 'My Wish List' redirects to the account page with the header 'My Wish List' displayed"
"passed","Fri Oct 27 01:21:18 GMT 2023","Fri Oct 27 01:21:21 GMT 2023","3044","tests","test_header","TestHeader","","","TC 01.03.12 correctness of the ""Bottoms"" link of the ""Women"" section","Check 'Bottoms' subsection link in 'Women' section click redirects to the Bottoms page and         the 'Bottoms' header is displayed"
"passed","Fri Oct 27 01:13:13 GMT 2023","Fri Oct 27 01:13:14 GMT 2023","1061","tests","test_footer","TestFooter","","","TC 02.01.37 - Check text of Copyright section on each page specified in DATA_1","Checks if text of Copyright section is correct on each page in DATA_1"
"passed","Fri Oct 27 01:30:12 GMT 2023","Fri Oct 27 01:30:14 GMT 2023","1509","tests","test_sale","TestSalePage","","","TC 10.01.03, 10.01.05, 10.01.07, 10.01.09, 10.01.11, 10.01.13 - Verify 6 links in Women's Deals open the correct pages","Check that six links in Women's Deals section lead to the correct pages after click"
"passed","Fri Oct 27 01:35:41 GMT 2023","Fri Oct 27 01:35:42 GMT 2023","1044","tests","test_sign_in","TestRegisteredCustomers","","","TC 03.01.12 Verify Password field highlighting on click","
        Check the Password field is activated with a cursor and gets highlighted when clicked
        "
"skipped","Fri Oct 27 01:36:35 GMT 2023","Fri Oct 27 01:36:35 GMT 2023","0","tests","test_sign_in","TestFailedLogin","","","TC 03.02.02 to 03_02_10 Verify Error on Failed Login with invalid credentials","Check error on Failed Login with invalid credentials, case-sensitive password and password with spaces"
"passed","Fri Oct 27 01:36:11 GMT 2023","Fri Oct 27 01:36:13 GMT 2023","1397","tests","test_sign_in","TestNewCustomers","","","TC 03.01.23 Verify Create an Account button is functional","Check if 'Create an Account' button link opens correct page"
"passed","Fri Oct 27 01:31:40 GMT 2023","Fri Oct 27 01:31:40 GMT 2023","439","tests","test_sale","TestSalePage","","","TC 10.04.08 - Verify the text in 2 columns block - Gear Deals","Check title-text and content-text in 2 columns block - Gear Deals"
"passed","Fri Oct 27 01:24:49 GMT 2023","Fri Oct 27 01:24:50 GMT 2023","1233","tests","test_main_page","TestMainPage","","","TC 13.01.39 - Check the display of the text in block 5 'home-eco' in the Promo Block","This test checks if the info block text in section 2 block 5 'home-eco' is correct
            in the Promo Block under header on the main page"
"passed","Fri Oct 27 01:33:01 GMT 2023","Fri Oct 27 01:33:05 GMT 2023","4471","tests","test_shopping_cart","TestShoppingCartFull","","","tc 07.02.08 Verify that 'Proceed to checkout' button redirects to the shipping page","Verify that the 'Proceed to checkout' button redirects to the shipping page."
"passed","Fri Oct 27 01:22:05 GMT 2023","Fri Oct 27 01:22:07 GMT 2023","1757","tests","test_main_page","TestMainPage","","","test_tc_06_01_12_the_color_change_my_wish_and_add_to_compare_button[add_to_wish_list]","This test checks the color change of the add to wishlist button and add to compare button on hover"
"passed","Fri Oct 27 01:13:10 GMT 2023","Fri Oct 27 01:13:11 GMT 2023","1160","tests","test_footer","TestFooter","","","TC 02.01.37 - Check text of Copyright section on each page specified in DATA_1","Checks if text of Copyright section is correct on each page in DATA_1"
"passed","Fri Oct 27 01:31:54 GMT 2023","Fri Oct 27 01:31:54 GMT 2023","136","tests","test_sale","TestSalePage","","","TC 10.04.10 - Verify that the sale-20-off contains an image","Check img existence of 1st column in 3-columns Promo Block section"
"passed","Fri Oct 27 01:37:06 GMT 2023","Fri Oct 27 01:37:06 GMT 2023","709","tests","test_training","TestMainPage","","","TC 16.02.05 Verify title Training is visible and contains text 'Top Videos'","Check Top Videos title has correct text and is visible"
"broken","Fri Oct 27 01:16:56 GMT 2023","Fri Oct 27 01:17:04 GMT 2023","8165","tests","test_forgot_your_password","TestForgotYourPasswordFunctionality","","","TC 17.01.26 Verify error on resetting My Password with empty captcha","Check error message on attempt to reset password with empty captcha input field"
"skipped","Fri Oct 27 01:22:43 GMT 2023","Fri Oct 27 01:22:55 GMT 2023","12299","tests","test_main_page","TestMainPage","","","Check the transition to the page my wish after clicking on the button. User is not authorized","
            This test will check that after clicking on the add to wishlist button,
            you are redirected to the My Wishlist page
            User is not authorized
            "
"passed","Fri Oct 27 01:12:31 GMT 2023","Fri Oct 27 01:12:32 GMT 2023","1120","tests","test_footer","TestFooter","","","TC 02.01.28 - Check Write for us link is present in the DOM tree on each page specified in DATA_1","Checks if Write for us link is present in the DOM tree on each page specified in DATA_1"
"skipped","Fri Oct 27 01:09:45 GMT 2023","Fri Oct 27 01:09:45 GMT 2023","0","tests","test_create_an_account","TestCreateAnAccount","","","test 04.02.01 create an account with correct data"," Verify that customer can Create An Account with correct data"
"passed","Fri Oct 27 01:31:56 GMT 2023","Fri Oct 27 01:31:56 GMT 2023","90","tests","test_sale","TestSalePage","","","TC 10.04.12 - Verify that the sale-free-shipping contains an image","Check img existence of 2nd column in 3-columns Promo Block section"
"passed","Fri Oct 27 01:09:38 GMT 2023","Fri Oct 27 01:09:39 GMT 2023","1145","tests","test_create_an_account","TestCreateAnAccount","","","TC 04_01_17 Verify Confirm Password input field highlighting on click"," Verify that Confirm Password input field highlighted when clicked"
"passed","Fri Oct 27 01:34:51 GMT 2023","Fri Oct 27 01:34:55 GMT 2023","4320","tests","test_shopping_cart","TestShoppingCartFull","","","TC 07.02.27 Verify that the list of items in the Shopping Cart is displayed correct","Check that the list of items in the Shopping Cart contains title item which was added from More Choices"
"passed","Fri Oct 27 01:09:42 GMT 2023","Fri Oct 27 01:09:45 GMT 2023","3238","tests","test_create_an_account","TestCreateAnAccount","","","test 04.02.08 create an account with registered email"," Verify that customer can't Create An Account with registered email before "
"passed","Fri Oct 27 01:30:59 GMT 2023","Fri Oct 27 01:31:00 GMT 2023","1457","tests","test_sale","TestSalePage","","","TC 10.02.03, 10.02.05, 10.02.07, 10.02.09, 10.02.11 - Verify 5 links in Men's Deals open the correct pages","Check that five links in Men's Deals section lead to the correct pages after click"
"passed","Fri Oct 27 01:20:37 GMT 2023","Fri Oct 27 01:20:43 GMT 2023","5536","tests","test_header","TestHeader","","","TC 01.01.12 functionality of the ""Sign In"" section in the dropdown list","Check the list appears with sections 'My Account', 'My Wish List', 'Sign Out' after clicking the button,        then clicking on 'Sign Out' redirects to the account page with the header 'You are signed out' displayed         and redirected to the Main Page after 5 seconds"
"passed","Fri Oct 27 01:24:18 GMT 2023","Fri Oct 27 01:24:19 GMT 2023","1198","tests","test_main_page","TestMainPage","","","TC 13.01.30 - Check the display of the sign in block 3 'home-erin' in the Promo Block","This test checks if the sign in info block in section 2 block 3 'home-erin' is correct
            in the Promo Block under header on the main page"
"passed","Fri Oct 27 01:35:20 GMT 2023","Fri Oct 27 01:35:21 GMT 2023","306","tests","test_sign_in","TestRegisteredCustomers","","","TC 03.01.05 Verify Email field is correct format and clickable","Check if the Email input is of correct format (input-text) and clickable"
"passed","Fri Oct 27 01:30:44 GMT 2023","Fri Oct 27 01:30:44 GMT 2023","251","tests","test_sale","TestSalePage","","","TC 10.02.02, 10.02.04, 10.02.06, 10.02.08, 10.02.10 - Verify 5 links in Men's Deals section are visible and clickable","Check that five elements in Men's Deals section are displayed and enabled"
"passed","Fri Oct 27 01:13:20 GMT 2023","Fri Oct 27 01:13:21 GMT 2023","1377","tests","test_footer","TestFooter","","","TC 02.01.53 - Check 'Subscribe to our mailing list' link is visible on each page specified in DATA_1","Checks if 'Subscribe to our mailing list' link is visible on each page specified in DATA_1"
"passed","Fri Oct 27 01:20:24 GMT 2023","Fri Oct 27 01:20:29 GMT 2023","5425","tests","test_header","TestHeader","","","TC 01.01.10 functionality of the ""My account"" section in the dropdown list","Check the list appears with sections 'My Account', 'My Wish List', 'Sign Out' after clicking the button,        then clicking on 'My Account' redirects to the account page with the header 'My Account' displayed"
"passed","Fri Oct 27 01:30:32 GMT 2023","Fri Oct 27 01:30:33 GMT 2023","1439","tests","test_sale","TestSalePage","","","TC 10.01.03, 10.01.05, 10.01.07, 10.01.09, 10.01.11, 10.01.13 - Verify 6 links in Women's Deals open the correct pages","Check that six links in Women's Deals section lead to the correct pages after click"
"passed","Fri Oct 27 01:27:07 GMT 2023","Fri Oct 27 01:27:09 GMT 2023","1250","tests","test_men","TestMenPagePromoBlock","","","TC 14.06.10 Verify the visibility of the image in the 'Save up to $24!' promo block.","Verify that the image in the block 'Save up to $24!' is displayed on the Men page"
"passed","Fri Oct 27 01:25:11 GMT 2023","Fri Oct 27 01:25:13 GMT 2023","1162","tests","test_main_page","TestMainPage","","","TC 13.01.48 - Check block 5 'home-eco' in section 2 of the Promo Block is present in the DOM tree","This test checks if block 5 'home-eco' in section 2 in the Promo Block is present
            in the DOM tree on the main page"
"passed","Fri Oct 27 01:23:54 GMT 2023","Fri Oct 27 01:23:56 GMT 2023","1515","tests","test_main_page","TestMainPage","","","TC 13.01.22 - Check the display of the info block in block 2 't-shirts' in the Promo Block","This test checks if info block in section 2 block 2 'home-t-shirts' is displayed
            in the Promo Block under header on the main page"
"passed","Fri Oct 27 01:13:15 GMT 2023","Fri Oct 27 01:13:16 GMT 2023","1059","tests","test_footer","TestFooter","","","TC 02.01.52 - Check 'Subscribe to our mailing list' link is present in the DOM tree on each page specified in DATA_1","Checks if 'Subscribe to our mailing list' link is present in the DOM tree on each page
        specified in DATA_1"
"passed","Fri Oct 27 01:09:24 GMT 2023","Fri Oct 27 01:09:25 GMT 2023","1206","tests","test_create_an_account","TestCreateAnAccount","","","TC 04_01_13 Verify presence of Password label and the required asterisk"," Verify presence of Password label and the required asterisk "
"passed","Fri Oct 27 01:19:58 GMT 2023","Fri Oct 27 01:20:01 GMT 2023","3248","tests","test_header","TestHeader","","","TC 01.03.18 correctness of the ""Tops"" link of the ""Men"" section","Check 'Tops' subsection link click in 'Men' section redirects to the Tops-men page and         the 'Tops' header is displayed"
"passed","Fri Oct 27 01:35:09 GMT 2023","Fri Oct 27 01:35:09 GMT 2023","342","tests","test_sign_in","TestRegisteredCustomers","","","TC 03.01.01 Verify Sign In Page h1 Header","Check Login Page Heading is present "
"passed","Fri Oct 27 01:20:48 GMT 2023","Fri Oct 27 01:20:51 GMT 2023","3120","tests","test_header","TestHeader","","","TC 01.03.06 correctness of the ""Tops"" link of the ""Women"" section","Check 'Tops' subsection link click in 'Women' section redirects to the Tops-women page and         the 'Tops' header is displayed"
