"Status","Start Time","Stop Time","Duration in ms","Parent Suite","Suite","Sub Suite","Test Class","Test Method","Name","Description"
"passed","Fri Oct 27 01:12:12 GMT 2023","Fri Oct 27 01:12:14 GMT 2023","1339","tests","test_footer","TestFooter","","","TC 02.01.24 - Check display of 'Contact us' link on each page specified in DATA_1","Checks if 'Contact us' link is visible on each page in DATA_1"
"passed","Fri Oct 27 01:33:33 GMT 2023","Fri Oct 27 01:33:43 GMT 2023","10133","tests","test_shopping_cart","TestShoppingCartFull","","","tc 07.02.23 Verify Order Total in Summury displayed correctly.","Verify Order Total in Summary: Order Total = Subtotal - Discount + Tax and displayed correctly."
"passed","Fri Oct 27 01:25:09 GMT 2023","Fri Oct 27 01:25:10 GMT 2023","1131","tests","test_main_page","TestMainPage","","","TC 13.01.47 - Check block 4 'home-performance' in section 2 of the Promo Block is present in the DOM tree","This test checks if block 4 'home-performance' in section 2 in the Promo Block is present
            in the DOM tree on the main page"
"passed","Fri Oct 27 01:25:28 GMT 2023","Fri Oct 27 01:25:29 GMT 2023","1360","tests","test_main_page","TestMainPage","","","TC 13.01.54 - Check if block 5 'home-eco' in section 2 is clickablein the Promo Block on the main page","This test checks if block 5 'home-eco' in section 2 in Promo Block under header is clickable"
"passed","Fri Oct 27 01:28:06 GMT 2023","Fri Oct 27 01:28:08 GMT 2023","1719","tests","test_men","TestMenPagePromoBlock","","","TC 14.06.30 Verify that the 'Grab a tee or two!' text is visible.","Verify that text-2 in 'Luma tees' block correctly displayed"
"passed","Fri Oct 27 01:27:43 GMT 2023","Fri Oct 27 01:27:44 GMT 2023","1512","tests","test_men","TestMenPagePromoBlock","","","TC 14.06.22 Verify the visibility of the image in the 'Luma shorts' promo block.","Verify that the image in the block 'Luma shorts' is displayed on the Men page"
"passed","Fri Oct 27 01:12:54 GMT 2023","Fri Oct 27 01:12:56 GMT 2023","1573","tests","test_footer","TestFooter","","","TC 02.01.34 - Check display of Copyright section on each page specified in DATA_1","Checks if Copyright section is visible on each page in DATA_1"
"passed","Fri Oct 27 01:25:01 GMT 2023","Fri Oct 27 01:25:03 GMT 2023","1131","tests","test_main_page","TestMainPage","","","TC 13.01.44 - Check block 1 'home-pants' in section 2 of the Promo Block is present in the DOM tree","This test checks if block 1 'home-pants' in section 2 in the Promo Block is present
            in the DOM tree on the main page"
"passed","Fri Oct 27 01:10:26 GMT 2023","Fri Oct 27 01:10:27 GMT 2023","884","tests","test_create_an_account","TestCreateAnAccount","","","TC 04_02_09_13 Verify presence of strong password strength hint"," Verify presence of Password Strength hint and warning color of weak password "
"passed","Fri Oct 27 01:12:57 GMT 2023","Fri Oct 27 01:12:59 GMT 2023","1546","tests","test_footer","TestFooter","","","TC 02.01.34 - Check display of Copyright section on each page specified in DATA_1","Checks if Copyright section is visible on each page in DATA_1"
"passed","Fri Oct 27 01:35:48 GMT 2023","Fri Oct 27 01:35:48 GMT 2023","339","tests","test_sign_in","TestRegisteredCustomers","","","TC 03.01.14 Verify Sign in button is present",""
"skipped","Fri Oct 27 01:13:14 GMT 2023","Fri Oct 27 01:13:14 GMT 2023","0","tests","test_footer","TestFooter","","","TC 02.01.46 - Check text on Subscribe Button on each page specified in DATA_1","Checks if text on Subscribe Button is correct on each page in DATA_1"
"passed","Fri Oct 27 01:24:00 GMT 2023","Fri Oct 27 01:24:01 GMT 2023","1310","tests","test_main_page","TestMainPage","","","TC 13.01.24 - Check the display of the text in block 2 'home-t-shirts' in the Promo Block","This test checks if the info block text in section 2 block 2 'home-t-shirts' is correct
            in the Promo Block under header on the main page"
"passed","Fri Oct 27 01:12:52 GMT 2023","Fri Oct 27 01:12:53 GMT 2023","1055","tests","test_footer","TestFooter","","","TC 02.01.33 - Check Copyright section is present in the DOM tree on each page specified in DATA_1","Checks if Copyright section is present in the DOM tree on each page specified in DATA_1"
"passed","Fri Oct 27 01:10:50 GMT 2023","Fri Oct 27 01:10:52 GMT 2023","1386","tests","test_footer","TestFooter","","","TC 02.01.05 - Check if Search Terms link is clickable on each page specified in DATA_1","This test checks if Search Terms link is clickable on each page specified in DATA_1"
"passed","Fri Oct 27 01:24:46 GMT 2023","Fri Oct 27 01:24:48 GMT 2023","1140","tests","test_main_page","TestMainPage","","","TC 13.01.38 - Check the display of the title in block 5 'home-eco' in the Promo Block","This test checks if the info block title in section 2 block 5 'home-eco' is correct
            in the Promo Block under header on the main page"
"passed","Fri Oct 27 01:23:35 GMT 2023","Fri Oct 27 01:23:36 GMT 2023","1117","tests","test_main_page","TestMainPage","","","TC 13.01.16 - Check correctness of the image in block 1 'home-pants' in the Promo Block","This test checks if the image in section 2 block 1 'home-pants' is correct"
"passed","Fri Oct 27 01:23:49 GMT 2023","Fri Oct 27 01:23:50 GMT 2023","1069","tests","test_main_page","TestMainPage","","","TC 13.01.21 - Check the display of an image in block 2 'home-t-shirts' in the Promo Block","This test checks if the image in section 2 block 2 'home-t-shirts' is visible"
"broken","Fri Oct 27 01:17:07 GMT 2023","Fri Oct 27 01:17:13 GMT 2023","5791","tests","test_forgot_your_password","TestForgotYourPasswordFunctionality","","","TC 17.01.27 Verify all fields got cleared after the failed attempt to reset password","Check if all the fields are getting cleared after failed attempt to reset password with invalid captcha"
"skipped","Fri Oct 27 01:13:14 GMT 2023","Fri Oct 27 01:13:14 GMT 2023","0","tests","test_footer","TestFooter","","","TC 02.01.47 - Check Email field in Subscribe section is present in the DOM tree on each page specified in DATA_1","Checks if Email field in Subscribe section is present in the DOM tree on each page specified in DATA_1"
"passed","Fri Oct 27 01:10:59 GMT 2023","Fri Oct 27 01:11:00 GMT 2023","1267","tests","test_footer","TestFooter","","","TC 02.01.07 - Check text of Search Terms link on each page specified in DATA_1","Checks if text of Search Terms link is correct on each page in DATA_1"
"passed","Fri Oct 27 01:17:46 GMT 2023","Fri Oct 27 01:17:48 GMT 2023","1629","tests","test_header","TestHeader","","","TC 01.01.04 display and interactivity of the ""Sign In"" link","Check 'Sign In' link is displayed and underlined"
"skipped","Fri Oct 27 01:13:14 GMT 2023","Fri Oct 27 01:13:14 GMT 2023","0","tests","test_footer","TestFooter","","","TC 02.01.42 - Check if Subscribe Button is clickable on each page specified in DATA_1","This test checks if Subscribe Button is clickable on each page specified in DATA_1"
"skipped","Fri Oct 27 01:36:35 GMT 2023","Fri Oct 27 01:36:35 GMT 2023","0","tests","test_sign_in","TestFailedLogin","","","TC 03.02.02 to 03_02_10 Verify Error on Failed Login with invalid credentials","Check error on Failed Login with invalid credentials, case-sensitive password and password with spaces"
"passed","Fri Oct 27 01:18:13 GMT 2023","Fri Oct 27 01:18:15 GMT 2023","2014","tests","test_header","TestHeader","","","TC 01.03.35 visible and interactive the link ""Sale""","Verify the link 'Sale' is visible and interactive"
"passed","Fri Oct 27 01:10:03 GMT 2023","Fri Oct 27 01:10:04 GMT 2023","1244","tests","test_create_an_account","TestCreateAnAccount","","","test 04.02.06 create an account with empty confirm password"," Verify that customer can't Create An Account with empty confirm password"
"passed","Fri Oct 27 01:23:52 GMT 2023","Fri Oct 27 01:23:53 GMT 2023","1312","tests","test_main_page","TestMainPage","","","TC 13.01.21_01 - Check correctness of the image in block 2 'home-t-shirts' in the Promo Block","This test checks if the image in section 2 block 2 'home-t-shirts' is correct"
"passed","Fri Oct 27 01:36:48 GMT 2023","Fri Oct 27 01:36:48 GMT 2023","364","tests","test_training","TestMainPage","","","TC 16.01.05 Verify Sidebar panel title Compare Products is visible and contains text 'Compare Products'","Check Sidebar Category title has correct text and is visible"
"broken","Fri Oct 27 01:16:11 GMT 2023","Fri Oct 27 01:16:16 GMT 2023","5206","tests","test_forgot_your_password","TestForgotYourPassword","","","TC 17.01.16 Verify click Reload captcha button generates a new captcha image","
        Check that the 'Reload captcha' button generates a new captcha image
        and ensure the new image source is different from the original image source
        "
"passed","Fri Oct 27 01:14:19 GMT 2023","Fri Oct 27 01:14:23 GMT 2023","4034","tests","test_footer","TestFooter","","","TC 02.02.06 - Check Write for us link in footer leads to the correct page from each page specified in DATA_1","Check that Write for us link in footer is correct"
"passed","Fri Oct 27 01:27:46 GMT 2023","Fri Oct 27 01:27:47 GMT 2023","1361","tests","test_men","TestMenPagePromoBlock","","","TC 14.06.23 Verify that the 'Luma shorts' text is visible.","Verify that text-1 in 'Luma shorts' block correctly displayed"
"passed","Fri Oct 27 01:11:25 GMT 2023","Fri Oct 27 01:11:27 GMT 2023","1123","tests","test_footer","TestFooter","","","TC 02.01.13 - Check Advanced Search link is present in the DOM tree on each page specified in DATA_1","Checks if Advanced Search link is present in the DOM tree on each page specified in DATA_1"
"passed","Fri Oct 27 01:35:57 GMT 2023","Fri Oct 27 01:35:58 GMT 2023","758","tests","test_sign_in","TestRegisteredCustomers","","","TC 03.01.18 Verify Email field for correct email format","Check error message for incorrect email format in email field"
"passed","Fri Oct 27 01:18:35 GMT 2023","Fri Oct 27 01:18:36 GMT 2023","914","tests","test_header","TestHeader","","","TC 01.03.03 display and interactivity of the ""Women"" section","Verify that the section Women in the header is visible and interactive"
"passed","Fri Oct 27 01:19:28 GMT 2023","Fri Oct 27 01:19:31 GMT 2023","2700","tests","test_header","TestHeader","","","TC 01.03.16 correctness of the ""Men"" section link","Check the 'Men' section click redirects to the Men page and the 'Men' header is displayed"
"passed","Fri Oct 27 01:22:02 GMT 2023","Fri Oct 27 01:22:04 GMT 2023","1795","tests","test_main_page","TestMainPage","","","test_tc_06_01_10_check_the_cursor_change_to_cart_button[add_to_compare]","This test check the cursor change when hovering over the cart buttons"
"passed","Fri Oct 27 01:19:02 GMT 2023","Fri Oct 27 01:19:06 GMT 2023","4098","tests","test_header","TestHeader","","","TC 01.03.26 correctness ""Shorts"" link","Check 'Shorts' subsection link in 'Men' section click redirects to the Shorts page and             the 'Shorts' header is displayed"
"passed","Fri Oct 27 01:32:15 GMT 2023","Fri Oct 27 01:32:17 GMT 2023","2289","tests","test_shopping_cart","TestShoppingCart","","","tc 07.01.04 Verify that here link leads to the main page","Verify that the link ""here"" redirects to the main page."
"passed","Fri Oct 27 01:11:12 GMT 2023","Fri Oct 27 01:11:14 GMT 2023","1435","tests","test_footer","TestFooter","","","TC 02.01.09 - Check display of Privacy and Cookie Policy link on each page specified in DATA_1","Checks if Privacy and Cookie Policy link is visible on each page in DATA_1"
"passed","Fri Oct 27 01:19:11 GMT 2023","Fri Oct 27 01:19:13 GMT 2023","2640","tests","test_header","TestHeader","","","TC 01.03.28 correctly redirected the link ""Gear""","Verify the link 'Gear' redirected to the page and the 'Gear' header is displayed"
"passed","Fri Oct 27 01:19:15 GMT 2023","Fri Oct 27 01:19:18 GMT 2023","2959","tests","test_header","TestHeader","","","TC 01.03.29 correctly redirected the link ""Gear - Bags""","Verify the link 'Bags' redirected to the page and the 'Bags' header is displayed"
"broken","Fri Oct 27 01:15:15 GMT 2023","Fri Oct 27 01:15:20 GMT 2023","5211","tests","test_forgot_your_password","TestForgotYourPassword","","","TC 17.01.09 Verify FYP captcha input field is present","Check if the captcha input field is present"
"passed","Fri Oct 27 01:24:08 GMT 2023","Fri Oct 27 01:24:09 GMT 2023","1180","tests","test_main_page","TestMainPage","","","TC 13.01.26_01 - Check correctness of the image in block 3 'home-erin' in the Promo Block","This test checks if the image in section 2 block 3 'home-erin' is correct"
"passed","Fri Oct 27 01:13:43 GMT 2023","Fri Oct 27 01:13:46 GMT 2023","2676","tests","test_footer","TestFooter","","","TC 02.02.02 - Check Privacy and Cookie Policy link in footer leads to the correct page from each page specified in DATA_1","Check that Privacy and Cookie Policy link in footer is correct"
"passed","Fri Oct 27 01:26:44 GMT 2023","Fri Oct 27 01:26:45 GMT 2023","1511","tests","test_men","TestMenPage","","","TC 14.04.01 Verify the 'BOTTOMS' subhead is displayed","Verify that the subhead 'BOTTOMS' is displayed"
"passed","Fri Oct 27 01:34:18 GMT 2023","Fri Oct 27 01:34:19 GMT 2023","446","tests","test_shopping_cart","TestShoppingCartFull","","","test_tc_07_02_02_Verify_table_headers_in_item_cart_are_visible[t_header3]","Check that table headers in item cart are visible"
"passed","Fri Oct 27 01:28:01 GMT 2023","Fri Oct 27 01:28:02 GMT 2023","1524","tests","test_men","TestMenPagePromoBlock","","","TC 14.06.28 Verify the visibility of the image in the 'Luma tees' promo block.","Verify that the image in the block 'Luma tees' is displayed on the Men page"
"passed","Fri Oct 27 01:27:10 GMT 2023","Fri Oct 27 01:27:12 GMT 2023","1450","tests","test_men","TestMenPagePromoBlock","","","TC 14.06.11 Verify that the 'Save up to $24!' text in the 'Save up to $24!' promo block is visible.","Verify that text-1 in 'Save up to $24!' block correctly displayed"
"passed","Fri Oct 27 01:37:47 GMT 2023","Fri Oct 27 01:37:49 GMT 2023","1497","tests","test_women","TestWomenPage","","","TC 12.05.01/02/03/04 Check the Sidebar text is visible","Check if items are visible"
"passed","Fri Oct 27 01:28:56 GMT 2023","Fri Oct 27 01:29:09 GMT 2023","13048","tests","test_reviews_page","TestReviews","","","test_tc_01_15_02_check_that_it_is_possible_to_vote_for_2_star","
        The user is NOT logged in, located in the product card, section ""Reviews""
        1. All required fields are filled with correct data
        2. Pressed 2 star
        3.The ""Submit Review"" button is pressed
        Result: Present in the DOM and visible on the page the message: ""You submitted your review for moderation.
        This code works when run on Win, Mac, Ubuntu on a real laptop and has the features of working on GitHub Action.
        When interacting with the GitHub Action, it checks not for the text of the ""Success"" message, but for the ""Success"" URL""
        "
"passed","Fri Oct 27 01:29:54 GMT 2023","Fri Oct 27 01:29:55 GMT 2023","313","tests","test_sale","TestSalePage","","","TC 10.01.01 - Verify 'WOMEN'S DEALS' title is correct","Check title of Women's Deals section"
"passed","Fri Oct 27 01:36:20 GMT 2023","Fri Oct 27 01:36:21 GMT 2023","939","tests","test_sign_in","TestLogin","","","TC 03.02.04 Verify error on attempting to log in with empty email - Negative","Check error message on attempt to log in with empty email"
"skipped","Fri Oct 27 01:36:35 GMT 2023","Fri Oct 27 01:36:35 GMT 2023","0","tests","test_sign_in","TestFailedLogin","","","TC 03.02.02 to 03_02_10 Verify Error on Failed Login with invalid credentials","Check error on Failed Login with invalid credentials, case-sensitive password and password with spaces"
"passed","Fri Oct 27 01:36:45 GMT 2023","Fri Oct 27 01:36:46 GMT 2023","351","tests","test_training","TestMainPage","","","TC 16.01.04 Verify Sidebar panel title Video Download contains URL","Check Sidebar Video Download contains URL"
"passed","Fri Oct 27 01:26:32 GMT 2023","Fri Oct 27 01:26:35 GMT 2023","2732","tests","test_men","TestMenPage","","","TC 14.03.07 Verify the link 'Tees' redirects to a correct page.","Verify that the link 'Tees' correctly opens and redirects to a new webpage, the header 'Tees' is
        displayed"
"passed","Fri Oct 27 01:36:00 GMT 2023","Fri Oct 27 01:36:00 GMT 2023","229","tests","test_sign_in","TestNewCustomers","","","TC 03.01.19 Verify New Customers Heading","Check New Customers Heading is present "
"passed","Fri Oct 27 01:31:07 GMT 2023","Fri Oct 27 01:31:09 GMT 2023","2053","tests","test_sale","TestSalePage","","","TC 10.02.03, 10.02.05, 10.02.07, 10.02.09, 10.02.11 - Verify 5 links in Men's Deals open the correct pages","Check that five links in Men's Deals section lead to the correct pages after click"
"passed","Fri Oct 27 01:14:07 GMT 2023","Fri Oct 27 01:14:13 GMT 2023","6488","tests","test_footer","TestFooter","","","TC 02.02.05 - Check Contact Us link in footer leads to the correct page from each page specified in DATA_1","Check that Contact Us link in footer is correct"
"passed","Fri Oct 27 01:31:34 GMT 2023","Fri Oct 27 01:31:35 GMT 2023","534","tests","test_sale","TestSalePage","","","TC 10.04.02 - Verify the text in main block - Women's Deals","Check title-text and content-text in main block - Women's Deals"
"passed","Fri Oct 27 01:18:16 GMT 2023","Fri Oct 27 01:18:22 GMT 2023","5451","tests","test_header","TestHeader","","","TC 01.03.33 correctly redirected the link ""Training""","Verify 'Training' link click redirected to the page and the 'Training' header is displayed"
"passed","Fri Oct 27 01:37:12 GMT 2023","Fri Oct 27 01:37:13 GMT 2023","706","tests","test_training","TestMainPage","","","TC 16.02.07 Check the cursor change to block training erin","This test check the cursor change when hovering over the block training erin"
"passed","Fri Oct 27 01:09:59 GMT 2023","Fri Oct 27 01:10:00 GMT 2023","1291","tests","test_create_an_account","TestCreateAnAccount","","","test 04.02.05 create an account with empty password"," Verify that customer can't Create An Account with empty password"
"passed","Fri Oct 27 01:31:19 GMT 2023","Fri Oct 27 01:31:20 GMT 2023","1250","tests","test_sale","TestSalePage","","","TC 10.03.03, 10.03.05 - Verify 2 links in Gear Deals open the correct pages","Check that two links in Gear Deals section lead to the correct pages after click"
"passed","Fri Oct 27 01:10:37 GMT 2023","Fri Oct 27 01:10:38 GMT 2023","1429","tests","test_footer","TestFooter","","","TC 02.01.02 - Check Footer display on each page specified in DATA_1","Checks if Footer is visible on each page specified in DATA_1"
"passed","Fri Oct 27 01:32:23 GMT 2023","Fri Oct 27 01:32:25 GMT 2023","1709","tests","test_shopping_cart","TestShoppingCartFull","","","tc 07.02.01 Verify that title Shopping Cart is displayed correctly when it is full","Check Shopping Cart title is displayed correctly"
"passed","Fri Oct 27 01:10:47 GMT 2023","Fri Oct 27 01:10:49 GMT 2023","1365","tests","test_footer","TestFooter","","","TC 02.01.04 - Check display of Search Terms link on each page specified in DATA_1","Checks if Search Terms link is visible on each page in DATA_1"
"skipped","Fri Oct 27 01:36:35 GMT 2023","Fri Oct 27 01:36:35 GMT 2023","0","tests","test_sign_in","TestFailedLogin","","","TC 03.02.01 to 03_02_10 Verify and Failed Login, no error validation","Check Success and Failed Login, no error validation"
"passed","Fri Oct 27 01:11:39 GMT 2023","Fri Oct 27 01:11:40 GMT 2023","1300","tests","test_footer","TestFooter","","","TC 02.01.15 - Check if Advanced Search link is clickable on each page specified in DATA_1","This test checks if Advanced Search link is clickable on each page specified in DATA_1"
"passed","Fri Oct 27 01:25:47 GMT 2023","Fri Oct 27 01:25:50 GMT 2023","2741","tests","test_main_page","TestMainPage","","","TC 13.02.05 - Check the link in section 2 block 4 'home-performance' in the Promo Block leads to the correct page","Check that link in section 2 block 4 'home-performance' is correct"
"skipped","Fri Oct 27 01:13:14 GMT 2023","Fri Oct 27 01:13:14 GMT 2023","0","tests","test_footer","TestFooter","","","TC 02.01.44 - Check text on Subscribe Button is present in the DOM tree on each page specified in DATA_1","Checks if text on Subscribe Button is present in the DOM tree on each page specified in DATA_1"
"passed","Fri Oct 27 01:36:15 GMT 2023","Fri Oct 27 01:36:18 GMT 2023","2527","tests","test_sign_in","TestLogin","","","TC 03.02.01 Verify login with valid email valid password - Positive","Check Success Login with correct credentials"
"skipped","Fri Oct 27 01:13:14 GMT 2023","Fri Oct 27 01:13:14 GMT 2023","0","tests","test_footer","TestFooter","","","TC 02.01.45 - Check display of text on Subscribe Button on each page specified in DATA_1","Checks if text on Subscribe Button is visible on each page in DATA_1"
"passed","Fri Oct 27 01:36:43 GMT 2023","Fri Oct 27 01:36:43 GMT 2023","424","tests","test_training","TestMainPage","","","TC 16.01.03 Verify Sidebar title Video Download is visible and contains text 'Video Download'","Check Sidebar Video Download title has correct text and is visible"
"passed","Fri Oct 27 01:25:19 GMT 2023","Fri Oct 27 01:25:21 GMT 2023","1381","tests","test_main_page","TestMainPage","","","TC 13.01.51 - Check if block 2 'home-t-shirts' in section 2 is clickablein the Promo Block on the main page","This test checks if block 2 'home-t-shirts' in section 2 in Promo Block under header is clickable"
"skipped","Fri Oct 27 01:36:35 GMT 2023","Fri Oct 27 01:36:35 GMT 2023","0","tests","test_sign_in","TestFailedLogin","","","TC 03.02.01 to 03_02_10 Verify and Failed Login, no error validation","Check Success and Failed Login, no error validation"
"passed","Fri Oct 27 01:35:36 GMT 2023","Fri Oct 27 01:35:36 GMT 2023","283","tests","test_sign_in","TestRegisteredCustomers","","","TC 03.01.10 Verify Password field is correct format and clickable","Check if the password input field is of correct format (input-text) and clickable"
"passed","Fri Oct 27 01:36:51 GMT 2023","Fri Oct 27 01:36:51 GMT 2023","403","tests","test_training","TestMainPage","","","TC 16.01.06 Verify Sidebar panel title My Wish List is visible and contains text 'My Wish List'","Check Sidebar Category title has correct text and is visible"
"passed","Fri Oct 27 01:18:45 GMT 2023","Fri Oct 27 01:18:47 GMT 2023","2105","tests","test_header","TestHeader","","","TC 01.03.27 visible and interactive the link ""Gear""","Verify the link 'Gear' is visible and interactive"
"broken","Fri Oct 27 01:16:19 GMT 2023","Fri Oct 27 01:16:24 GMT 2023","5161","tests","test_forgot_your_password","TestForgotYourPassword","","","TC 17.01.17 Verify captcha image is present by default","Check that the captcha image is present by default"
"passed","Fri Oct 27 01:28:35 GMT 2023","Fri Oct 27 01:28:35 GMT 2023","251","tests","test_orders_and_returns","TestOrdersAndReturnsPage","","","TC 05.01.01 - Verify that 'Order and Returns' Page Heading is present","This test checks ""Orders and Returns"" header is visible and has correct text"
"passed","Fri Oct 27 01:29:11 GMT 2023","Fri Oct 27 01:29:24 GMT 2023","12899","tests","test_reviews_page","TestReviews","","","test_tc_01_15_03_check_that_it_is_possible_to_vote_for_3_star","
        The user is NOT logged in, located in the product card, section ""Reviews""
        1. All required fields are filled with correct data
        2. Pressed 3 star
        3.The ""Submit Review"" button is pressed
        Result: Present in the DOM and visible on the page the message: ""You submitted your review for moderation.
        This code works when run on Win, Mac, Ubuntu on a real laptop and has the features of working on GitHub Action.
        When interacting with the GitHub Action, it checks not for the text of the ""Success"" message, but for the ""Success"" URL""
        "
"passed","Fri Oct 27 01:13:28 GMT 2023","Fri Oct 27 01:13:29 GMT 2023","1280","tests","test_footer","TestFooter","","","TC 02.01.54 - Check if 'Subscribe to our mailing list' link is clickable on each page specified in DATA_1","This test checks if 'Subscribe to our mailing list' link is clickable on each page specified in DATA_1"
"passed","Fri Oct 27 01:10:32 GMT 2023","Fri Oct 27 01:10:33 GMT 2023","1114","tests","test_footer","TestFooter","","","TC 02.01.01 - Check Footer is present in the DOM tree on each page specified in DATA_1","Checks if the footer is present in the DOM tree on each page specified in DATA_1"
"skipped","Fri Oct 27 01:36:35 GMT 2023","Fri Oct 27 01:36:35 GMT 2023","0","tests","test_sign_in","TestFailedLogin","","","TC 03.02.02 to 03_02_10 Verify Error on Failed Login with invalid credentials","Check error on Failed Login with invalid credentials, case-sensitive password and password with spaces"
"passed","Fri Oct 27 01:17:56 GMT 2023","Fri Oct 27 01:17:59 GMT 2023","2553","tests","test_header","TestHeader","","","TC 01.03.36 correctly redirected the link sale","Verify 'Sale' link click redirected to the page and the 'Sale' header is displayed"
"passed","Fri Oct 27 01:23:29 GMT 2023","Fri Oct 27 01:23:30 GMT 2023","1402","tests","test_main_page","TestMainPage","","","TC 13.01.14 - Check display of block 5 'home-eco' in section 2 in the Promo Block","This test checks if block 5 'home-eco' is displayed in section 2
            of Promo Block under header on the main page"
"passed","Fri Oct 27 01:23:18 GMT 2023","Fri Oct 27 01:23:19 GMT 2023","1305","tests","test_main_page","TestMainPage","","","TC 13.01.10 - Check display of block 1 'home-pants' in section 2 in the Promo Block","This test checks if block 1 'home-pants' is displayed in section 2 of Promo Block under header
            on the Main Page"
"passed","Fri Oct 27 01:33:49 GMT 2023","Fri Oct 27 01:33:52 GMT 2023","2168","tests","test_shopping_cart","TestShoppingCartFull","","","tc 07.02.10 Verify that remove button deletes item from the shipping page","Check that remove button deletes item from the shipping page"
